GWNO	EVENT_ID_CNTY	EVENT_ID_NO_CNTY	EVENT_DATE	YEAR	MONTH	DAY	TIME_PRECISION	Event Type	Actor	ALLY_ACTOR_1	INTER1	ACTOR2	ALLY_ACTOR_2	INTER2	INTERACTION	COUNTRY	ADMIN1	ADMIN2	ADMIN3	LOCATION	LATITUDE	LONGITUDE	GEO_PRECIS	SOURCE	Notes	Fatalities651	1EGY	21779	03/01/1997	1997	1	3	1	Battle-No change of territory	Police Forces of Egypt (1981-2011)		1	Al-Gama'a al-Islamiyya 		2	12	Egypt	Menia	Kesm Al-minya		Minya	28.10988	30.75030	1	Reuters	Egyptian police shot dead a suspected Islamist militant in an exchange of fire in the southern countryside on Friday.	1651	3EGY	21781	06/01/1997	1997	1	6	1	Violence against civilians	Al-Gama'a al-Islamiyya 		2	Civilians (Egypt)		7	27	Egypt	North Sinai	Bir Al-Abd		"Mahari, Hod el"	30.98330	32.83330	1	Reuters	A farmer was killed in his fields during a shootout between police and suspected Moslem militants in southern Egypt.	1651	2EGY	21780	06/01/1997	1997	1	6	1	Battle-No change of territory	Police Forces of Egypt (1981-2011)		1	Al-Gama'a al-Islamiyya 		2	12	Egypt	North Sinai	Bir Al-Abd		"Mahari, Hod el"	30.98330	32.83330	1	Reuters	Shootout between police and suspected Moslem militants in southern Egypt on Monday	0651	4EGY	21782	25/01/1997	1997	1	25	1	Battle-No change of territory	Police Forces of Egypt (1981-2011)		1	Al-Gama'a al-Islamiyya 		2	12	Egypt	Menia	Kesm Al-minya		Minya	28.10988	30.75030	1	Reuters	Police shot dead three suspected Moslem militants on Saturday after a four-hour gun battle near Sheikh Saleh Basha village in the Minya province in southern Egypt.	3651	5EGY	21783	27/01/1997	1997	1	27	1	Violence against civilians	Al-Gama'a al-Islamiyya 		2	Civilians (Egypt)		7	27	Egypt	Menia	Markz Mallawi		El Ashmunein	27.77560	30.80330	1	Reuters	Suspected Moslem militants shot dead a retired police major general in the southern Egyptian town of Ashmouneen on Monday to avenge comrades killed by police at the weekend.	1651	6EGY	21784	12/02/1997	1997	2	12	1	Violence against civilians	Al-Gama'a al-Islamiyya 		2	Civilians (Egypt)	Christian Group (Egypt)	7	27	Egypt	Menia	Markz Abu Qurqas		Abu Qurqas	27.93080	30.83640	1	Reuters	Gunmen stormed the church on Wednesday evening near the town of Abu Qurqas in Minya province 240 km (150 miles) south of Cairo and sprayed bullets into a youth meeting.	10651	7EGY	21785	20/02/1997	1997	2	20	1	Battle-No change of territory	Police Forces of Egypt (1981-2011)		1	Al-Gama'a al-Islamiyya 		2	12	Egypt	Menia	Markz Mallawi		El Ashmunein	27.77560	30.80330	1	Reuters	Three people were killed and several others wounded on Thursday in a shootout between Egyptian police and suspected Moslem militants outside the southern village of Ashmouneen.	3651	8EGY	21786	20/02/1997	1997	2	20	1	Violence against civilians	Unidentified Armed Group (Egypt)		3	Civilians (Egypt)		7	37	Egypt	Menia	Markz Mallawi		El Ashmunein	27.77560	30.80330	1	Reuters	"During a clash between police and militants, police informers Khalaf Mohamed and Mohamed Ali Bikheit were also killed."	2651	9EGY	21787	13/03/1997	1997	3	13	1	Violence against civilians	Al-Gama'a al-Islamiyya 		2	Civilians (Egypt)		7	27	Egypt	Fayoum	Fayyum		Ezbet Dawud	29.51869	30.87220	1	Reuters	"A shooting took place in in Ezbet Dawoud, where 13 people were killed late on Thursday when gunmen opened fire at random on a crowded street before fleeing into sugar cane fields."	13651	10EGY	21788	13/03/1997	1997	3	13	1	Violence against civilians	Al-Gama'a al-Islamiyya 		2	Civilians (Egypt)		7	27	Egypt	Qena	Nag Hammadi		Nag Hamadi	26.05140	32.23860	1	Reuters	Gunmen opened fire on a train passing through Nag Hammadi on its way to Cairo from Aswan. Seven people were wounded in that attack and one woman later died of her injuries.	1651	11EGY	21789	17/03/1997	1997	3	17	1	Non-violent activity by a conflict actor	Vanguards of Conquest		3	Islamist Militia (Egypt)		3	33	Egypt	Cairo	Al Wayli		Cairo	30.07708	31.28591	1		Two Moslem militant groups in Egypt - Vanguards of Conquest and Jihad Movement - said on Monday that they have agreed to unify their ranks and that violence was the only answer to Israeli policies.	0651	12EGY	21790	24/03/1997	1997	3	24	1	Riots/Protests	Protesters (Egypt)	Students (Egypt)	6	Police Forces of Egypt (1981-2011)		1	16	Egypt	Cairo	Al Wayli		Cairo	30.07708	31.28591	1	Reuters	Students at Cairo University protest Iraeli settlement policy. Five students are detained for 15 days on suspicion of inciting violence.	0651	13EGY	21791	31/03/1997	1997	3	31	1	Riots/Protests	Protesters (Egypt)	Students (Egypt)	6			0	60	Egypt	Cairo	Al Wayli		Cairo	30.07708	31.28591	1	Reuters	Thousands of Egyptian students demonstrated at the Azhar Islamic university in Cairo on Monday in protest at Israeli and U.S. policies. Some of the students burned Israel and U.S. flags.	0651	15EGY	21793	08/04/1997	1997	4	8	1	Violence against civilians	Al-Gama'a al-Islamiyya 		2	Civilians (Egypt)		7	27	Egypt	Menia	Kesm Al-minya		Minya	28.10988	30.75030	1	Reuters	Suspected Moslem militant gunmen shot dead a policeman and a farmer in a southern Egyptian town on Tuesday and then fled with an automatic rifle	2651	14EGY	21792	08/04/1997	1997	4	8	1	Battle-No change of territory	Al-Gama'a al-Islamiyya 		2	Police Forces of Egypt (1981-2011)		1	12	Egypt	Menia	Kesm Al-minya		Minya	28.10988	30.75030	1	Reuters	Suspected Moslem militant gunmen shot dead a policeman and a farmer in a southern Egyptian town on Tuesday and then fled with an automatic rifle	2651	16EGY	21794	01/06/1997	1997	6	1	1	Riots/Protests	Rioters (Egypt)		5	Police Forces of Egypt (1981-2011)		1	15	Egypt	Menia	Kesm Al-minya		Minya	28.10988	30.75030	1		"In June, police arrested 26 farmers for allegedly demonstrating in another southern province, where protesters burnt down two government buildings to protest at new tenant laws."	0651	17EGY	21795	03/06/1997	1997	6	3	1	Battle-No change of territory	Police Forces of Egypt (1981-2011)		1	Al-Gama'a al-Islamiyya 		2	12	Egypt	Menia	Markz Samalut		Deir Samalut	28.30000	30.68330	1	Reuters	Egyptian police killed four suspected Islamist militants in a dawn raid near the southern town of Samalout.	4651	18EGY	21796	10/06/1997	1997	6	10	1	Battle-No change of territory	Police Forces of Egypt (1981-2011)		1	Al-Gama'a al-Islamiyya 		2	12	Egypt	Cairo	Ain Shams		Mataria	30.11670	31.31670	1	Reuters	Egyptian police shot dead a suspected Moslem militant leader in the northern suburbs of Cairo.	1651	19EGY	21797	10/06/1997	1997	6	10	1	Battle-No change of territory	Police Forces of Egypt (1981-2011)		1	Al-Gama'a al-Islamiyya 		2	12	Egypt	Menia	Kesm Al-minya		Minya	28.10988	30.75030	1	Reuters	Egyptian police shot dead four suspected Moslem militants in a gun battle in the southern province of Minya.	4651	20EGY	21798	14/06/1997	1997	6	14	1	Riots/Protests	Protesters (Egypt)		6			0	60	Egypt	Cairo	Al Wayli		Cairo	30.07708	31.28591	1	Reuters	An anti-Israel demonstration broke out on Saturday at a heavily guarded Cairo courthouse where An Israeli textile worker is being tried for spying against Egypt.	0651	21EGY	21799	20/06/1997	1997	6	20	1	Battle-No change of territory	Police Forces of Egypt (1981-2011)		1	Al-Gama'a al-Islamiyya 		2	12	Egypt	Beni Suef	Bani Swayf		Beni Suef	29.06390	31.08890	1	Reuters	Egyptian police shot dead three suspected Moslem militants and wounded another in a shootout in a village in southern Egypt on Friday.	3651	22EGY	21800	01/07/1997	1997	7	1	1	Riots/Protests	Rioters (Egypt)		5	Police Forces of Egypt (1981-2011)		1	15	Egypt	Menia	Markz Matay		Kafr el Kawadi	28.38890	30.76390	1	Reuters	Three people were killed and dozens hurt in southern Egypt on Tuesday when police broke up a riot by farmers to protest a new farm land law.	2651	23EGY	21801	01/07/1997	1997	7	1	1	Riots/Protests	Rioters (Egypt)		5	Police Forces of Egypt (1981-2011)		1	15	Egypt	Menia	Markz Samalut		Qulusna	28.35000	30.73330	1	Reuters	Three people were killed and dozens hurt in southern Egypt on Tuesday when police broke up a riot by farmers to protest a new farm land law.	1651	24EGY	21802	02/07/1997	1997	7	2	1	Riots/Protests	Rioters (Egypt)		5	Police Forces of Egypt (1981-2011)		1	15	Egypt	Gharbia	El Mahalla El Kobra 1		El Mahalla el Kubra	30.97610	31.16690	1	Reuters	"Egyptian police arrested 150 people for demonstrating against a new farm land law and burning a government building. Demonstrators set fire to the farm cooperative society near the Nile Delta town of Mahalla el-Kubra, after officials had refused to provide agricultural supplies."	0651	25EGY	21803	03/07/1997	1997	7	3	1	Riots/Protests	Protesters (Egypt)		6	Police Forces of Egypt (1981-2011)		1	16	Egypt	Gharbia	Qutur		Nile Delta	31.00000	31.00000	1	Reuters	Egyptian police arrested 35 farmers south of Cairo on Thursday in the latest outbreak of unrest over an agricultural land law which takes effect in October.	0651	26EGY	21804	04/07/1997	1997	7	4	1	Battle-No change of territory	Police Forces of Egypt (1981-2011)		1	Al-Gama'a al-Islamiyya 		2	12	Egypt	Menia	Markz Abu Qurqas		"Abu Qurqas, Markaz"	27.93330	30.75000	1	Reuters	Egyptian police shot dead three suspected militants during a search operation in southern Egypt.	3651	28EGY	21806	22/07/1997	1997	7	22	1	Violence against civilians	Al-Gama'a al-Islamiyya 		2	Civilians (Egypt)		7	27	Egypt	Menia	Kesm Al-minya		Minya	28.10988	30.75030	1	Reuters	Suspected Moslem militants shot dead five policemen and their officer and injured two civilians on Tuesday in an attack on a police patrol just outside Minya.	5651	27EGY	21805	22/07/1997	1997	7	22	1	Battle-No change of territory	Al-Gama'a al-Islamiyya 		2	Police Forces of Egypt (1981-2011)		1	12	Egypt	Menia	Kesm Al-minya		Minya	28.10988	30.75030	1	Reuters	Suspected Moslem militants shot dead five policemen and their officer and injured two civilians on Tuesday in an attack on a police patrol just outside Minya.	6651	30EGY	21808	19/08/1997	1997	8	19	1	Violence against civilians	Al-Gama'a al-Islamiyya 		2	Civilians (Egypt)		7	27	Egypt	Assiut	Al-Qusia		"Manfalut, Markaz"	27.33330	30.83330	1	Reuters	Egypt's most violent Moslem militant group has claimed responsibility for killing four policemen in an attack in the south of the country - civilian caught in crossfire of police ambush.	1651	29EGY	21807	19/08/1997	1997	8	19	1	Battle-No change of territory	Al-Gama'a al-Islamiyya 		2	Police Forces of Egypt (1981-2011)		1	12	Egypt	Assiut	Al-Qusia		"Manfalut, Markaz"	27.33330	30.83330	1	Reuters	Egypt's most violent Moslem militant group has claimed responsibility for killing four policemen in an attack in the south of the country.	4651	32EGY	21810	06/09/1997	1997	9	6	1	Violence against civilians	Al-Gama'a al-Islamiyya 		2	Civilians (Egypt)		7	27	Egypt	Shrkia	Faqus		Roda	30.68940	31.82080	1	Reuters	Six people including a 10-year-old child were killed and one was injured in southern Egypt after suspected Moslem militants went on a rampage against police informers.	6651	31EGY	21809	06/09/1997	1997	9	6	1	Battle-No change of territory	Unidentified Armed Group (Egypt)		3	Muslim Militia (Egypt)		4	34	Egypt	Assiut	Al-Qusia		Assiut	27.33330	30.83330	1	Reuters	"In the village of Greiss, a fugitive militant shot and injured his neighbour, because he thought he was cooperating with the police. The farmer's family then shot dead the militant's uncle, aunt and their 10-year-old daughter in revenge."	3651	33EGY	21811	18/09/1997	1997	9	18	1	Remote violence	Muslim Militia (Egypt)		4	Civilians (International)		7	47	Egypt	Cairo	Al Wayli		Cairo	30.07708	31.28591	1	Reuters	"Nine people were killed on Thursday in a bomb attack on a tourist bus in Cairo, including six Germans and three others."	9651	35EGY	21813	30/09/1997	1997	9	30	1	Violence against civilians	Al-Gama'a al-Islamiyya 		2	Civilians (Egypt)		7	27	Egypt	Menia	Markz Al Minya		Beni Ahmad	28.04170	30.76940	1	Reuters	Suspected Moslem militants beheaded a policeman and killed a farmer they believed was a police informer in the southern Egyptian province of Minya.	1651	34EGY	21812	30/09/1997	1997	9	30	1	Battle-No change of territory	Al-Gama'a al-Islamiyya 		2	Police Forces of Egypt (1981-2011)		1	12	Egypt	Menia	Markz Al Minya		Beni Ahmad	28.04170	30.76940	1	Reuters	Suspected Moslem militants beheaded a policeman and killed a farmer they believed was a police informer in the southern Egyptian province of Minya.	2651	37EGY	21815	13/10/1997	1997	10	13	1	Violence against civilians	Al-Gama'a al-Islamiyya 		2	Civilians (Egypt)		7	27	Egypt	Menia	Markz Abu Qurqas		"Abu Qurqas, Markaz"	27.93330	30.75000	1	Dow Jones International News	"Militants attacked police stations in the town of Abu Qurqas, killing six policemen and two civilians."	8651	36EGY	21814	13/10/1997	1997	10	13	1	Battle-No change of territory	Al-Gama'a al-Islamiyya 		2	Police Forces of Egypt (1981-2011)		1	12	Egypt	Menia	Markz Abu Qurqas		"Abu Qurqas, Markaz"	27.93330	30.75000	1	Dow Jones International News	"Militants attacked police stations in the town of Abu Qurqas, killing six policemen and two civilians."	8651	38EGY	21816	13/10/1997	1997	10	13	1	Battle-No change of territory	Al-Gama'a al-Islamiyya 		2	Police Forces of Egypt (1981-2011)		1	12	Egypt	Menia	Markz Mallawi		Mallawi	27.76670	30.83330	1	Dow Jones International News	Militants attacked police stations in the town of Mellawi killing three policemen.	3651	40EGY	21818	12/11/1997	1997	11	12	1	Violence against civilians	Muslim Militia (Egypt)		4	Civilians (Egypt)		7	47	Egypt	Qena	Nag Hammadi		Nag Hamadi	26.05140	32.23860	1	Reuters	Suspected Moslem militants shot dead two policemen and a farmer on Wednesday after an ambush in the railway station of the southern Egyptian town of Nag Hammadi.	3651	39EGY	21817	12/11/1997	1997	11	12	1	Battle-No change of territory	Muslim Militia (Egypt)		4	Police Forces of Egypt (1981-2011)		1	14	Egypt	Qena	Nag Hammadi		Nag Hamadi	26.05140	32.23860	1	Reuters	Suspected Moslem militants shot dead two policemen and a farmer on Wednesday after an ambush in the railway station of the southern Egyptian town of Nag Hammadi.	3651	42EGY	21820	17/11/1997	1997	11	17	1	Violence against civilians	Al-Gama'a al-Islamiyya 		2	Civilians (International)		7	27	Egypt	Luxor	Luxor		Luxor	25.68330	32.65000	1	Reuters	Gunmen killed 60 foreign tourists in an attack on an ancient temple in Egypt's southern town of Luxor on Monday	60651	41EGY	21819	17/11/1997	1997	11	17	1	Battle-No change of territory	Al-Gama'a al-Islamiyya 		2	Police Forces of Egypt (1981-2011)		1	12	Egypt	Luxor	Luxor		Luxor	25.68330	32.65000	1	Reuters	Gunmen kill three policemen in a shoot-out following an attack on tourists in Luxor.	3651	43EGY	21821	13/12/1997	1997	12	13	1	Battle-No change of territory	Police Forces of Egypt (1981-2011)		1	Al-Gama'a al-Islamiyya 		2	12	Egypt	Menia	Markz Mallawi		Mallawi	27.76670	30.83330	1	Reuters	A suspected Moslem militant and a policeman were killed in a shootout in southern Egypt.	2651	44EGY	21822	10/03/1998	1998	3	10	1	Battle-No change of territory	Police Forces of Egypt (1981-2011)		1	Al-Gama'a al-Islamiyya 		2	12	Egypt	Menia	Kesm Al-minya		Minya	28.10988	30.75030	1	Reuters	Four suspected Moslem militants and a policeman were killed in a gunbattle in Egypt's southern province of Minya.	5651	46EGY	21824	22/03/1998	1998	3	22	1	Violence against civilians	Al-Gama'a al-Islamiyya 		2	Civilians (Egypt)		7	27	Egypt	Menia	Markz Bani Mazar		Beni Mazar	28.50000	30.75000	1	Reuters	"Suspected Moslem militants rampaged through Beni Mazar village. They machine-gunned a police car, killing Lieutenant Alaa Andeel, two guards and the driver. Two passers-by were also wounded."	4651	48EGY	21826	22/03/1998	1998	3	22	1	Violence against civilians	Al-Gama'a al-Islamiyya 		2	Civilians (Egypt)		7	27	Egypt	Menia	Markz Matay		Matay	28.42220	30.75560	1	Reuters	"Suspected Moslem militants rampaged through two villages in southern Egypt on Sunday, killing four policemen and wounding at least 13 others. The gunmen drove through Matay where they sprayed a minibus with bullets, wounding four policemen and seven passengers."	4651	45EGY	21823	22/03/1998	1998	3	22	1	Battle-No change of territory	Al-Gama'a al-Islamiyya 		2	Police Forces of Egypt (1981-2011)		1	12	Egypt	Menia	Markz Bani Mazar		Beni Mazar	28.50000	30.75000	1	Reuters	"Suspected Moslem militants rampaged through Beni Mazar village. They machine-gunned a police car, killing Lieutenant Alaa Andeel, two guards and the driver. Two passers-by were also wounded."	4651	47EGY	21825	22/03/1998	1998	3	22	1	Battle-No change of territory	Al-Gama'a al-Islamiyya 		2	Police Forces of Egypt (1981-2011)		1	12	Egypt	Menia	Markz Matay		Matay	28.42220	30.75560	1	Reuters	"Suspected Moslem militants rampaged through two villages in southern Egypt on Sunday, killing four policemen and wounding at least 13 others."	4651	50EGY	21828	30/03/1998	1998	3	30	1	Violence against civilians	Al-Gama'a al-Islamiyya 		2	Civilians (Egypt)		7	27	Egypt	Assiut	Al- Badari		El Badari	27.01670	31.41670	1	Reuters	A 10-year-old boy and a suspected Moslem militant were shot dead in a clash between police and three suspected militants in southern Egypt on Monday.	1651	49EGY	21827	30/03/1998	1998	3	30	1	Battle-No change of territory	Al-Gama'a al-Islamiyya 		2	Police Forces of Egypt (1981-2011)		1	12	Egypt	Assiut	Al- Badari		El Badari	27.01670	31.41670	1	Reuters	A 10-year-old boy and a suspected Moslem militant were shot dead in a clash between police and three suspected militants in southern Egypt on Monday.	1651	51EGY	21829	06/04/1998	1998	4	6	1	Violence against civilians	Al-Gama'a al-Islamiyya 		2	Civilians (Egypt)		7	27	Egypt	Menia	Kesm Mallawi		Mallawi	27.73190	30.84110	1	Reuters	Suspected Moslem militants shot dead two farmers in southern Egypt late on Sunday.	2651	52EGY	21830	10/04/1998	1998	4	10	1	Riots/Protests	Police Forces of Egypt (1981-2011)		1	Rioters (Egypt)		5	15	Egypt	Cairo	Al Wayli		Cairo	30.07708	31.28591	1	Reuters	"One man was killed and six people were injured on Thursday when a riot erupted in Wabour al-Nour, about 200 km (120 miles) from the capital."	1651	53EGY	21831	01/08/1998	1998	8	1	1	Violence against civilians	Police Forces of Egypt (1981-2011)		1	Civilians (Egypt)	Christian Group (Egypt)	7	17	Egypt	New Valley	Al-Kharga Oasis		Upper Egypt	26.00000	32.00000	3		"Coptic Christian clergy in Egypt have contacted human rights groups and ministries alleging that police tortured 1,000 members of the minority church living in a southern village in August."	0651	54EGY	21832	23/09/1998	1998	9	23	1	Battle-No change of territory	Ahrar Party (Hemeida Faction)		3	Ahrar Party (Sadat Faction)		3	33	Egypt	Cairo	Al Wayli		Cairo	30.07708	31.28591	1	Reuters	Rival factions of an Egyptian opposition party opened fire on each other and used firebombs in a battle on Wednesday to occupy party offices in downtown Cairo.	0651	55EGY	21833	02/11/1998	1998	11	2	1	Battle-No change of territory	Police Forces of Egypt (1981-2011)		1	Islamist Militia (Egypt)		3	13	Egypt	Menia	Kesm Al-minya		Minya	28.10988	30.75030	1	Dow Jones International News	Egyptian police Monday shot and killed two Islamic militants wanted for a series of attacks. The gunbattle began after police surrounded a house in which the militants had taken shelter near the village of Galal in the southern province of Minya.	2651	56EGY	21834	17/12/1998	1998	12	17	1	Riots/Protests	Protesters (Egypt)	Students (Egypt)	6			0	60	Egypt	Cairo	Al Wayli		Cairo	30.07708	31.28591	1	Reuters	Thousands of Cairo university students protested on Thursday against U.S. air raids on Iraq. Hundreds of students swarmed out of the American University in Cairo campus intending to march on the nearby U.S. embassy.	0651	57EGY	21835	18/12/1998	1998	12	18	1	Riots/Protests	Protesters (Egypt)		6	Police Forces of Egypt (1981-2011)		1	16	Egypt	Cairo	Muski		Cairo	30.05000	31.25000	1	Reuters	"In a separate demonstration, police sealed off the road leading to the U.S. embassy in Cairo as less than one hundred protestors at a nearby mosque burned a paper American flag"	0651	58EGY	21836	18/12/1998	1998	12	18	1	Riots/Protests	Protesters (Egypt)		6	Police Forces of Egypt (1981-2011)		1	16	Egypt	Cairo	Muski		Cairo	30.05000	31.25000	1	Reuters	"In a third demonstration, near the embassy, under 100 people burned an American flag, watched by helmeted police."	0651	59EGY	21837	18/12/1998	1998	12	18	1	Riots/Protests	Rioters (Egypt)	Muslim Group (Egypt)	5	Police Forces of Egypt (1981-2011)		1	15	Egypt	Cairo	Muski		Cairo	30.05000	31.25000	1	Reuters	Hundreds of Egyptians burned American flags and shouted anti-U.S. slogans on Friday to protest against U.S.-led air strikes on Iraq. Twenty trucks full of riot police ringed the congested downtown area of Cairo near al-Azhar mosque.	0651	60EGY	21838	19/12/1998	1998	12	19	1	Riots/Protests	Protesters (Egypt)	Students (Egypt)	6			0	60	Egypt	Cairo	Marg		`Ain Shams	30.13330	31.31670	1	Star-Ledger Wire Services	"A groundswell of protests against the bombing of Iraq roiled the Middle East. In Egypt, 4,000 students burned U.S. and Israeli flags at Banha University, north of Cairo."	0651	61EGY	21839	19/12/1998	1998	12	19	1	Riots/Protests	Protesters (Egypt)	Students (Egypt)	6			0	60	Egypt	Kalyoubia	Banha		Banha	30.46080	31.18750	1	Star-Ledger Wire Services	"A groundswell of protests against the bombing of Iraq roiled the Middle East. In Egypt, 4,000 students burned U.S. and Israeli flags at Banha University, north of Cairo."	0651	62EGY	21840	23/12/1998	1998	12	23	1	Riots/Protests	Police Forces of Egypt (1981-2011)		1	Protesters (Egypt)	Muslim Brotherhood	6	16	Egypt	Cairo	Muski		Cairo	30.05000	31.25000	1	Reuters	Egyptian police barred members of opposition parties from demonstrating in Cairo on Wednesday against last week's U.S. and British air strikes on Iraq. 	0651	63EGY	21841	05/01/1999	1999	1	5	1	Violence against civilians	Muslim Militia (Egypt)		4	Civilians (Egypt)	Christian Group (Egypt)	7	47	Egypt	Suhag	Suhag-2		Sohag	26.55000	31.70000	1	Reuters	Gunmen have shot dead one Coptic Christian and wounded another in southern Egypt in an apparent dispute over a Moslem woman.	1651	64EGY	21842	19/02/1999	1999	2	19	1	Riots/Protests	Protesters (Egypt)		6	Police Forces of Egypt (1981-2011)		1	16	Egypt	Cairo	Muski		Cairo	30.05000	31.25000	1	Reuters	Demonstrators from an Egyptian opposition party shouted anti-American slogans and scuffled with police in front of the United States embassy in Cairo on Thursday to protest against U.S. threats to bomb Iraq.	0651	65EGY	21843	05/04/1999	1999	4	5	1	Riots/Protests	Protesters (Egypt)	Students (Egypt)	6	Police Forces of Egypt (1981-2011)		1	16	Egypt	Cairo	Muski		Cairo	30.05000	31.25000	1	Reuters	Hundreds of Egyptian students demonstrated inside the grounds of Cairo University on Monday in support for ethnic Albanian Moslems in Kosovo.	0651	66EGY	21844	20/04/1999	1999	4	20	1	Riots/Protests	Protesters (Egypt)		6	Police Forces of Egypt (1981-2011)		1	16	Egypt	Cairo	Muski		Cairo	30.05000	31.25000	1	Reuters	"About 25 lawyers showed up on Tuesday for a three-hour sit-in at the syndicate's building in central Cairo, under heavy guard since mid-March when police forcibly prevented lawyers from convening a general assembly and holding fresh elections."	0651	67EGY	21845	31/07/1999	1999	7	31	1	Battle-No change of territory	Muslim Militia (Egypt)		4	Police Forces of Egypt (1981-2011)		1	14	Egypt	Assiut	Al-Qusia		Assiut	27.33330	30.83330	1	Reuters	Suspected Moslem militants shot dead one policeman and wounded two other police at a checkpoint in southern Egypt on Friday.	1651	68EGY	21846	06/09/1999	1999	9	6	1	Battle-No change of territory	Police Forces of Egypt (1981-2011)		1	Al-Gama'a al-Islamiyya 		2	12	Egypt	Giza	Giza		Giza	30.00860	31.21220	1	Reuters	Egyptian police shot dead four members of the banned al-Gama'a al-Islamiya (Islamic Group) who tried to resist arrest in their hideout near the capital on Monday.	4651	69EGY	21847	06/09/1999	1999	9	6	1	Violence against civilians	Unidentified Armed Group (Egypt)		3	Civilians (Egypt)		7	37	Egypt	Port Said	Al-Munakh		Port Said	31.25654	32.28412	1	Reuters	Assassination attempt: Mubarak's bodyguards shot dead a street vendor when he attacked the president with a knife in the Suez Canal city of Port Said.	1651	70EGY	21848	01/10/1999	1999	10	1	1	Battle-No change of territory	Police Forces of Egypt (1981-2011)		1	Islamist Militia (Egypt)		3	13	Egypt	Cairo	Muski		Cairo	30.05000	31.25000	1	Reuters	"An Egyptian Moslem fundamentalist died at the headquarters of state security investigations 10 days ago after being tortured, an Islamist human rights group said."	1651	71EGY	21849	07/11/1999	1999	11	7	1	Riots/Protests	Protesters (Egypt)	Students (Egypt)	6	Police Forces of Egypt (1981-2011)		1	16	Egypt	Menoufia	Shibin al-Kum		Shibin al Kawm	30.55860	31.01000	1	Reuters	Hundreds of students from Minufiya University took to the streets on Sunday in protest at plans for a military trial of 20 alleged members of the banned Moslem Brotherhood.	0651	72EGY	21850	08/12/1999	1999	12	8	1	Riots/Protests	Protesters (Egypt)		6			0	60	Egypt	Menia	Kesm Al-minya		Minya	28.10988	30.75030	1	Reuters	About 300 Egyptian workers demonstrated peacefully on Wednesday at a Coca-Cola plant in protest at the company's decision to relocate them.	0651	73EGY	21851	01/01/2000	2000	1	1	1	Battle-No change of territory	Muslim Militia (Egypt)		4	Christian Militia (Egypt)		4	44	Egypt	Suhag	Suhag-2		Sohag	26.55000	31.70000	1	Reuters	At least three men were wounded in the southern Egyptian village of al-Kosheh after a dispute between two traders developed into Moslem-Christian clashes.	0651	74EGY	21852	02/01/2000	2000	1	2	1	Battle-No change of territory	Muslim Militia (Egypt)		4	Christian Militia (Egypt)		4	44	Egypt	Suhag	Suhag-2		Sohag	26.55000	31.70000	1	Reuters	At least three men were wounded in the southern Egyptian village of al-Kosheh after a dispute between two traders developed into Moslem-Christian clashes.	8651	75EGY	21853	03/01/2000	2000	1	3	1	Battle-No change of territory	Muslim Militia (Egypt)		4	Christian Militia (Egypt)		4	44	Egypt	Suhag	Suhag-2		Sohag	26.55000	31.70000	1	Reuters	At least three men were wounded in the southern Egyptian village of al-Kosheh after a dispute between two traders developed into Moslem-Christian clashes.	21651	76EGY	21854	10/02/2000	2000	2	10	1	Riots/Protests	Protesters (Egypt)	Students (Egypt)	6			0	60	Egypt	Cairo	Muski		Cairo	30.05000	31.25000	1	AP Newswire	students from the American University in Cairo staged a protest inside their campus Thursday to denounce Israel's attacks on Lebanon.	0651	77EGY	21855	15/02/2000	2000	2	15	1	Riots/Protests	Protesters (Egypt)	Students (Egypt)	6			0	60	Egypt	Cairo	Marg		`Ain Shams	30.13330	31.31670	1	Reuters	"Several thousand Egyptian university students held campus demonstrations in Cairo on Tuesday in protest at Israeli attacks on Lebanon. Students at Ain Shams University chanted anti-Israel slogans in separate demonstrations, while riot and state security police stood guard outside the campus."	0651	78EGY	21856	15/02/2000	2000	2	15	1	Riots/Protests	Protesters (Egypt)	Students (Egypt)	6			0	60	Egypt	Cairo	Madinat Nasr-2		Al Mokhaym Al Daem	30.05372	31.31188	1	Reuters	"Several thousand Egyptian university students held campus demonstrations in Cairo on Tuesday in protest at Israeli attacks on Lebanon. Students at al-Azhar University chanted anti-Israel slogans in separate demonstrations, while riot and state security police stood guard outside the campus."	0651	79EGY	21857	15/02/2000	2000	2	15	1	Riots/Protests	Protesters (Egypt)	Students (Egypt)	6			0	60	Egypt	Giza	Giza		Oula	30.02084	31.21394	1	Reuters	"Several thousand Egyptian university students held campus demonstrations in Cairo on Tuesday in protest at Israeli attacks on Lebanon. Students at Cairo University chanted anti-Israel slogans in separate demonstrations, while riot and state security police stood guard outside the campus."	0651	80EGY	21858	05/03/2000	2000	3	5	1	Riots/Protests	Rioters (Egypt)		5	Police Forces of Egypt (1981-2011)		1	15	Egypt	Kalyoubia	Qalyub		Mit Nama	30.14610	31.23110	1	Dow Jones International News	"3,000 Egyptian villagers rioted Sunday, hurling rocks at passing cars and fighting with policemen, after a speeding truck killed a 16-year-old girl. Villagers seized the driver of the truck that killed Samah Mustafa and beat him severely."	1651	81EGY	21859	11/03/2000	2000	3	11	1	Riots/Protests	Rioters (Egypt)		5	Police Forces of Egypt (1981-2011)		1	15	Egypt	Shrkia	Minya al-Qamh		Awlad Sayf	30.46670	31.40000	1	Lloyd's Information Casualty Report	Police in Egypt have broken up a riot by villagers protesting after a traffic accident involving in which two teenage girls were killed. It is the second such protest over a traffic accident in less than a week.Angry villagers set the bus and other vehicles on fire.	0651	82EGY	21860	07/05/2000	2000	5	7	1	Riots/Protests	Protesters (Egypt)	Students (Egypt)	6	Police Forces of Egypt (1981-2011)		1	16	Egypt	Cairo	Muski		Cairo	30.05000	31.25000	1	Dow Jones International News	"Police in riot gear fired tear gas Monday to disperse 5,000 students in Cairo angry about a book fundamentalists have deemed insulting to Islam. Hospitals treated about 40 students. Demonstrators were mostly from Al-Azhar University."	0651	83EGY	21861	08/05/2000	2000	5	8	1	Riots/Protests	Protesters (Egypt)	Students (Egypt)	6	Police Forces of Egypt (1981-2011)		1	16	Egypt	Cairo	Muski		Cairo	30.05000	31.25000	1	Dow Jones International News	"Police in riot gear fired tear gas Monday to disperse 5,000 students in Cairo angry about a book fundamentalists have deemed insulting to Islam. Hospitals treated about 40 students. Demonstrators were mostly from Al-Azhar University."	0651	85EGY	21863	09/05/2000	2000	5	9	1	Riots/Protests	Protesters (Egypt)	Students (Egypt)	6			0	60	Egypt	Cairo	Muski		Cairo	30.05000	31.25000	1	Agence France Press(AFP)	"Protests spread from al-Alzhar University to other Cairo academies. Some 3,000 students from Ain Shams University and 2,000 held similar protest on Tuesday."	0651	86EGY	21864	09/05/2000	2000	5	9	1	Riots/Protests	Protesters (Egypt)	Students (Egypt)	6			0	60	Egypt	Cairo	Muski		Cairo	30.05000	31.25000	1	Agence France Press(AFP)	"Protests spread from al-Alzhar University to other Cairo academies. Some 3,000 students from Cairo University and 2,000 held similar protest on Tuesday."	0651	84EGY	21862	09/05/2000	2000	5	9	1	Riots/Protests	Rioters (Egypt)	Students (Egypt)	5	Police Forces of Egypt (1981-2011)		1	15	Egypt	Cairo	Muski		Cairo	30.05000	31.25000	1	Agence France Press(AFP)	Protests escalate in violence; The arrest of more than 100 students at a violent demonstration here over a novel they deemed blasphemous sparked more protests at Cairo's Islamic Al-Azhar University Tuesday evening.	0651	87EGY	21865	10/05/2000	2000	5	10	1	Riots/Protests	Rioters (Egypt)	Students (Egypt)	5	Police Forces of Egypt (1981-2011)		1	15	Egypt	Cairo	Muski		Cairo	30.05000	31.25000	1	Agence France Press(AFP)	Protests escalate in violence; The arrest of more than 100 students at a violent demonstration here over a novel they deemed blasphemous sparked more protests at Cairo's Islamic Al-Azhar University Tuesday evening.	0651	88EGY	21866	24/06/2000	2000	6	24	1	Battle-No change of territory	Christian Militia (Sudan)		4	Muslim Militia (Egypt)		4	44	Egypt	Cairo	Muski		Cairo	30.05000	31.25000	1	Agence France Press(AFP)	"Around 20 people were hurt, including two policemen, when mainly Sudanese Christians and Egyptian Muslims came to blows after a car hit a Sudanese man outside a Cairo church late Monday."	0651	89EGY	21867	25/06/2000	2000	6	25	1	Battle-No change of territory	Unidentified Armed Group (Egypt)		3	Unidentified Armed Group (Egypt)		3	33	Egypt	Giza	Waraq		Tanash wa Nazlat az Zumur	30.12530	31.19000	1	Agence France Press(AFP)	"39 people were injured overnight Monday in Tanash village outside of Cairo when two families fought with guns, knives, clubs and stones over a student accused of speeding."	0651	90EGY	21868	04/10/2000	2000	10	4	1	Riots/Protests	Protesters (Egypt)	Students (Egypt)	6	Police Forces of Egypt (1981-2011)		1	16	Egypt	Alexandria	Bab Sharqi		Alexandria	31.19810	29.91920	1	Dow Jones International News	"3,000 students at Alexandria University, north Egypt, protested the planned visit by Israeli Prime Minister Ehud Barak to their country Thursday for talks with President Hosni Mubarak and Palestinian leader Yasser Arafat."	0651	91EGY	21869	04/10/2000	2000	10	4	1	Riots/Protests	Rioters (Egypt)	Students (Egypt)	5	Police Forces of Egypt (1981-2011)		1	15	Egypt	Cairo	Muski		Cairo	30.05000	31.25000	1	Dow Jones International News	"In Cairo, about 1,500 school students stoned a supermarket belonging to the British retail chain Sainsbury's, saying the owner is Jewish. Police dispersed the protesters, but not before they had smashed the store's glass front."	0651	92EGY	21870	07/10/2000	2000	10	7	1	Riots/Protests	Protesters (Egypt)	Students (Egypt)	6	Police Forces of Egypt (1981-2011)		1	16	Egypt	Cairo	Muski		Cairo	30.05000	31.25000	1	Agence France Press(AFP)	"Hundreds of school pupils on Saturday marched in the streets of Cairo denouncing ""the massacres committed by the Israelis"" against the Palestinian people."	0651	94EGY	21872	07/10/2000	2000	10	7	1	Riots/Protests	Protesters (Egypt)	Students (Egypt)	6			0	60	Egypt	New Valley	Al-Kharga Oasis		Upper Egypt	26.00000	32.00000	1	Agence France Press(AFP)	"Hundreds of school pupils on Saturday marched in the streets of Upper Egypt denouncing ""the massacres committed by the Israelis"" against the Palestinian people."	0651	93EGY	21871	07/10/2000	2000	10	7	1	Riots/Protests	Rioters (Egypt)	Students (Egypt)	5	Police Forces of Egypt (1981-2011)		1	15	Egypt	Cairo	Muski		Cairo	30.05000	31.25000	1	Agence France Press(AFP)	Twenty-two people were wounded Saturday in Egypt in clashes between students and police in a day of anti- Israeli rage.	22651	95EGY	21873	08/10/2000	2000	10	8	1	Riots/Protests	Protesters (Egypt)	Students (Egypt)	6			0	60	Egypt	Cairo	Muski		Cairo	30.05000	31.25000	1	Associated Press Newswire	"More than 2,000 students at al-Azhar University in Cairo demonstrated on their campuses, calling for an end to relations with Israel and urging Arab leaders to adopt a unified stand in support of the Palestinian people."	0651	96EGY	21874	08/10/2000	2000	10	8	1	Riots/Protests	Protesters (Egypt)	Students (Egypt)	6			0	60	Egypt	Cairo	Muski		Cairo	30.05000	31.25000	1	Associated Press Newswire	"More than 7,000 students at Cairo University in Cairo demonstrated on their campuses, calling for an end to relations with Israel and urging Arab leaders to adopt a unified stand in support of the Palestinian people."	0651	97EGY	21875	10/10/2000	2000	10	10	1	Riots/Protests	Protesters (Egypt)	Students (Egypt)	6			0	60	Egypt	Alexandria	Bab Sharqi		Alexandria	31.19810	29.91920	1	Agence France Press(AFP)	"Thousands of Egyptian students staged pro-Palestinian and anti-Israeli rallies on Monday in the Mediterranean city of Alexandria. More 2,000 protested at the medical school of Alexandria University."	0651	100EGY	21878	10/10/2000	2000	10	10	1	Riots/Protests	Protesters (Egypt)	Students (Egypt)	6			0	60	Egypt	Cairo	Muski		Cairo	30.05000	31.25000	1	Agence France Press(AFP)	"Thousands of Egyptian students staged pro-Palestinian and anti-Israeli rallies on Monday in the capital. High school students marched through the streets of the Cairo suburbs of Maadi, Bassatine and Helmiyat al-Zaytun."	0651	99EGY	21877	10/10/2000	2000	10	10	1	Riots/Protests	Rioters (Egypt)	Students (Egypt)	5	Police Forces of Egypt (1981-2011)		1	15	Egypt	Cairo	Marg		`Ain Shams	30.13330	31.31670	1	Agence France Press(AFP)	"Egyptian students on Tuesday burned cars and stoned police who fired tear gas and used clubs to prevent them from taking an anti-Israeli protest to the streets of the capital. The police managed to keep the 5,000 protestors on the grounds of Ain Shams University in northern Cairo by sealing the gates."	0651	98EGY	21876	10/10/2000	2000	10	10	1	Riots/Protests	Rioters (Egypt)	Independent Political Candidate	5	Rioters (Egypt)		5	55	Egypt	Aswan	Zemam Out		"Tokham, Barqet"	23.50000	33.35000	1	Reuters	Eight campaign workers received bullet wounds in the town of Tokh north of Cairo the week of the 10th October in clashes between rival independent candidates.	0651	101EGY	21879	10/10/2000	2000	10	10	1	Riots/Protests	Rioters (Egypt)	Independent Political Candidate	5	Rioters (Egypt)		5	55	Egypt	Kafr El-Shikh	Kafr Al-Shaykh		Kafr el Sheikh	31.11140	30.93640	1	Reuters	Fifteen campaign workers were injured in a brick and stone fight between rival independent political candidates in the town of Kafr el-Sheikh	0651	102EGY	21880	11/10/2000	2000	10	11	1	Battle-No change of territory	Unidentified Armed Group (Egypt)		3	Military Forces of Israel		8	38	Egypt	North Sinai	Rafah		Rafah	31.28780	34.23690	1	Agence France Press(AFP)	"Israeli troops fired live rounds into neighbouring Egypt during clashes early Wednesday with youths who threw rocks and bottles at their positions from across the border, an army spokesman said."	0651	103EGY	21881	13/10/2000	2000	10	13	1	Riots/Protests	Protesters (Egypt)	Muslim Group (Egypt)	6			0	60	Egypt	Cairo	Muski		Cairo	30.05000	31.25000	1	Dow Jones International News	"About 1,000 demonstrators shouted pro-Palestinian slogans and burned Israeli flags. Protesters called on Arab leaders to stand more firmly against Israel and asked ""Where is the Egyptian army?"""	0651	104EGY	21882	19/10/2000	2000	10	19	1	Battle-No change of territory	Police Forces of Egypt (1981-2011)		1	Islamist Militia (Egypt)		3	13	Egypt	Cairo	Muski		Cairo	30.05000	31.25000	1	Agence France Press(AFP)	"Two Islamist ""terrorists"" were killed last week by Egyptian police during a crackdown on militants ahead of an Arab summit at the weekend, Egypt's information minister said Thursday."	2651	105EGY	21883	20/10/2000	2000	10	20	1	Riots/Protests	Protesters (Egypt)	Muslim Group (Egypt)	6			0	60	Egypt	Cairo	Muski		Cairo	30.05000	31.25000	1	Reuters	"About 500 Egyptians called for a ""jihad"" or ""holy struggle"" against Israel on Friday at a demonstration after Muslim prayers at Cairo's al-Azhar mosque."	0651	106EGY	21884	21/10/2000	2000	10	21	1	Battle-No change of territory	Christian Militia (Egypt)		4	Muslim Militia (Egypt)		4	44	Egypt	Menia	Markz Samalut		Dayr Samalut	28.30000	30.68330	1	Reuters	Christian-Muslim violence erupted in southern Egypt at the weekend over renovation work at a local church. 3 people wounded.	0651	107EGY	21885	23/10/2000	2000	10	23	1	Violence against civilians	Civilians (Egypt)	Independent Political Candidate	7	NDP: National Democratic Party		3	37	Egypt	Fayoum	Fayyum		Fayyum	29.31670	30.80000	1	Reuters	Electoral violence - Eleven people were admitted to hospital with bullet wounds on Monday after fighting broke out between rival candidates in Egypt's parliamentary elections.	0651	108EGY	21886	24/10/2000	2000	10	24	1	Violence against civilians	Police Forces of Egypt (1981-2011)		1	Civilians (Egypt)		7	17	Egypt	Menia	Markz Mallawi		Al Ashmunin	27.77560	30.80330	1	Reuters	One man was killed and dozens wounded when Egyptian police fired at angry masses who said security forces were trying to keep them from voting in a run-off election on Tuesday.	1651	109EGY	21887	29/10/2000	2000	10	29	1	Non-violent activity by a conflict actor	Muslim Brotherhood		3	Unidentified Armed Group (Egypt)		3	33	Egypt	Alexandria	Bab Sharqi		Alexandria	31.19810	29.91920	1	Reuters	"36 supporters of the outlawed Muslim Brotherhood, Egypt's most influential Islamist group, were arrested after election-related clashes in two north Egyptian towns on Sunday."	0651	110EGY	21888	30/10/2000	2000	10	30	1	Battle-No change of territory	Unidentified Armed Group (Egypt)		3	Unidentified Armed Group (Egypt)		3	33	Egypt	Assiut	Al-Qusia		Assiut	27.33330	30.83330	1	Reuters	"Security sources said one man was killed and three wounded in a shooting incident on Monday between families supporting different candidates near the southern town of Assiut, where voting takes place in next week's final phase."	1651	112EGY	21890	04/11/2000	2000	11	4	1	Riots/Protests	Rioters (Egypt)		5	Police Forces of Egypt (1981-2011)		1	15	Egypt	Gharbia	Tanta		"Al Gharbiyah, Muhafazat al"	30.83330	31.00000	1	Reuters	"Two men died of bullet wounds after clashes between police and voters in the village of Ibyar, Gharbia district. Another 22 people were in hospital after being shot."	2651	113EGY	21891	04/11/2000	2000	11	4	1	Riots/Protests	Rioters (Egypt)		5	Police Forces of Egypt (1981-2011)		1	15	Egypt	Gharbia	Tanta 2		Tanta	30.79110	30.99810	1	Reuters	"In the Delta city of Tanta, police used teargas to disperse stone-throwing crowds after clashes between supporters of Islamist and other candidates."	0651	111EGY	21889	04/11/2000	2000	11	4	1	Battle-No change of territory	Unidentified Armed Group (Egypt)		3	Unidentified Armed Group (Egypt)		3	33	Egypt	Damietta	Fariskur		Damietta	31.33330	31.75000	1	Reuters	Two people died after election-related clashes in northern Egypt on Saturday in the worst day of violence since the three-stage poll began last month.	2651	114EGY	21892	08/11/2000	2000	11	8	1	Violence against civilians	Police Forces of Egypt (1981-2011)		1	Civilians (Egypt)		7	17	Egypt	Cairo	Muski		Cairo	30.05000	31.25000	1	Agence France Press(AFP)	"Several foreign and Egyptian journalists covering the parliamentary elections in Egypt were beaten, roughed up or intimidated on Wednesday. Some were attacked by unidentified men and women in civilian clothes, an Egyptian cameraman was seen being beaten by police wielding metal bars."	0651	116EGY	21894	08/11/2000	2000	11	8	1	Violence against civilians	Unidentified Armed Group (Egypt)		3	Civilians (International)	Journalists (International)	7	37	Egypt	Cairo	Muski		Cairo	30.05000	31.25000	1	Agence France Press(AFP)	"Several foreign and Egyptian journalists covering the parliamentary elections in Egypt were beaten, roughed up or intimidated on Wednesday. Some were attacked by unidentified men and women in civilian clothes, an Egyptian cameraman was seen being beaten by police wielding metal bars."	0651	115EGY	21893	08/11/2000	2000	11	8	1	Violence against civilians	Unidentified Armed Group (Egypt)		3	Civilians (Egypt)		7	37	Egypt	Cairo	Muski		Cairo	30.05000	31.25000	1	Agence France Press(AFP)	"Several foreign and Egyptian journalists covering the parliamentary elections in Egypt were beaten, roughed up or intimidated on Wednesday. Some were attacked by unidentified men and women in civilian clothes, an Egyptian cameraman was seen being beaten by police wielding metal bars."	0651	118EGY	21896	14/11/2000	2000	11	14	1	Riots/Protests	Police Forces of Egypt (1981-2011)		1	Rioters (Egypt)	Independent Political Candidate	5	15	Egypt	Gharbia	Qutur		Nile Delta	31.00000	31.00000	1	Reuters	Two Egyptians were killed and five wounded in a Nile Delta town in election day clashes between police and supporters of an independent candidate on Tuesday.	2651	117EGY	21895	14/11/2000	2000	11	14	1	Riots/Protests	Police Forces of Egypt (1981-2011)		1	Rioters (Egypt)		5	15	Egypt	Cairo	Zamalik		Zamalek	30.06670	31.21670	1	Agence France Press(AFP)	Four people were killed Tuesday in clashes with the police on the last and bloodiest day of voting for a new parliament.	4651	120EGY	21898	21/11/2000	2000	11	21	1	Violence against civilians	Islamist Militia (Egypt)		3	Civilians (Egypt)		7	37	Egypt	Suhag	Al-Maragha		Al Maraghah	26.70000	31.60000	1	Agence France Press(AFP)	At least ten people including policemen and employees were killed Tuesday in a bank robbery by suspected Islamic militants in southern Egypt during which automatic weapons were used.	5651	119EGY	21897	21/11/2000	2000	11	21	1	Battle-No change of territory	Islamist Militia (Egypt)		3	Police Forces of Egypt (1981-2011)		1	13	Egypt	Suhag	Al-Maragha		Al Maraghah	26.70000	31.60000	1	Agence France Press(AFP)	At least ten people including policemen and employees were killed Tuesday in a bank robbery by suspected Islamic militants in southern Egypt during which automatic weapons were used.	5651	121EGY	21899	31/12/2000	2000	12	31	1	Battle-No change of territory	Unidentified Armed Group (Egypt)		3	Police Forces of Egypt (1981-2011)		1	13	Egypt	Assiut	Al-Qusia		Assiut	27.33330	30.83330	1	Reuters	Two Egyptian policemen have been killed in southern Egypt while pursuing two gunmen. A third policeman was wounded in the shootout and the two gunmen escaped.	2651	122EGY	21900	04/02/2001	2001	2	4	1	Violence against civilians	Unidentified Armed Group (Egypt)		3	Civilians (Egypt)		7	37	Egypt	Ismailia	Ismailiyya 3		Ismailia	30.60530	32.27720	1	Reuters	"The gunmen had raided the village, stealing money, gold and livestock. They had also briefly kidnapped some men and forced them to sign contracts handing over their properties to the gang."	0651	123EGY	21901	05/02/2001	2001	2	5	1	Battle-No change of territory	Police Forces of Egypt (1981-2011)		1	Unidentified Armed Group (Egypt)		3	13	Egypt	Ismailia	Ismailiyya 3		Ismailia	30.60530	32.27720	1	Reuters	"Egyptian police killed three gunmen and arrested 10 others who attacked a village in the Nile Delta province of Ismailiya, security sources said on Monday."	3651	124EGY	21902	13/03/2001	2001	3	13	1	Violence against civilians	Unidentified Armed Group (Egypt)		3	Civilians (International)		7	37	Egypt	Luxor	Luxor		Luxor	25.68330	32.65000	1	Agence France Press(AFP)	An Egyptian tour guide has threatened to start killing four German tourists he is holding hostage if his estranged wife does not hand him back their two sons.	0651	125EGY	21903	03/04/2001	2001	4	3	1	Riots/Protests	Protesters (Egypt)	Students (Egypt)	6			0	60	Egypt	Cairo	Muski		Cairo	30.05000	31.25000	1	AP Newswire	"Some 400 students, carrying banners ""Liberation is the duty of every Muslim"" marched peacefully outside the campus of Cairo University."	0651	126EGY	21904	15/05/2001	2001	5	15	1	Riots/Protests	Rioters (Egypt)		5	Police Forces of Egypt (1981-2011)		1	15	Egypt	Luxor	Luxor		Luxor	25.68330	32.65000	1	BBC Monitoring	"A riot broke out in one of Egypt's main tourist destinations, the city of Luxor, on Tuesday, after it was reported that a local man had been killed by police. The rumour of the killing later turned out to be unfounded."	0651	127EGY	21905	28/05/2001	2001	5	28	1	Riots/Protests	Protesters (Egypt)		6			0	60	Egypt	South Sinai	Sant Katrin		Dahab	28.48330	34.53330	1	Agence France Press(AFP)	"A crowd of some 5,000 Egyptians demonstrated Monday against a government decision to evacuated their houses on the island of Dahab in the suburbs of the capital to set up tourist projects."	0651	128EGY	21906	02/06/2001	2001	6	2	1	Riots/Protests	Rioters (Egypt)	Independent Political Candidate	5	Police Forces of Egypt (1981-2011)		1	15	Egypt	Gharbia	Tanta		Gharbia	30.83330	31.00000	1	Economist Intelligence Unit	"Electoral violence: supporters of one candidate, Mohammed Sukkar, clashed with riot police in the central Delta governorate of Gharbiya on June 2nd."	0651	129EGY	21907	14/06/2001	2001	6	14	1	Riots/Protests	Rioters (Egypt)		5	Police Forces of Egypt (1981-2011)		1	15	Egypt	Shrkia	Zaqaziq 2		Zagazig	30.59140	31.51030	1	Reuters	"Hundreds of unemployed Egyptians clashed with police on Saturday in protest against restrictions which were introduced to reduce the deluge of applications for 170,000 government jobs currently on offer. . Five security police and 15 demonstrators were hurt outside local government offices in the town of Zaqaziq, 80 km (50 miles) north of Cairo, after police fired teargas and protesters threw stones."	0651	130EGY	21908	15/06/2001	2001	6	15	1	Riots/Protests	Rioters (Egypt)		5	Police Forces of Egypt (1981-2011)		1	15	Egypt	Shrkia	Zaqaziq 2		Zagazig	30.59140	31.51030	1	Reuters	"Hundreds of unemployed Egyptians clashed with police on Saturday in protest against restrictions which were introduced to reduce the deluge of applications for 170,000 government jobs currently on offer. . Five security police and 15 demonstrators were hurt outside local government offices in the town of Zaqaziq, 80 km (50 miles) north of Cairo, after police fired teargas and protesters threw stones."	0651	131EGY	21909	17/06/2001	2001	6	17	1	Riots/Protests	Protesters (Egypt)	Christian Group (Egypt)	6			0	60	Egypt	Cairo	Muski		Cairo	30.05000	31.25000	1	Reuters	"Angry Coptic Christians carrying wooden crosses and chanting religious slogans demonstrated in Cairo for the second day on Monday to protest against a newspaper article they said insulted their faith. About 1,000 protesters gathered in the compound of Cairo's cathedral."	0651	132EGY	21910	18/06/2001	2001	6	18	1	Riots/Protests	Protesters (Egypt)	Christian Group (Egypt)	6			0	60	Egypt	Cairo	Muski		Cairo	30.05000	31.25000	1	Reuters	"Angry Coptic Christians carrying wooden crosses and chanting religious slogans demonstrated in Cairo for the second day on Monday to protest against a newspaper article they said insulted their faith. About 1,000 protesters gathered in the compound of Cairo's cathedral."	0651	133EGY	21911	19/06/2001	2001	6	19	1	Riots/Protests	Protesters (Egypt)	Christian Group (Egypt)	6			0	60	Egypt	Cairo	Muski		Cairo	30.05000	31.25000	1	Reuters	"Angry Coptic Christians carrying wooden crosses and chanting religious slogans demonstrated in Cairo for the second day on Monday to protest against a newspaper article they said insulted their faith. About 1,000 protesters gathered in the compound of Cairo's cathedral."	0651	134EGY	21912	20/06/2001	2001	6	20	1	Riots/Protests	Rioters (Egypt)	Christian Group (Egypt)	5	Police Forces of Egypt (1981-2011)		1	15	Egypt	Cairo	Muski		Cairo	30.05000	31.25000	1	Agence France Press(AFP)	"Protests escalated into violence at Cairo's Coptic Cathedral where at least 70 people were hurt Wednesday night as Christians and riot police threw rocks, sticks and bottles at each other across the gates."	0651	135EGY	21913	21/06/2001	2001	6	21	1	Riots/Protests	Rioters (Egypt)	Christian Group (Egypt)	5	Police Forces of Egypt (1981-2011)		1	15	Egypt	Cairo	Muski		Cairo	30.05000	31.25000	1	Agence France Press(AFP)	"Protests escalated into violence at Cairo's Coptic Cathedral where at least 70 people were hurt Wednesday night as Christians and riot police threw rocks, sticks and bottles at each other across the gates."	0651	136EGY	21914	14/07/2001	2001	7	14	1	Battle-No change of territory	Unidentified Armed Group (Egypt)		3	Police Forces of Egypt (1981-2011)		1	13	Egypt	Cairo	Muski		Cairo	30.05000	31.25000	1	Reuters	"A student shot dead a security guard and wounded two policemen in an attack on a state security building in a north Egyptian town early on Saturday morning, officials said."	1651	137EGY	21915	22/09/2001	2001	9	22	1	Riots/Protests	Rioters (Egypt)		5	Police Forces of Egypt (1981-2011)		1	15	Egypt	Kalyoubia	Qalyub		Mit Nama	30.14610	31.23110	1	Reuters	"Protesters burned tires and hurled rocks at policemen and vehicles north of Cairo after a teenage girl died in a road accident on Saturday. Twenty-one villagers and 15 policemen were taken to hospital with injuries, they said."	0651	138EGY	21916	30/09/2001	2001	9	30	1	Riots/Protests	Protesters (Egypt)	Students (Egypt)	6			0	60	Egypt	Menoufia	Shibin al-Kum		Menoufiya	30.50000	31.00000	1	BBC Monitoring	Al-Munufiyah University students organized demonstrations on Sunday 30 September to voice their condemnation of Israel's massacre of Palestinian people.	0651	139EGY	21917	02/10/2001	2001	10	2	1	Riots/Protests	Protesters (Egypt)	Students (Egypt)	6			0	60	Egypt	Alexandria	Bab Sharqi		Alexandria	31.19810	29.91920	1	BBC Monitoring	Student demonstrations were organized inside Alexandria University yesterday to protest against the continued barbaric Israeli practices against the Palestinian people and the US support for the Jewish State.	0651	140EGY	21918	08/10/2001	2001	10	8	1	Riots/Protests	Protesters (Egypt)	Students (Egypt)	6			0	60	Egypt	Alexandria	Bab Sharqi		Alexandria	31.19810	29.91920	1	Dow Jones International News	"In Egypt more than 14,000 students protested at six universities, shouting slogans against the British and American attacks."	0651	141EGY	21919	08/10/2001	2001	10	8	1	Riots/Protests	Protesters (Egypt)	Students (Egypt)	6			0	60	Egypt	Cairo	Muski		Cairo	30.05000	31.25000	1	Dow Jones International News	"In Egypt more than 14,000 students protested at six universities, shouting slogans against the British and American attacks."	0651	142EGY	21920	08/10/2001	2001	10	8	1	Riots/Protests	Protesters (Egypt)	Students (Egypt)	6			0	60	Egypt	Shrkia	Zaqaziq 2		Zagazig	30.59140	31.51030	1	Dow Jones International News	"Protesters Monday demanded that their government condemn the start of U.S. and British strikes in Afghanistan. ""Our rulers, why are you silent? Have you got orders from America?"" students chanted at Zagazig University north of Cairo."	0651	143EGY	21921	09/10/2001	2001	10	9	1	Riots/Protests	Protesters (Egypt)	Students (Egypt)	6			0	60	Egypt	Cairo	Muski		Cairo	30.05000	31.25000	1	Agence France Press(AFP)	"Student protests escalate - . At Cairo University, around 1,500 mainly Islamist students set fire to an effigy of US President George W. Bush emblazoned with the words ""The Dog Bush,"" while shouting Allahu Akbar (God is greatest)."	0651	144EGY	21922	23/10/2001	2001	10	23	1	Riots/Protests	Protesters (Egypt)	Students (Egypt)	6			0	60	Egypt	Cairo	Marg		`Ain Shams	30.13330	31.31670	1	Agence France Press(AFP)	"Around 2,500 Egyptian university students students from Ain Shams University's teacher training faculty in northeast Cairo demonstrated in Cairo on Tuesday against the United States' military strikes on Afghanistan, police sources said."	0651	145EGY	21923	24/10/2001	2001	10	24	1	Riots/Protests	Protesters (Egypt)	Students (Egypt)	6			0	60	Egypt	Cairo	Marg		`Ain Shams	30.13330	31.31670	1	Agence France Press(AFP)	"Around 2,500 Egyptian university students students from Ain Shams University's teacher training faculty in northeast Cairo demonstrated in Cairo on Tuesday against the United States' military strikes on Afghanistan, police sources said."	0651	146EGY	21924	24/10/2001	2001	10	24	1	Riots/Protests	Protesters (Egypt)	Students (Egypt)	6			0	60	Egypt	Menoufia	Shibin al-Kum		Shibin al Kawm	30.55860	31.01000	1	Dow Jones International News	"About 1,200 Egyptian students demonstrated Wednesday to protest a planned trial of Muslim Brotherhood activists before a military tribunal."	0651	147EGY	21925	02/01/2002	2002	1	2	1	Riots/Protests	Police Forces of Egypt (1981-2011)		1	Protesters (Egypt)		6	16	Egypt	Port Said	Al-Munakh		Port Said	31.25654	32.28412	1	Dow Jones International News	"Thousands of merchants took to the streets of the Mediterranean city of Port Said in Egypt Wednesday to protest the introduction this week of higher tariffs on imported clothes. At least 5,000 merchants Wednesday pulled down their shutters and gathered outside the local governor's office in downtown Port Said to protest the move."	0651	148EGY	21926	06/01/2002	2002	1	6	1	Riots/Protests	Rioters (Egypt)		5	Police Forces of Egypt (1981-2011)		1	15	Egypt	Port Said	Al-Munakh		Port Said	31.25654	32.28412	1	BBC	"Riot police arrested 14 persons who infiltrated into a peaceful march protesting the latest additional customs tariff imposed on ready-made imports. Rioters burnt down pro-customs-rise cloth signs hung in the the city plaza and hurled stones at the Chamber of Commerce, which is adjacent to the Town Hall building."	0651	149EGY	21927	08/01/2002	2002	1	8	1	Riots/Protests	Rioters (Egypt)		5	Police Forces of Egypt (1981-2011)		1	15	Egypt	Port Said	Al-Munakh		Port Said	31.25654	32.28412	1	Agence France Press(AFP)	"Police have arrested 138 people after Egyptian traders in this Mediterranean city staged a violent protest over the revocation of duty-free privileges, judicial sources said Tuesday."	0651	150EGY	21928	10/02/2002	2002	2	10	1	Battle-No change of territory	Muslim Militia (Egypt)		4	Christian Militia (Egypt)		4	44	Egypt	Menia	Kesm Al-minya		Minya	28.11940	30.74440	1	Reuters	"Muslims in a southern Egyptian town clashed with Coptic Christians on Sunday after complaining that their new church bell was too loud, ending an eight-month period of sectarian calm, security sources said."	0651	151EGY	21929	11/02/2002	2002	2	11	1	Battle-No change of territory	Muslim Militia (Egypt)		4	Christian Militia (Egypt)		4	44	Egypt	Damietta	Kafr Sad		As Sawalim	31.27500	31.65440	1	Agence France Press(AFP)	"A Christian police auxiliary killed his Muslim colleague during a squabble in Upper Egypt on Monday, the day after Christians and Muslims clashed in a nearby village over the construction of a church, police sources said."	1651	152EGY	21930	05/03/2002	2002	3	5	1	Riots/Protests	Protesters (Egypt)	Students (Egypt)	6			0	60	Egypt	Alexandria	Bab Sharqi		Alexandria	31.19810	29.91920	1	Dow Jones International News	"In the Mediterranean city of Alexandria, about 8,000 students burned the flags and posters with pictures of Israeli Prime Minister Ariel Sharon and U.S. President George W. Bush."	0651	153EGY	21931	05/03/2002	2002	3	5	1	Riots/Protests	Protesters (Egypt)	Students (Egypt)	6			0	60	Egypt	Cairo	Muski		Cairo	30.05000	31.25000	1	Dow Jones International News	"Thousands of Egyptian students burned U.S. and Israeli flags on Tuesday to protest one of the sharpest escalations in Palestinian-Israeli violence across the border. Protests were held at Cairo's All-Star University, which is affiliated with Al-Azhar Institute, the foremost Islamic authority in the Sunni Muslim world."	0651	154EGY	21932	05/03/2002	2002	3	5	1	Riots/Protests	Protesters (Egypt)	Students (Egypt)	6			0	60	Egypt	Qena	Naqada		Qena	25.83330	32.75000	1	Dow Jones International News	"Thousands of Egyptian students burned U.S. and Israeli flags on Tuesday to protest one of the sharpest escalations in Palestinian-Israeli violence across the border. Protests were held on the campus in Qena province, about 430 kilometers (270 miles) south of Cairo, where about 600 students demonstrated against Israel."	0651	155EGY	21933	12/03/2002	2002	3	12	1	Riots/Protests	Protesters (Egypt)	Students (Egypt)	6	Police Forces of Egypt (1981-2011)		1	16	Egypt	Cairo	Muski		Cairo	30.05000	31.25000	1	AP News Wire	"Around 1,000 protesting university students saying their religion is under attack around the world streamed out of Cairo University and marched on the nearby Israeli Embassy, where they were pushed back by hundreds of baton-wielding riot police."	0651	156EGY	21934	14/03/2002	2002	3	14	1	Riots/Protests	Protesters (Egypt)		6			0	60	Egypt	Alexandria	Bab Sharqi		Alexandria	31.19810	29.91920	1	Agence France Press(AFP)	"In Egypt, a rally Thursday in the Mediterranean port city of Alexandria finished off a week of protests throughout the country that followed March 8, or ""Black Friday,"" in which 36 Palestinians were killed."	0651	157EGY	21935	15/03/2002	2002	3	15	1	Riots/Protests	Protesters (Egypt)		6			0	60	Egypt	Alexandria	Bab Sharqi		Alexandria	31.19810	29.91920	1	Agence France Press(AFP)	"In Egypt, a rally Thursday in the Mediterranean port city of Alexandria finished off a week of protests throughout the country that followed March 8, or ""Black Friday,"" in which 36 Palestinians were killed."	0651	158EGY	21936	18/03/2002	2002	3	18	1	Riots/Protests	Protesters (Egypt)	Students (Egypt)	6			0	60	Egypt	Cairo	Muski		Cairo	30.05000	31.25000	1	AP Newswire	"About 3,000 students from Cairo's Al-Azhar University protested against Israel on Monday, burning pictures of Israeli Prime Minister Ariel Sharon."	0651	159EGY	21937	18/03/2002	2002	3	18	1	Riots/Protests	Protesters (Egypt)	Students (Egypt)	6			0	60	Egypt	Cairo	Muski		Cairo	30.05000	31.25000	1	AP Newswire	"Angered by Palestinian deaths, hundreds of students at the American University in Cairo on Monday demonstrated against an ""Arab apathy"" and called on their leaders to take concrete steps at an upcoming Arab summit to help the Palestinians."	0651	160EGY	21938	27/03/2002	2002	3	27	1	Riots/Protests	Protesters (Egypt)		6			0	60	Egypt	Cairo	Muski		Cairo	30.05000	31.25000	1	AP Newswire	"Fearing that an Arab summit may pave the way for normal ties with Israel, thousands across the Arab world demonstrated Wednesday, with some calling for fighting, rather than offering peace, with the Jewish state."	0651	161EGY	21939	29/03/2002	2002	3	29	1	Riots/Protests	Protesters (Egypt)	Students (Egypt)	6			0	60	Egypt	Cairo	Muski		Cairo	30.05000	31.25000	1	Agence France Press(AFP)	"Around 1,000 students at a military secondary school in the south Cairo suburb of Maadi demonstrated on the street outside, calling for the expulsion of Israel's ambassador to Cairo and for Arab states to ""open the door of jihad (holy war),"" the police sources said."	0651	162EGY	21940	29/03/2002	2002	3	29	1	Riots/Protests	Protesters (Egypt)		6			0	60	Egypt	Cairo	Muski		Cairo	30.05000	31.25000	1	Agence France Press(AFP)	"More than 3,000 worshippers demonstrated Friday in central Cairo's Al-Azhar mosque against Israel and its occupation of the West Bank town of Ramallah, calling for the expulsion of the Israeli ambassador, police sources said. Around 3,000 men and 400 women gathered in the mosque's interior after Friday prayers and shouted slogans before peacefully dispersing, the source said."	0651	163EGY	21941	30/03/2002	2002	3	30	1	Riots/Protests	Protesters (Egypt)	Students (Egypt)	6	Police Forces of Egypt (1981-2011)		1	16	Egypt	Cairo	Muski		Cairo	30.05000	31.25000	1	Agence France Press(AFP)	"1,000 students at a south Cairo secretarial school demonstrated on the streets outside, dispersing when police arrived, the source said."	0651	164EGY	21942	30/03/2002	2002	3	30	1	Riots/Protests	Protesters (Egypt)	Students (Egypt)	6			0	60	Egypt	Cairo	Muski		Cairo	30.05000	31.25000	1	Agence France Press(AFP)	"Some 500 students at the engineering faculty of Cairo University demonstrated on campus, burning an Israeli flag, witnesses said. "	0651	166EGY	21944	31/03/2002	2002	3	31	1	Riots/Protests	Protesters (Egypt)	Students (Egypt)	6			0	60	Egypt	Cairo	Muski		Cairo	30.05000	31.25000	1	Agence France Press(AFP)	"In Egypt, students rallied at most of the country's major university campuses, while primary and secondary pupils staged small demonstrations throughout Cairo in defiance of a normally strictly-enforced ban on street protests. The largest demonstration drew 12,000 protestors at the Islamic university of Al Azhar in Cairo, where professors and university officials joined with the students."	0651	167EGY	21945	31/03/2002	2002	3	31	1	Riots/Protests	Protesters (Egypt)	Students (Egypt)	6			0	60	Egypt	Kafr El-Shikh	Kafr Al-Shaykh		Kafr el Sheikh	31.11140	30.93640	1	Agence France Press(AFP)	"In Egypt, students rallied at most of the country's major university campuses, while primary and secondary pupils staged small demonstrations throughout Cairo in defiance of a normally strictly- enforced ban on street protests. 6,000 students demonstrated in the Nile Delta university of Kafr al- Sheikh, organisers said."	0651	165EGY	21943	31/03/2002	2002	3	31	1	Riots/Protests	Rioters (Egypt)	Students (Egypt)	5			0	50	Egypt	Cairo	Muski		Cairo	30.05000	31.25000	1	Agence France Press(AFP)	"In Cairo, secondary school students threw rocks at a McDonald's restaurant, damaging the windows."	0651	168EGY	21946	01/04/2002	2002	4	1	1	Riots/Protests	Protesters (Egypt)		6			0	60	Egypt	Alexandria	Bab Sharqi		Alexandria	31.19810	29.91920	1	AP Newswire	"In Alexandria, Egypt, about 10,000 people gathered in support of the Palestinians."	0651	169EGY	21947	01/04/2002	2002	4	1	1	Riots/Protests	Rioters (Egypt)		5			0	50	Egypt	Cairo	Muski		Cairo	30.05000	31.25000	1	AP Newswire	Thirty protesters were arrested and nine police officers were struck by stones. Sixteen protesters - most suffering the effects of tear gas - were hospitalized after the clashes.	0651	170EGY	21948	02/04/2002	2002	4	2	1	Riots/Protests	Protesters (Egypt)	Students (Egypt)	6	Police Forces of Egypt (1981-2011)		1	16	Egypt	Alexandria	Bab Sharqi		Alexandria	31.19810	29.91920	1	Agence France Press(AFP)	"Police reinforcements were also deployed to monitor anti-Israeli rallies elsewhere in Cairo and in other Egyptian cities, including a peaceful protest by some 6,000 students at Alexandria University in the Nile Delta."	0651	171EGY	21949	02/04/2002	2002	4	2	1	Riots/Protests	Protesters (Egypt)	Students (Egypt)	6			0	60	Egypt	Cairo	Muski		Cairo	30.05000	31.25000	1	Agence France Press(AFP)	"Egyptian police using batons, water cannon and tear gas clashed Tuesday with students demanding tough Arab action against Israel's military campaign against the Palestinians, leaving 17 people on both sides injured."	0651	172EGY	21950	03/04/2002	2002	4	3	1	Riots/Protests	Protesters (Egypt)	Students (Egypt)	6			0	60	Egypt	Cairo	Marg		`Ain Shams	30.13330	31.31670	1	Agence France Press(AFP)	"Egyptian students continued a week of protest Wednesday with rallies at three universities in Cairo, demanding the expulsion of the Israeli ambassador to Egypt and protesting Arab governments lack of response to Israel's offensive in the Palestinian territories, police sources said. 5,000 students demonstrated at Ain Shams campus."	0651	173EGY	21951	03/04/2002	2002	4	3	1	Riots/Protests	Protesters (Egypt)	Students (Egypt)	6			0	60	Egypt	Cairo	Muski		Cairo	30.05000	31.25000	1	Agence France Press(AFP)	"Egyptian students continued a week of protest Wednesday with rallies at three universities in Cairo, demanding the expulsion of the Israeli ambassador to Egypt and protesting Arab governments lack of response to Israel's offensive in the Palestinian territories, police sources said. 3,000 students demonstrated at Cairo University."	0651	174EGY	21952	03/04/2002	2002	4	3	1	Riots/Protests	Protesters (Egypt)	Students (Egypt)	6			0	60	Egypt	Cairo	Muski		Cairo	30.05000	31.25000	1	Agence France Press(AFP)	"Egyptian students continued a week of protest Wednesday with rallies at three universities in Cairo, demanding the expulsion of the Israeli ambassador to Egypt and protesting Arab governments lack of response to Israel's offensive in the Palestinian territories, police sources said. Secondary school students marched outside their campuses on eastern Cairo's Faisal street."	0651	175EGY	21953	03/04/2002	2002	4	3	1	Riots/Protests	Protesters (Egypt)	Students (Egypt)	6			0	60	Egypt	Cairo	Muski		Cairo	30.05000	31.25000	1	Agence France Press(AFP)	"Six thousand students ralled inside the Islamic university of Al Azhar, shouting ""Where is the Arab army?"""	0651	176EGY	21954	04/04/2002	2002	4	4	1	Riots/Protests	Protesters (Egypt)	Students (Egypt)	6			0	60	Egypt	Aswan	Zemam Out		Aswan	23.08330	32.66670	1	Agence France Press(AFP)	"Almost 4,000 students at a university in Aswan, southern Egypt, held a peaceful demonstration during which the Israeli flag was burnt while protesters demanded the closure of Israel's embassy in Cairo, police said."	0651	177EGY	21955	04/04/2002	2002	4	4	1	Riots/Protests	Protesters (Egypt)		6			0	60	Egypt	Cairo	Muski		Cairo	30.05000	31.25000	1	Agence France Press(AFP)	"In Cairo, police said they dispersed without incident almost 200 demonstrators holding a protest in front of a synagogue in the centre of town."	0651	178EGY	21956	05/04/2002	2002	4	5	1	Riots/Protests	Protesters (Egypt)		6			0	60	Egypt	Alexandria	Bab Sharqi		Alexandria	31.19810	29.91920	1	AP Newswire	"Arabs demonstrated in the thousands Friday against Israel's offensive in the Palestinian territories. Palestinian supporters also rallied in the north Egyptian city of Alexandria, Bahrain, Lebanon and Iran as Israel's offensive in the West Bank entered its second week"	0651	179EGY	21957	05/04/2002	2002	4	5	1	Riots/Protests	Protesters (Egypt)		6			0	60	Egypt	Cairo	Muski		Cairo	30.05000	31.25000	1	AP Newswire	"Some 2000 protesters at Al-Azhar Mosque, Egypt's top Islamic institute, called for military intervention, chanting: ""One, two, where is the Arab army?"""	0651	180EGY	21958	05/04/2002	2002	4	5	1	Riots/Protests	Rioters (Egypt)		5	Police Forces of Egypt (1981-2011)		1	15	Egypt	South Sinai	Nuweiba		Sinai Peninsula	29.50000	34.00000	1	Agence France Press(AFP)	"In the town of Al-Arich on the Sinai peninsula Egyptian police intervened with teargas against some 6,000 protesters who loudly decried Israeli ""murders"" and threw stones against security forces."	0651	181EGY	21959	06/04/2002	2002	4	6	1	Riots/Protests	Protesters (Egypt)		6			0	60	Egypt	Cairo	Muski		Cairo	30.05000	31.25000	1	CPR Newswire	"As the foreign ministers took their places in the Arab League conference room, about 20 people demonstrated outside the League building in central Cairo."	0651	183EGY	21961	09/04/2002	2002	4	9	1	Violence against civilians	Protesters (Egypt)	Students (Egypt)	6	Police Forces of Egypt (1981-2011)		1	16	Egypt	Alexandria	Bab Sharqi		Alexandria	31.19810	29.91920	1	Agence France Press(AFP)	"Riot police in the Egyptian city of Alexandria fired water cannon and tear gas at students protesting a visit to Cairo by US Secretary of State Colin Powell, injuring scores of people, witnesses and police said. Police opened fire when nearly 7,000 students left the Alexandria University campus in direction of the nearby US cultural center."	1651	182EGY	21960	09/04/2002	2002	4	9	1	Riots/Protests	Protesters (Egypt)		6			0	60	Egypt	Alexandria	Bab Sharqi		Alexandria	31.19810	29.91920	1	Agence France Press(AFP)	"Also in Alexandria, hundreds of professional union members demonstrated Tuesday on the seaside thoroughfare with banners denouncing Israel's attacks and Powell's visit."	0651	187EGY	21965	10/04/2002	2002	4	10	1	Riots/Protests	Protesters (Egypt)		6	Police Forces of Egypt (1981-2011)		1	16	Egypt	Gharbia	Qutur		Nile Delta	31.00000	31.00000	1	Agence France Press(AFP)	"Around 3,000 people also demonstrated Wednesday in the Egyptian province of Menufiya in the Nile Delta, police sources said."	0651	185EGY	21963	10/04/2002	2002	4	10	1	Riots/Protests	Protesters (Egypt)	Students (Egypt)	6			0	60	Egypt	Alexandria	Bab Sharqi		Alexandria	31.19810	29.91920	1	AP Newswire	"Tight security was evident around the university campus Wednesday where some 3,000 students gathered peacefully. Some dozen truckloads of riot police parked near the university."	0651	186EGY	21964	10/04/2002	2002	4	10	1	Riots/Protests	Protesters (Egypt)	Students (Egypt)	6			0	60	Egypt	Cairo	Muski		Cairo	30.05000	31.25000	1	AP Newswire	Thousands of students protested at other universities in Cairo and outside the Egyptian capital.	0651	184EGY	21962	10/04/2002	2002	4	10	1	Riots/Protests	Rioters (Egypt)	Students (Egypt)	5	Police Forces of Egypt (1981-2011)		1	15	Egypt	Alexandria	Bab Sharqi		Alexandria	31.19810	29.91920	1	Agence France Press(AFP)	"Around 2,500 Egyptian students here Wednesday smashed through a campus gate and hurled stones at police in an anti-Israeli protest, fueled on by the death of a fellow student. More than 200 people, mainly students but also around 40 policemen, were wounded and taken to three hospitals in Alexandria, hospital officials said."	0651	188EGY	21966	19/04/2002	2002	4	19	1	Riots/Protests	Protesters (Egypt)		6			0	60	Egypt	Cairo	Muski		Cairo	30.05000	31.25000	1	Agence France Press(AFP)	"Some 2,000 Muslims staged a demonstration in Cairo's Al-Azhar mosque Friday, to protest against the Israeli offensive in the West Bank."	0651	189EGY	21967	23/04/2002	2002	4	23	1	Riots/Protests	Protesters (Egypt)	Students (Egypt)	6			0	60	Egypt	Kafr El-Shikh	Kafr Al-Shaykh		Kafr el Sheikh	31.11140	30.93640	1	Agence France Press(AFP)	"Nearly 1,500 university students at Kafr El-Sheikh staged an anti-Israeli protest, police and organizers said."	0651	190EGY	21968	23/04/2002	2002	4	23	1	Riots/Protests	Protesters (Egypt)	Students (Egypt)	6			0	60	Egypt	Shrkia	Zaqaziq 2		Zagazig	30.59140	31.51030	1	Agence France Press(AFP)	"More than 4,000 students at Zagazig University in the Nile Delta protested on campus against the Israeli ""offensive"" in the Palestinian territories."	0651	191EGY	21969	15/05/2002	2002	5	15	1	Riots/Protests	Protesters (Egypt)	Muslim Brotherhood	6			0	60	Egypt	Alexandria	Bab Sharqi		Alexandria	31.19810	29.91920	1	Agence France Press(AFP)	"More than 5,000 people demonstrated Wednesday to mark the anniversary of what the Palestinians call the ""catastrophe"" of Israel's creation in 1948. The protestors were mostly members of the banned but tolerated Muslim Brotherhood."	0651	192EGY	21970	15/05/2002	2002	5	15	1	Riots/Protests	Protesters (Egypt)		6			0	60	Egypt	Cairo	Muski		Cairo	30.05000	31.25000	1	Agence France Press(AFP)	"In Cairo, around 1,000 Egyptians staged a protest in solidarity with the Palestinians."	0651	193EGY	21971	27/06/2002	2002	6	27	1	Non-violent activity by a conflict actor	Muslim Brotherhood		3	NDP: National Democratic Party	Police Forces of Egypt (1981-2011)	3	33	Egypt	Alexandria	Bab Sharqi		Alexandria	31.19810	29.91920	1	Agence France Press(AFP)	More than 200 supporters of the Muslim Brotherhood were arrested after scuffles during parliamentary by-elections Thursday in Alexandria.	0651	194EGY	21972	26/07/2002	2002	7	26	1	Riots/Protests	Protesters (Egypt)		6			0	60	Egypt	Cairo	Muski		Cairo	30.05000	31.25000	1	Agence France Press(AFP)	"Protests broke out in Jordan and Egypt Friday over Israel's deadly air raid on Gaza City, with about 1,000 Egyptians calling Israelis ""enemies of God"" at Cairo's Al- Azhar university, the highest authority in Sunni Islam."	0651	195EGY	21973	10/08/2002	2002	8	10	1	Battle-No change of territory	Militia (Abdel Halim)		3	Hunayshat Ethnic Militia (Egypt)		4	34	Egypt	Suhag	Al-Minshat		Girga	26.50000	31.75000	1	Reuters	Twenty-two members of a single Egyptian clan died on Saturday when another family mounted a revenge attack for the killing of one of their people.	22651	196EGY	21974	27/11/2002	2002	11	27	1	Riots/Protests	Rioters (Egypt)		5	Police Forces of Egypt (1981-2011)		1	15	Egypt	Cairo	Muski		Cairo	30.05000	31.25000	1	Agence France Press(AFP)	"Villagers rioted Wednesday after a hit-and- run driver killed two teenage girls on a road north of Cairo, police said. The two were killed crossing near the village of Sendeyon, around 30 kilometers (18 miles) north of Cairo, when they were hit by a car."	0651	197EGY	21975	21/12/2002	2002	12	21	1	Riots/Protests	Protesters (Egypt)		6			0	60	Egypt	Cairo	Muski		Cairo	30.05000	31.25000	1	Agence France Press(AFP)	Hundreds of people chanting anti-American and anti-Israeli slogans demonstrated outside the Qatari embassy in Cairo Saturday to protest a new military agreement between the emirate and the United States.	0651	198EGY	21976	02/01/2003	2003	1	2	1	Non-violent activity by a conflict actor	Police Forces of Egypt (1981-2011)		1	Muslim Brotherhood		3	13	Egypt	Cairo	Muski		Cairo	30.05000	31.25000	1	"Reuters News 02 January 2003 15:28 GMT, Associated Press Newswires/ Associated Press Writer 02 January 2003 20:19 GMT"	"Police arrested 13 alleged members of Egypt's banned Muslim Brotherhood.Ten of the men were arrested while holding an ""organizational meeting"" in the northern Cairo suburb of Zeitoun."	0651	199EGY	21977	20/03/2003	2003	3	20	1	Riots/Protests	Protesters (Egypt)		6			0	60	Egypt	Cairo	Muski		Cairo	30.05000	31.25000	1	Agence France Press(AFP)	"Anti-Iraq war protests across Middle East countries.In Cairo, around 100 demonstrators and policemen suffered minor injuries when around 1,000 people, many of them students at the American University in Cairo, rallied in defiance of an emergency law that bans street demonstrations. "	0651	200EGY	21978	21/03/2003	2003	3	21	1	Riots/Protests	Protesters (Egypt)		6			0	60	Egypt	Cairo	Muski		Cairo	30.05000	31.25000	1	Agence France Press(AFP)	"Anti-Iraq war protests across Middle East countries.In Cairo, around 100 demonstrators and policemen suffered minor injuries when around 1,000 people, many of them students at the American University in Cairo, rallied in defiance of an emergency law that bans street demonstrations. "	0651	201EGY	21979	18/04/2003	2003	4	18	1	Non-violent activity by a conflict actor	Police Forces of Egypt (1981-2011)		1	Muslim Brotherhood		3	13	Egypt	Behera	Damanhur		Damanhour	31.03917	30.46914	1	Reuters	10 alleged members of the Muslim brotherhood were arrested on the accusation that they tried to revive the group's activity.	0651	202EGY	21980	21/04/2003	2003	4	21	1	Non-violent activity by a conflict actor	Police Forces of Egypt (1981-2011)		1	Muslim Brotherhood		3	13	Egypt	Alexandria	Bab Sharqi		Alexandria	31.19810	29.91920	1	"Associated Press Newswires 22 April 2003 12:56 GMT, BBC Monitoring Middle East 23 April 2003 17:43 GMT"	Police have arrested 11 leading members of Egypt's outlawed Muslim Brotherhood in an ongoing crackdown against the organization.	0651	203EGY	21981	04/06/2003	2003	6	4	1	Non-violent activity by a conflict actor	Police Forces of Egypt (1981-2011)		1			0	10	Egypt	Menoufia	Shibin al-Kum		Menoufiya	30.50000	31.00000	1	"Associated Press Newswires/ Associated Press Writer 05 June 2003 18:00 GMT, Dow Jones International News 05 June 2003 23:01 GMT"	"Police have arrested 12 alleged members of Egypt's banned Muslim Brotherhood group.Those arrested include medical doctors, engineers, university professors, pharmacists and a candidate in the 2000 parliamentary elections.Exact location: town of Menoufia."	0651	204EGY	21982	22/08/2003	2003	8	22	1	Non-violent activity by a conflict actor	Police Forces of Egypt (1981-2011)		1	Muslim Brotherhood		3	13	Egypt	Port Said	Al-Munakh		Port Said	31.25654	32.28412	1	Agence France Press(AFP)	"Two students, members of the Brotherhood, were arrested andplaced in custody."	0651	205EGY	21983	23/08/2003	2003	8	23	1	Non-violent activity by a conflict actor	Police Forces of Egypt (1981-2011)		1	Al-Gama'a al-Islamiyya 		2	12	Egypt	Cairo	Muski		Cairo	30.05000	31.25000	1	Agence France Press(AFP)	"Egyptian security services have arrested 37 suspected members of the banned group Jamaa Islamiya for trying to reignite violence, as well as 2 members of the Muslim Brotherhood."	0651	206EGY	21984	28/08/2003	2003	8	28	1	Non-violent activity by a conflict actor	Police Forces of Egypt (1981-2011)		1	Muslim Brotherhood		3	13	Egypt	Cairo	Muski		Cairo	30.05000	31.25000	1	"Associated Press Newswires 28 August 2003 14:12 GMT, Agence France Presse 28 August 2003"	Egyptian authorities arrested and ordered 9 members of the outlawed Muslim Brotherhood group detained for 15 days on suspicion of inciting the public against the country's government.	0651	207EGY	21985	08/09/2003	2003	9	8	1	Non-violent activity by a conflict actor	Police Forces of Egypt (1981-2011)		1	Muslim Brotherhood		3	13	Egypt	Behera	Damanhur		Damanhour	31.03917	30.46914	1	Agence France Press(AFP)	"Seven members of the Muslim Brotherhood, including a former member of parliament were arrested, while they were gathering at the former MP's house.They were accused of trying to revive the group's activities."	0651	208EGY	21986	09/12/2003	2003	12	9	1	Non-violent activity by a conflict actor	Police Forces of Egypt (1981-2011)		1	Muslim Brotherhood		3	13	Egypt	Fayoum	Fayyum		Fayyum	29.31670	30.80000	1	Associated Press Newswires 09 December 2003 18:32 GMT	"Police have arrested 23 students of the College of Education in Fayoum who belong to the banned Muslim Brotherhood group, accusing them of insulting the college dean and inciting a disturbance."	0651	209EGY	21987	10/12/2003	2003	12	10	1	Non-violent activity by a conflict actor	Police Forces of Egypt (1981-2011)		1	Muslim Brotherhood		3	13	Egypt	Alexandria	Bab Sharqi		Alexandria	31.19810	29.91920	1	"Associated Press Newswires 11 December 2003 17:29 GMT,Dow Jones International News 11 December 2003 17:45 GMT, Xinhua News Agency 12 December 2003"	"Police have arrested 14 members of the Muslim Brotherhood group.The men were arrested Wednesday night in the capital, Cairo, the Mediterranean city of Alexandria and the Nile Delta Dakahlia province.The group confirmed only the arrests taking place in Dakalia.Last source mentions that 9 were arrested in the Mediterranean port city of Alexandria, one in Cairo and four in the Delta city of Dakahlia.The eventis coded 3 times to differentiate between the 3 locations."	0651	210EGY	21988	10/12/2003	2003	12	10	1	Non-violent activity by a conflict actor	Police Forces of Egypt (1981-2011)		1	Muslim Brotherhood		3	13	Egypt	Cairo	Muski		Cairo	30.05000	31.25000	1	"Associated Press Newswires 11 December 2003 17:29 GMT,Dow Jones International News 11 December 2003 17:45 GMT, Xinhua News Agency 12 December 2003"	"Police have arrested 14 members of the Muslim Brotherhood group.The men were arrested Wednesday night in the capital, Cairo, the Mediterranean city of Alexandria and the Nile Delta Dakahlia province.The group confirmed only the arrests taking place in Dakalia.Last source mentions that 9 were arrested in the Mediterranean port city of Alexandria, one in Cairo and four in the Delta city of Dakahlia.The eventis coded 3 times to differentiate between the 3 locations."	0651	211EGY	21989	10/12/2003	2003	12	10	1	Non-violent activity by a conflict actor	Police Forces of Egypt (1981-2011)		1	Muslim Brotherhood		3	13	Egypt	Dakahlia	Sinbillawin		Dakahlieh	30.91670	31.50000	1	"Associated Press Newswires 11 December 2003 17:29 GMT,Dow Jones International News 11 December 2003 17:45 GMT, Xinhua News Agency 12 December 2003"	"Police have arrested 14 members of the Muslim Brotherhood group.The men were arrested Wednesday night in the capital, Cairo, the Mediterranean city of Alexandria and the Nile Delta Dakahlia province.The group confirmed only the arrests taking place in Dakalia.Last source mentions that 9 were arrested in the Mediterranean port city of Alexandria, one in Cairo and four in the Delta city of Dakahlia.The eventis coded 3 times to differentiate between the 3 locations."	0651	212EGY	21990	15/12/2003	2003	12	15	1	Non-violent activity by a conflict actor	Police Forces of Egypt (1981-2011)		1			0	10	Egypt	Ismailia	Ismailiyya 3		Ismailia	30.60530	32.27720	1	Agence France Press(AFP)	"18 members of the Muslim Brotherhood were arrested on suspicion of trying to ""revive the activities of a banned"" group.The arrested were mostly medical doctors, engineers and teachers."	0651	213EGY	21991	16/05/2004	2004	5	16	1	Non-violent activity by a conflict actor	Police Forces of Egypt (1981-2011)		1	Muslim Brotherhood		3	13	Egypt	Alexandria	Bab Sharqi		Alexandria	31.19810	29.91920	1	"Associated Press Newswires/ Associated Press Writer 16 May 2004 14:56 GMT,Reuters News 16 May 2004 13:45 GMT, Dow Jones International News 16 May 2004 17:16 GMT,Agence France Presse 18 May 2004 11:26 GMT"	16 members of the Muslim Brotherhood were arrested in the city of Alexandria before dawn.	0651	214EGY	21992	16/05/2004	2004	5	16	1	Non-violent activity by a conflict actor	Police Forces of Egypt (1981-2011)		1	Muslim Brotherhood		3	13	Egypt	Cairo	Muski		Cairo	30.05000	31.25000	1	"Associated Press Newswires/ Associated Press Writer 16 May 2004 14:56 GMT,Reuters News 16 May 2004 13:45 GMT, Dow Jones International News 16 May 2004 17:16 GMT,Agence France Presse 18 May 2004 11:26 GMT"	2 members of the Brotherhood were arrested.	0651	215EGY	21993	16/05/2004	2004	5	16	1	Non-violent activity by a conflict actor	Police Forces of Egypt (1981-2011)		1	Muslim Brotherhood		3	13	Egypt	Dakahlia	Sinbillawin		Dakahlieh	30.91670	31.50000	1	"Associated Press Newswires/ Associated Press Writer 16 May 2004 14:56 GMT, Dow Jones International News 16 May 2004 17:16 GMT, Agence France Presse 18 May 2004 11:26 GMT"	9 Brotherhood members were arrested.	0651	216EGY	21994	16/05/2004	2004	5	16	1	Non-violent activity by a conflict actor	Police Forces of Egypt (1981-2011)		1	Muslim Brotherhood		3	13	Egypt	Gharbia	Tanta		Gharbia	30.83330	31.00000	1	"Associated Press Newswires/ Associated Press Writer 16 May 2004 14:56 GMT, Dow Jones International News 16 May 2004 17:16 GMT,Agence France Presse 18 May 2004 11:26 GMT"	9 members of the brotherhood were arrested.	0651	217EGY	21995	16/05/2004	2004	5	16	1	Non-violent activity by a conflict actor	Police Forces of Egypt (1981-2011)		1	Muslim Brotherhood		3	13	Egypt	Menoufia	Shibin al-Kum		Menoufiya	30.50000	31.00000	1	"Associated Press Newswires/ Associated Press Writer 16 May 2004 14:56 GMT, Dow Jones International News 16 May 2004 17:16 GMT, Agence France Presse 18 May 2004 11:26 GMT"	5 Brotherhood members were arrested.	0651	218EGY	21996	25/07/2004	2004	7	25	1	Non-violent activity by a conflict actor	Police Forces of Egypt (1981-2011)		1	Civilians (Egypt)		7	17	Egypt	Behera	Abu-l-Matamir		Beheira	30.98330	30.20000	1	Reuters	"The police has arrested seven men on suspicion of belonging to a banned Muslim militant group remembered for killing an Egyptian minister in the 1970s, called Takfir wal-Higra."	0651	219EGY	21997	17/09/2004	2004	9	17	1	Non-violent activity by a conflict actor	Police Forces of Egypt (1981-2011)		1	Civilians (Egypt)	Muslim Brotherhood	7	17	Egypt	Dakahlia	Sinbillawin		Dakahlieh	30.91670	31.50000	1	"Associated Press Newswires 18 September 2004 19:29 GMT, Reuters News 18 September 2004 16:08 GMT,Dow Jones International News 18 September 2004 20:18 GMT"	2 alleged members of the Muslim Brotherhood were arrested.	0651	220EGY	21998	17/09/2004	2004	9	17	1	Non-violent activity by a conflict actor	Police Forces of Egypt (1981-2011)		1	Civilians (Egypt)	Muslim Brotherhood	7	17	Egypt	Shrkia	Faqus		Sharqiya	30.80000	31.80000	1	"Associated Press Newswires 18 September 2004 19:29 GMT, Reuters News 18 September 2004 16:08 GMT,Dow Jones International News 18 September 2004 20:18 GMT"	"9 alleged members of the Muslim Brotherhood were arrested after they returned to their homes from ""an organizational meeting""."	0651	221EGY	21999	07/10/2004	2004	10	7	1	Remote violence	Unidentified Armed Group (Egypt)		3	Civilians (Egypt)		7	37	Egypt	South Sinai	Nuweiba		Sinai Peninsula	29.50000	34.00000	1	Agence France Press(AFP)	"An explosion ripped through the Taba Hilton, a vast hotel between the shores of the Red Sea and the mountains of the Sinai peninsula. This bomb attack was followed by two more blasts in a resort farther south down the coast. The attack targeted Israeli tourists and it was claimed by several terorist organizations:Brigades of the Martyr Abdullah Azzam , Jamaa Al-Islamiya Al-Alamiya (World Islamist Group), Islamic Unity Brigades. More than 100 people were injured."	28651	222EGY	22000	09/11/2004	2004	11	9	1	Non-violent activity by a conflict actor	Muslim Brotherhood		3			0	30	Egypt	Cairo	Muski		Cairo	30.05000	31.25000	1	"Associated Press Newswires/Associated Press Writer 09 November 2004 13:58 GMT, Dow Jones International News 09 November 2004 14:05 GMT"	10 leading members of the Muslim Brotherhood were released after spending 3 years in prison.	0651	223EGY	22001	10/11/2004	2004	11	10	1	Non-violent activity by a conflict actor	Muslim Brotherhood		3			0	30	Egypt	Cairo	Muski		Cairo	30.05000	31.25000	1	Dow Jones International News 10 November 2004 14:55 GMT	60 alleged members of the banned Muslim Brotherhood group who had been detained for six months for belonging to an outlawed organization were released.	0651	224EGY	22002	31/01/2005	2005	1	31	1	Non-violent activity by a conflict actor	Police Forces of Egypt (1981-2011)		1	Civilians (Egypt)	Muslim Brotherhood	7	17	Egypt	Shrkia	Zaqaziq 2		Zagazig	30.59140	31.51030	1	Dow Jones International News 31 January 2005 22:45 GMT	9alleged members of the Muslim Brotherhood group were arrested in pre-dawn raids.	0651	225EGY	22003	31/01/2005	2005	1	31	1	Riots/Protests	Protesters (Egypt)		6			0	60	Egypt	Suez	Al-Arbiin		Suez and El-Arish	29.98330	32.55000	1	Africa Research Bulletin	"""In late January the police clashed with"	0651	226EGY	22004	01/02/2005	2005	2	1	1	Battle-No change of territory	Police Forces of Egypt (1981-2011)		1	Unidentified Armed Group (Egypt)		3	13	Egypt	South Sinai	Sant Katrin		"Sinai, Mount"	28.53780	33.97440	1	Africa Research Bulletin	Egyptian security forces clashed with	0651	227EGY	22005	21/02/2005	2005	2	21	1	Riots/Protests	Protesters (Egypt)		6			0	60	Egypt	Cairo	Muski		Cairo	30.05000	31.25000	1	Africa Research Bulletin	Large street demonstrations following the announcement of that competitive elections might become a reality in Egypt.	0651	228EGY	22006	27/03/2005	2005	3	27	1	Non-violent activity by a conflict actor	Police Forces of Egypt (1981-2011)		1	Civilians (Egypt)	Muslim Brotherhood	7	17	Egypt	Cairo	Muski		Cairo	30.05000	31.25000	1	"Associated Press Newswires/Associated Press Writer 27 March 2005 13:54 GMT, Dow Jones International News 27 March 2005 10:50 GMT, The Canadian Press 27 March 2005 18:20 GMT"	"Egyptian security arrested 45 of members of the banned Muslim Brotherhood and hours before the group planned to demonstrate against the government.A demonstration still followed not in front of the Parliament but in front of a Mosque so the event is coded one more time.Two more protests by the Muslim Brotherhood took place elsewhere in Cairo, and the officials said there were up to 200 protesters in each of Babelouq and Sayda Zeinab districts. Riot police were present at both.In the fourth protest, an estimated 300 demonstrators gathered outside the offices of the Press Syndicate in downtown Cairo, where they were joined by dozens of other government critics chanting anti-Mubarak slogans."	0651	229EGY	22007	27/03/2005	2005	3	27	1	Riots/Protests	Protesters (Egypt)		6			0	60	Egypt	Cairo	Muski		Cairo	30.05000	31.25000	1	"Associated Press Newswires/Associated Press Writer 27 March 2005 13:54 GMT, Dow Jones International News 27 March 2005 10:50 GMT, The Canadian Press 27 March 2005 18:20 GMT"	"Demonstrations rather than riots per se. Egyptian security arrested 45 of members of the banned Muslim Brotherhood and hours before the group planned to demonstrate against the government.A demonstration still followed not in front of the Parliament but in front of a Mosque so the event is coded one more time. Two more protests by the Muslim Brotherhood took place elsewhere in Cairo, and the officials said there were up to 200 protesters in each of Babelouq and Sayda Zeinab districts. Riot police were present at both.In the fourth protest, an estimated 300 demonstrators gathered outside the offices of the Press Syndicate in downtown Cairo, where they were joined by dozens of other government critics chanting anti-Mubarak slogans."	0651	230EGY	22008	30/03/2005	2005	3	30	1	Non-violent activity by a conflict actor	Police Forces of Egypt (1981-2011)		1	Civilians (Egypt)	Kifaya Movement	7	17	Egypt	Alexandria	Bab Sharqi		Alexandria	31.19810	29.91920	1	"Associated Press Newswires/Associated Press Writer 30 March 2005 14:51 GMT, Dow Jones International News 30 March 2005 13:18 GMT"	"Twenty protesters of the Kifaya or ""Enough"" Movement were detained in the city of Alexandria during the anti-government protests that took place across the country on March 30th."	0651	233EGY	22011	30/03/2005	2005	3	30	1	Non-violent activity by a conflict actor	Police Forces of Egypt (1981-2011)		1	Civilians (Egypt)	Kifaya Movement	7	17	Egypt	Dakahlia	El Mansora 1		Mansoura	31.04310	31.37670	1	"Associated Press Newswires/Associated Press Writer 30 March 2005 14:51 GMT, Dow Jones International News 30 March 2005 13:18 GMT"	"2 protesters of the Kifaya or ""Enough"" Movement were detained in Mansoura during the anti-government demonstrations that took place across Egypt on March 30th.According to one Kifaya member, about 100 Kifaya demonstrators in Umm Kalthoum Square were attacked by thugs, apparently supporters of Mubarak's National Democratic Party."	0651	231EGY	22009	30/03/2005	2005	3	30	1	Riots/Protests	Protesters (Egypt)		6			0	60	Egypt	Alexandria	Bab Sharqi		Alexandria	31.19810	29.91920	1	"Associated Press Newswires/Associated Press Writer 30 March 2005 14:51 GMT, Dow Jones International News 30 March 2005 13:18 GMT"	"University protesters defied government warnings and staged a series of pro-reform demonstrations across Egypt.Hundreds of protesters demonstrated in Cairo, Alexandria and the Nile Delta town of Mansoura."	0651	232EGY	22010	30/03/2005	2005	3	30	1	Riots/Protests	Protesters (Egypt)		6			0	60	Egypt	Cairo	Muski		Cairo	30.05000	31.25000	1	"Associated Press Newswires/Associated Press Writer 30 March 2005 14:51 GMT, Dow Jones International News 30 March 2005 13:18 GMT"	"University protesters defied government warnings and staged a series of pro-reform demonstrations across Egypt.Hundreds of protesters demonstrated in Cairo, Alexandria and the Nile Delta town of Mansoura, but large numbers of police officers did stop the demonstrators from reaching their main target -- parliament."	0651	234EGY	22012	30/03/2005	2005	3	30	1	Riots/Protests	Protesters (Egypt)		6			0	60	Egypt	Dakahlia	El Mansora 1		Mansoura	31.04310	31.37670	1	"Associated Press Newswires/Associated Press Writer 30 March 2005 14:51 GMT, Dow Jones International News 30 March 2005 13:18 GMT"	"University protesters defied government warnings and staged a series of pro-reform demonstrations across Egypt.Hundreds of protesters demonstrated in Cairo, Alexandria and the Nile Delta town of Mansoura."	0651	235EGY	22013	04/04/2005	2005	4	4	1	Non-violent activity by a conflict actor	Police Forces of Egypt (1981-2011)		1	Muslim Brotherhood		3	13	Egypt	Cairo	Nasr City		Nasr City	30.01692	31.37704	1	"Associated Press Newswires/ Associated Press Writer 04 April 2005 20:09 GMT, Dow Jones International News 04 April 2005 20:37 GMT"	Police arrests 4 Islamic activists.	0651	236EGY	22014	05/04/2005	2005	4	5	1	Riots/Protests	Protesters (Egypt)		6			0	60	Egypt	Cairo	Muski		Cairo	30.05000	31.25000	1	Dow Jones International News 05 April 2005 14:30 GMT	"Around 10,000 students, including members of Egypt's largest Islamic group, staged angry protests inside university campuses across Egypt calling for political reform and an end to the country's emergency laws. Protests at four universities in Cairo and the Nile Delta north of the capital were called for by the banned Muslim Brotherhood."	0651	237EGY	22015	05/04/2005	2005	4	5	1	Riots/Protests	Protesters (Egypt)		6			0	60	Egypt	Dakahlia	El Mansora 1		Mansoura	31.04310	31.37670	1	Dow Jones International News 05 April 2005 14:30 GMT	"2,000 students demonstrated at Delta university."	0651	238EGY	22016	05/04/2005	2005	4	5	1	Riots/Protests	Protesters (Egypt)		6			0	60	Egypt	Kafr El-Shikh	Kafr Al-Shaykh		Kafr el Sheikh	31.11140	30.93640	1	Dow Jones International News 05 April 2005 14:30 GMT	"North of Cairo at Kafr el-Sheikh University, police said 2,000 students demonstrated."	0651	239EGY	22017	07/04/2005	2005	4	7	1	Remote violence	Unidentified Armed Group (Egypt)		3	Civilians (Egypt)		7	37	Egypt	Cairo	Muski		Cairo	30.05000	31.25000	1	Agence France Press(AFP)	"Three people, including a Frenchwoman and an American, were killed in the explosion at a crowded market popular with tourists near the Al-Azhar mosque and university.It was apparently caused by a booby-trapped motorcycle but not immediately claimed by any organisation. Both the Muslim Brotherhood group and al-Gamaa al-Islamiya, or Islamic Group, condemned the attacks.The event was later on attributed to one individual only."	3651	240EGY	22018	12/04/2005	2005	4	12	1	Riots/Protests	Protesters (Egypt)	Muslim Brotherhood	6			0	60	Egypt	Assiut	Al-Qusia		Assuit	27.33330	30.83330	1	"Dow Jones International News 12 April 2005 13:47 GMT, Associated Press Newswires/ Associated Press Writer 12 April 2005 22:43 GMT"	"Thousands of students of various political parties and movements demonstrated within university campus grounds across Egypt, calling for political reform and an end to the country's emergency laws.About 2,000 students staged angry protest in Assuit University. The protests were organized by the Muslim Brotherhood organization. joined by supporters of ""Kifaya,"" a growing activist movement calling for the end of President Hosni Mubarak's rule."	0651	241EGY	22019	12/04/2005	2005	4	12	1	Riots/Protests	Protesters (Egypt)	Muslim Brotherhood	6			0	60	Egypt	Cairo	Muski		Cairo	30.05000	31.25000	1	"Dow Jones International News 12 April 2005 13:47 GMT, Associated Press Newswires/ Associated Press Writer 12 April 2005 22:43 GMT"	"Thousands of students of various political parties and movements demonstrated within university campus grounds across Egypt, calling for political reform and an end to the country's emergency laws.About 1,200 students staged angry protest in Cairo University.The protests were organized by the Muslim Brotherhood organization. joined by supporters of ""Kifaya,"" a growing activist movement calling for the end of President Hosni Mubarak's rule."	0651	242EGY	22020	27/04/2005	2005	4	27	1	Riots/Protests	Protesters (Egypt)		6	Police Forces of Egypt (1981-2011)		1	16	Egypt	Cairo	Muski		Cairo	30.05000	31.25000	1	Agence France Presse 28 April 2005 03:47 GMT	"The Egypt pro-reform movement Kefaya organized simultaneous rallies across the country in protest at President Hosni Mubarak's unchallenged 24-year-old rule. They coordinated 14 marches at the same time under the banner ""no constitution without freedom."" Some 75 protestors around the country were arrested but later released.Among the towns affected by the demonstrations: Cairo, Suez, Alexandria, Sinai town of El-Arish , Minya, Mansoura. In some cases clashes occured between civilians and police forces, some civilians being arrested."	0651	243EGY	22021	30/04/2005	2005	4	30	1	Violence against civilians	Unidentified Armed Group (Egypt)		3	Civilians (Egypt)		7	37	Egypt	Cairo	Muski		Cairo	30.05000	31.25000	1	Agence France Press(AFP)	"A suicide bomber wounded several foreigners outside one of Cairo's most popular tourist attractions.A second attack with a bomb took placxe one hour after, conducted by the sister and fiancee of the first suicide bomber.The attacks were claimed in Internet statements by a group calling itself the Brigades of the Martyr Abdullah Azzam and another one called the Egyptian Mujahedeen Group. 200 arrests were done afterwards in relation to these attacks."	0651	244EGY	22022	04/05/2005	2005	5	4	1	Riots/Protests	Protesters (Egypt)	Muslim Brotherhood	6	Police Forces of Egypt (1981-2011)		1	16	Egypt	Cairo	Muski		Cairo	30.05000	31.25000	1	"Associated Press Newswires/Associated Press Writer 04 May 2005 21:34 GMT, Dow Jones International News 04 May 2005 14:04 GMT, Reuters News 04 May 2005 15:32 GMT"	"Thousands of supporters of the banned Muslim Brotherhood, Egypt's largest Islamic group, protested across the country in an escalation of the opposition campaign demanding political reform. Police arrested hundreds of protesters. The protests took place in Cairo, several cities in the Delta and in Fayoum, south of Cairo.Security sources said police had detained about 80 protesters in El-Mansura and 100 in Zagazig, both in the Nile Delta north of Cairo, and 30 in El-Faiyum, to the southwest. Brotherhood officials reported many other detentions elsewhere. About 220 protesters were arrested during demonstrations in the Delta provinces of Sharqiya and Daqahliya and in Fayoum."	0651	245EGY	22023	06/05/2005	2005	5	6	1	Non-violent activity by a conflict actor	Police Forces of Egypt (1981-2011)		1	Muslim Brotherhood		3	13	Egypt	Cairo	Muski		Cairo	30.05000	31.25000	1	"Associated Press Writer/Associated Press Newswires 06 May 2005 14:14 GMT, Dow Jones International News 06 May 2005 22:59 GMT"	Egyptian police detained four leaders of the banned Muslim Brotherhood and rounded up dozens of other members in the Islamic group as demonstrators gathered in several cities to protest arrests earlier in the week.	0651	247EGY	22025	06/05/2005	2005	5	6	1	Riots/Protests	Protesters (Egypt)	Muslim Brotherhood	6	Police Forces of Egypt (1981-2011)		1	16	Egypt	Dakahlia	Talkha		Talkha	31.05310	31.37390	1	"Associated Press Writer/Associated Press Newswires 06 May 2005 14:14 GMT, Dow Jones International News 06 May 2005 22:59 GMT"	Protests against the gover