GWNO	EVENT_ID_CNTY	EVENT_ID_NO_CNTY	EVENT_DATE	YEAR	MONTH	DAY	TIME_PRECISION	Event Type	Actor	ALLY_ACTOR_1	INTER1	ACTOR2	ALLY_ACTOR_2	INTER2	INTERACTION	COUNTRY	ADMIN1	ADMIN2	ADMIN3	LOCATION	LATITUDE	LONGITUDE	GEO_PRECIS	SOURCE	Notes	Fatalities482	76CEN	9879	10/01/2000	2000	1	10	1	Non-violent activity by a conflict actor	MLC: Movement for the Liberation of Congo		2			0	20	Central African Republic	Mbomou	Bakouma	Bakouma	Wango Bangowili	5.18000	22.83000	1	IRIN Africa	"The Forces Armees Congolaises claimed the rebel MLC of Jean-Pierre Bemba was undertaking ""massive military recruitment"" in Wango, just across the border of DRC in CAR."	0482	77CEN	9880	24/01/2000	2000	1	24	1	Riots/Protests	Protesters (Central African Republic)		6	Police Forces of Central African Republic (1993-2003)		1	16	Central African Republic	Bangui	Bangui	Bangui	Bangui	4.36670	18.58330	1	Agence France-Presse	Police fired rifles and used teargas on protesters who were members of the Base Karako militia demanding to be taken back into the regular army.	0482	78CEN	9881	04/02/2000	2000	2	4	1	Riots/Protests	Protesters (Central African Republic)		6			0	60	Central African Republic	Bangui	Bangui	Bangui	Bangui	4.36670	18.58330	1	Agence France-Presse	Police fired rifles and used teargas on protesters who were members of the Base Karako militia demanding to be taken back into the regular army.	0482	79CEN	9882	05/02/2000	2000	2	5	1	Violence against civilians	Civilians (Central African Republic)		7	Zaraguinas		3	37	Central African Republic	Ouaka	Bambari	Bambari	Bambari	5.76190	20.66720	1	Agence France-Presse	"Zarguinas, or highway militia men, attacked and killed a nun. After, they stole petrol from a tanker"	1482	80CEN	9883	06/02/2000	2000	2	6	1	Riots/Protests	Protesters (Central African Republic)		6			0	60	Central African Republic	Bangui	Bangui	Bangui	Bangui	4.36670	18.58330	1	Agence France-Presse	Nuns marched to the protest the killing of a nun in Bambari	0482	81CEN	9884	07/02/2000	2000	2	7	1	Violence against civilians	Civilians (Central African Republic)		7	Zaraguinas		3	37	Central African Republic	Ouaka	Bambari	Bambari	Bambari	5.76190	20.66720	1	Agence France-Presse	Zarguinas attacked the funeral procession of a nun killed in previous attacks	0482	82CEN	9885	29/02/2000	2000	2	29	1	Violence against civilians	Civilians (Libya)		7	Unidentified Armed Group (Central African Republic)		3	37	Central African Republic	Bangui	Bangui	Bangui	Bangui	4.36670	18.58330	1	Associated Press	Libyan ambassador shot	0482	83CEN	9886	14/10/2000	2000	10	14	1	Riots/Protests	Protesters (Central African Republic)		6			0	60	Central African Republic	Bangui	Bangui	Bangui	Bangui	4.36670	18.58330	1	Agence France-Presse	Civil servants protested unpaid wages by striking	0482	84CEN	9887	14/11/2000	2000	11	14	1	Riots/Protests	Rioters (Central African Republic)		5	Police Forces of Central African Republic (1993-2003)		1	15	Central African Republic	Bangui	Bangui	Bangui	Bangui	4.36670	18.58330	1	Agence France-Presse	Rioters set tires on fire to demonstrate over unemployment. Police responded with teargas	0482	85CEN	9888	24/11/2000	2000	11	24	1	Riots/Protests	Protesters (Central African Republic)		6			0	60	Central African Republic	Bangui	Bangui	Bangui	Bangui	4.36670	18.58330	1	Agence France-Presse	"Protesters, mostly civil servants, demanded payment of salary arrears"	0482	86CEN	9889	15/12/2000	2000	12	15	3	Violence against civilians	Civilians (Chad)		7	Zaraguinas		3	37	Central African Republic	Ombella M'Poko	Yaloke	Yaloke	Yaloke	5.32000	17.08000	2	Agence France-Presse	7 Chad farmers killed	7482	87CEN	9890	19/12/2000	2000	12	19	1	Riots/Protests	Rioters (Central African Republic)		5	Police Forces of Central African Republic (1993-2003)		1	15	Central African Republic	Bangui	Bangui	Bangui	Bangui	4.36670	18.58330	1	Associated Press	Police fired teargas and automatic rifles at anti-government demonstrators. 20 people were inured	0482	88CEN	9891	17/02/2001	2001	2	17	1	Riots/Protests	Rioters (Central African Republic)	Merchant Militia	5	Rioters (Central African Republic)	Merchant Militia	5	55	Central African Republic	Bangui	Bangui	Bangui	Bangui	4.36670	18.58330	1	Agence France-Presse	Merchants- local and foreign- fought each other.	0482	89CEN	9892	13/03/2001	2001	3	13	1	Battle-No change of territory	Masabio Ethnic Miitia (Central African Republic)		4	Military Forces of Central African Republic (1993-2003)		1	14	Central African Republic	Ouham	Batangafo	Bakassa	Sabo	7.87620	17.77300	3	BBC Monitoring	Masabio herders shot at soldiers attempting to carry out a vaccination campaign	0482	90CEN	9893	16/03/2001	2001	3	16	3	Violence against civilians	Civilians (Central African Republic)		7	Unidentified Armed Group (Chad)		3	37	Central African Republic	Ouham Pende	Bozoum	Bozoum	Bozoum	6.31670	16.38330	3	Agence France-Presse	Armed group from Chad killed and raped several CAR civilians.	0482	91CEN	9894	12/04/2001	2001	4	12	1	Violence against civilians	Civilians (Central African Republic)		7	Unidentified Armed Group (Chad)		3	37	Central African Republic	Ouham Pende	Paoua	Nana-Barya	Bekila	7.42000	16.62000	1	Associated Press	Armed group from Chad killed and raped several CAR civilians.	0482	92CEN	9895	12/04/2001	2001	4	12	1	Violence against civilians	Civilians (Central African Republic)		7	Unidentified Armed Group (Chad)		3	37	Central African Republic	Ouham Pende	Paoua	Nana-Barya	Beo-Gombo	7.36000	16.61000	1	Associated Press	Armed group from Chad killed and raped several CAR civilians.	0482	93CEN	9896	25/04/2001	2001	4	25	2	Violence against civilians	Civilians (Chad)		7	Zaraguinas		3	37	Central African Republic	Ombella M'Poko	Yaloke	Yaloke	Yaloke	5.32000	17.08000	1	Agence France-Presse	21 Chad farmers killed and farmers settlement seized	21482	94CEN	9897	28/05/2001	2001	5	28	1	Battle-Non-state actor overtakes territory	Mutiny of Military Forces of Central African Republic (1993-2003)		1	Military Forces of Central African Republic (1993-2003)		1	11	Central African Republic	Bangui	Bangui	Bangui	Bangui	4.36670	18.58330	1	Associated Press	Soldiers attached the home of President Patasse	0482	96CEN	9899	29/05/2001	2001	5	29	1	Violence against civilians	Civilians (Central African Republic)	Yakoma Ethnic Group (Central African Republic)	7	Military Forces of Central African Republic (1993-2003)		1	17	Central African Republic	Bangui	Bangui	Bangui	Bangui	4.36670	18.58330	1	Africa Research Bulletin	CAR military kill people of Yokama ethnic group- the ethnic group most of the mutiny belongs to	0482	95CEN	9898	29/05/2001	2001	5	29	1	Battle-No change of territory	Mutiny of Military Forces of Central African Republic (1993-2003)		1	Military Forces of Central African Republic (1993-2003)		1	11	Central African Republic	Bangui	Bangui	Bangui	Bangui	4.36670	18.58330	1	Associated Press	Military coup led by Andre Kolingba- former military leader	0482	97CEN	9900	30/05/2001	2001	5	30	1	Battle-No change of territory	Mutiny of Military Forces of Central African Republic (1993-2003)		1	Military Forces of Central African Republic (1993-2003)	Military Forces of Libya (1969-2011)	1	11	Central African Republic	Bangui	Bangui	Bangui	Bangui	4.36670	18.58330	1	Africa Research Bulletin	Military coup. CAR troops supported by Libyan troops	0482	98CEN	9901	30/05/2001	2001	5	30	1	Battle-No change of territory	Mutiny of Military Forces of Central African Republic (1993-2003)		1	Military Forces of Central African Republic (1993-2003)	Military Forces of Libya (1969-2011)	1	11	Central African Republic	Bangui	Bangui	Bangui	Bangui	4.36670	18.58330	1	Radio France		0482	99CEN	9902	30/05/2001	2001	5	30	1	Battle-Non-state actor overtakes territory	Mutiny of Military Forces of Central African Republic (1993-2003)		1	Military Forces of Central African Republic (1993-2003)	MLC: Movement for the Liberation of Congo	1	11	Central African Republic	Bangui	Bangui	Bangui	Kasai	4.36670	18.58330	1	BBC Monitoring	Mutiny take Kassai military camp. MLC aid CAR troops	0482	101CEN	9904	01/06/2001	2001	6	1	1	Non-violent activity by a conflict actor	FLC: Congolese Liberation Front		2			0	20	Central African Republic	Bangui	Bangui	Bangui	Bangui	4.36670	18.58330	1	Reuters News	Jean-Pierre Bemba sent troops to Bangui to aid CAR's president.	0482	103CEN	9906	01/06/2001	2001	6	1	1	Non-violent activity by a conflict actor	MLC: Movement for the Liberation of Congo	MLC: Movement for the Liberation of Congo	2			0	20	Central African Republic	Bangui	Bangui	Bangui	Ouango	4.36670	18.61670	1	Africa Research Bulletin	MLC loots area	0482	100CEN	9903	01/06/2001	2001	6	1	1	Battle-No change of territory	Mutiny of Military Forces of Central African Republic (1993-2003)		1	Military Forces of Central African Republic (1993-2003)	Military Forces of Libya (1969-2011)	1	11	Central African Republic	Bangui	Bangui	Bangui	Bangui	4.36670	18.58330	1	Agence France-Presse		0482	102CEN	9905	01/06/2001	2001	6	1	1	Battle-Government regains territory	Mutiny of Military Forces of Central African Republic (1993-2003)		1	Military Forces of Central African Republic (1993-2003)	MLC: Movement for the Liberation of Congo	1	11	Central African Republic	Bangui	Bangui	Bangui	Kasai	4.36670	18.58330	1	Agence France-Presse		0482	105CEN	9908	02/06/2001	2001	6	2	2	Violence against civilians	Civilians (Central African Republic)	Yakoma Ethnic Group (Central African Republic)	7	Military Forces of Central African Republic (1993-2003)		1	17	Central African Republic	Bangui	Bangui	Bangui	Bangui	4.36670	18.58330	1	Reuters	Army targets members of Yakoma ethnic group and attacks them	0482	104CEN	9907	02/06/2001	2001	6	2	1	Battle-No change of territory	Mutiny of Military Forces of Central African Republic (1993-2003)		1	Military Forces of Central African Republic (1993-2003)		1	11	Central African Republic	Bangui	Bangui	Bangui	Bangui	4.36670	18.58330	1	Africa Research Bulletin		0482	107CEN	9910	03/06/2001	2001	6	3	1	Battle-Government regains territory	Military Forces of Central African Republic (1993-2003)		1	Unidentified Armed Group (Central African Republic)		3	13	Central African Republic	Bangui	Bangui	Bangui	Ouango	4.36670	18.61670	1	Reuters News	Rebel leader's house in Ouango CAR (Kolingba) was attacked and captured by FACA and Bemba's FLC forces together.	0482	106CEN	9909	03/06/2001	2001	6	3	1	Battle-Government regains territory	Mutiny of Military Forces of Central African Republic (1993-2003)		1	Military Forces of Central African Republic (1993-2003)		1	11	Central African Republic	Bangui	Bangui	Bangui	Bangui	4.36670	18.58330	1	Associated Press	CAR army regains control	0482	108CEN	9911	04/06/2001	2001	6	4	1	Battle-No change of territory	Mutiny of Military Forces of Central African Republic (1993-2003)		1	Military Forces of Central African Republic (1993-2003)		1	11	Central African Republic	Bangui	Bangui	Bangui	Bangui	4.36670	18.58330	1	Reuters	Mutiny still control to neighborhoods that the govt is trying to re-take	0482	109CEN	9912	05/06/2001	2001	6	5	1	Battle-No change of territory	Mutiny of Military Forces of Central African Republic (1993-2003)		1	Military Forces of Central African Republic (1993-2003)	Military Forces of Libya (1969-2011)	1	11	Central African Republic	Bangui	Bangui	Bangui	Bangui	4.36670	18.58330	1	Agence France-Presse	Mutiny still control to neighborhoods that the govt is trying to re-take	0482	110CEN	9913	06/06/2001	2001	6	6	1	Battle-No change of territory	Mutiny of Military Forces of Central African Republic (1993-2003)		1	Military Forces of Central African Republic (1993-2003)		1	11	Central African Republic	Bangui	Bangui	Bangui	Bangui	4.36670	18.58330	1	BBC Monitoring	coup fails	0482	111CEN	9914	06/06/2001	2001	6	6	1	Battle-No change of territory	Unidentified Armed Group (Central African Republic)		3	MLC: Movement for the Liberation of Congo		2	23	Central African Republic	Bangui	Bangui	Bangui	Bangui	4.36670	18.58330	1	BBC Monitoring	CAR rebels captured 8 DR Congo rebels (MLC- ugandan-backed who were there helping the FACA to fight the rebels) after serious clashes in Bangui. 4 Libyans were also killed.	4482	112CEN	9915	07/06/2001	2001	6	7	1	Non-violent activity by a conflict actor	MLC: Movement for the Liberation of Congo		2			0	20	Central African Republic	Bangui	Bangui	Bangui	Bangui	4.36670	18.58330	1	Agence France Presse	Bemba orders his troops to leave CAR.	0482	113CEN	9916	08/06/2001	2001	6	8	1	Violence against civilians	Civilians (Central African Republic)	Yakoma Ethnic Group (Central African Republic)	7	Military Forces of Central African Republic (1993-2003)		1	17	Central African Republic	Bangui	Bangui	Bangui	Ouango	4.36670	18.61670	1	BBC Monitoring	Archbishop killed for being Yakoma	0482	114CEN	9917	13/06/2001	2001	6	13	1	Violence against civilians	Civilians (Central African Republic)	Yakoma Ethnic Group (Central African Republic)	7	Military Forces of Central African Republic (1993-2003)		1	17	Central African Republic	Bangui	Bangui	Bangui	Bangui	4.36670	18.58330	1	Africa Research Bulletin	Members of Yakoma group rounded up and beaten	0482	115CEN	9918	16/06/2001	2001	6	16	1	Violence against civilians	Civilians (Central African Republic)	Yakoma Ethnic Group (Central African Republic)	7	Military Forces of Central African Republic (1993-2003)		1	17	Central African Republic	Bangui	Bangui	Bangui	Bangui	4.36670	18.58330	1	Africa Research Bulletin	Members of Yakoma group rounded up and beaten	0482	116CEN	9919	06/07/2001	2001	7	6	1	Violence against civilians	Civilians (France)		7	Unidentified Armed Group (Central African Republic)		3	37	Central African Republic	Bangui	Bangui	Bangui	Bangui	4.36670	18.58330	1	Agence France-Presse	unidentified armed group shot dead a former french colonel	1482	117CEN	9920	03/11/2001	2001	11	3	1	Battle-No change of territory	Mutiny of Military Forces of Central African Republic (1993-2003)		1	Military Forces of Central African Republic (1993-2003)		1	11	Central African Republic	Bangui	Bangui	Bangui	Bangui	4.36670	18.58330	1	Reuters	Soldiers loyal to a fired army chief fought CAR troops	0482	118CEN	9921	04/11/2001	2001	11	4	1	Battle-No change of territory	Mutiny of Military Forces of Central African Republic (1993-2003)		1	Military Forces of Central African Republic (1993-2003)		1	11	Central African Republic	Bangui	Bangui	Bangui	Bangui	4.36670	18.58330	1	Agence France-Presse		0482	119CEN	9922	05/11/2001	2001	11	5	1	Battle-No change of territory	Mutiny of Military Forces of Central African Republic (1993-2003)		1	Military Forces of Central African Republic (1993-2003)	Military Forces of Libya (1969-2011)	1	11	Central African Republic	Bangui	Bangui	Bangui	Bangui	4.36670	18.58330	1	Reuters		0482	120CEN	9923	06/11/2001	2001	11	6	1	Battle-No change of territory	Mutiny of Military Forces of Central African Republic (1993-2003)		1	Military Forces of Central African Republic (1993-2003)	Military Forces of Libya (1969-2011)	1	11	Central African Republic	Bangui	Bangui	Bangui	Bangui	4.36670	18.58330	1	Reuters		0482	121CEN	9924	07/11/2001	2001	11	7	1	Battle-No change of territory	Mutiny of Military Forces of Central African Republic (1993-2003)		1	Military Forces of Central African Republic (1993-2003)		1	11	Central African Republic	Bangui	Bangui	Bangui	Bangui	4.36670	18.58330	1	Reuters	govt expels mutiny of soldiers	0482	122CEN	9925	10/11/2001	2001	11	10	1	Violence against civilians	Civilians (Central African Republic)		7	Mutiny of Military Forces of Central African Republic (1993-2003)		1	17	Central African Republic	Ombella M'Poko	Damara	Damara	Damara	4.96670	18.70000	2	Agence France-Presse	Bozize group attacked CAR officials	0482	123CEN	9926	19/11/2001	2001	11	19	1	Non-violent transfer of territory	Mutiny of Military Forces of Central African Republic (1993-2003)		1			0	10	Central African Republic	Ouham	Batangafo	Batangafo	Batangafo	7.30000	18.30000	1	Associated Press		0482	124CEN	9927	19/11/2001	2001	11	19	1	Non-violent transfer of territory	Mutiny of Military Forces of Central African Republic (1993-2003)		1			0	10	Central African Republic	Ouham	Kabo	Sido	Kabo	7.58330	18.63330	1	Associated Press		0482	125CEN	9928	22/11/2001	2001	11	22	1	Battle-No change of territory	Mutiny of Military Forces of Central African Republic (1993-2003)		1	Military Forces of Central African Republic (1993-2003)		1	11	Central African Republic	Nana-Gribizi	Kaga-Bandoro	Kaga-Bandoro	Kaga Bandoro	6.98330	19.18330	1	Associated Press		0482	126CEN	9929	27/11/2001	2001	11	27	1	Battle-No change of territory	Mutiny of Military Forces of Central African Republic (1993-2003)		1	Military Forces of Central African Republic (1993-2003)		1	11	Central African Republic	Nana-Gribizi	Kaga-Bandoro	Nana-Outa	Ouandago	7.21670	18.83330	1	Agence France-Presse	Fatalities: 1 govt soldier. Several injured during fighting	1482	127CEN	9930	02/12/2001	2001	12	2	1	Battle-No change of territory	Mutiny of Military Forces of Central African Republic (1993-2003)		1	Military Forces of Central African Republic (1993-2003)		1	11	Central African Republic	Ouham	Kabo	Sido	Kabo	7.58330	18.63330	1	Associated Press	Fatalities: 12 people total	12482	128CEN	9931	31/12/2001	2001	12	31	1	Violence against civilians	Civilians (Central African Republic)		7	Military Forces of Central African Republic (1993-2003)		1	17	Central African Republic	Bangui	Bangui	Bangui	Bangui	4.36670	18.58330	1	Agence France-Presse	"Soldiers fired shots on New years eve, wounding five people"	0482	129CEN	9932	07/01/2002	2002	1	7	1	Riots/Protests	Rioters (Central African Republic)		5	Police Forces of Central African Republic (1993-2003)		1	15	Central African Republic	Bangui	Bangui	Bangui	Bangui	4.36670	18.58330	1	Agence France-Presse	Rioters demonstrated over grant payments. Police used teargas to break up the crowd	0482	130CEN	9933	10/03/2002	2002	3	10	2	Violence against civilians	Civilians (Central African Republic)		7	Zaraguinas		3	37	Central African Republic	Kemo	Ndjoukou	Galabadja	Gbada	5.13330	19.73330	1	Africa Research Bulletin		0482	131CEN	9934	10/03/2002	2002	3	10	2	Violence against civilians	Civilians (Central African Republic)		7	Zaraguinas		3	37	Central African Republic	Ouham	Kabo	Sido	Sido	8.21670	18.71670	1	Reuters	10 people killed in cattle raids by Zaraguinas	10482	132CEN	9935	01/04/2002	2002	4	1	1	Battle-No change of territory	Military Forces of Chad (1990-)		8	Military Forces of Central African Republic (1993-2003)		1	18	Central African Republic	Ouham	Kabo	Sido	Kabo	7.58330	18.63330	1	Associated Press	Fatalities: 1 CAR soldier	1482	133CEN	9936	09/05/2002	2002	5	9	2	Violence against civilians	Civilians (Central African Republic)		7	Military Forces of Sudan (1989-)		8	78	Central African Republic	Vakaga	Birao	Ridina	Birao	10.28000	22.78000	2	Reuters	Sudanese troops entered CAR and killed about 100 villagers	100482	134CEN	9937	18/05/2002	2002	5	18	2	Battle-No change of territory	Unidentified Armed Group (Central African Republic)		3	Unidentified Ethnic Militia (Sudan)		4	34	Central African Republic	Vakaga	Birao	Ridina	Birao	10.28000	22.78000	1	Associated Press	Total fatalities: 6	6482	135CEN	9938	18/05/2002	2002	5	18	2	Battle-No change of territory	Unidentified Ethnic Militia (Central African Republic)		4	Unidentified Ethnic Militia (Sudan)		4	44	Central African Republic	Vakaga	Birao	Ridina	Birao	10.28000	22.78000	1	"Associated Press Newswires 25/5/02, Al-Bawaba News"	A clash took place involving rival herdsmen in the Central African Republic after a rumour spread that a Muslim tribal leaders and a relative to the country's president was killed by a Sudanese national- 63 Sudanese people were killed	63482	136CEN	9939	25/05/2002	2002	5	25	2	Battle-No change of territory	Unidentified Armed Group (Central African Republic)		3	Unidentified Ethnic Militia (Sudan)		4	34	Central African Republic	Vakaga	Birao	Ridina	Birao	10.28000	22.78000	2	Associated Press	Clashes between herdsmen killed 63 Sudanese	63482	137CEN	9940	22/06/2002	2002	6	22	1	Riots/Protests	Protesters (Central African Republic)		6			0	60	Central African Republic	Bangui	Bangui	Bangui	Bangui	4.36670	18.58330	1	Associated Press	Parliament staged a protest over non-payment of per diems	0482	138CEN	9941	01/07/2002	2002	7	1	1	Riots/Protests	Protesters (Central African Republic)		6			0	60	Central African Republic	Bangui	Bangui	Bangui	Bangui	4.36670	18.58330	1	Agence France-Presse	Health workers protest over back pay	0482	139CEN	9942	06/08/2002	2002	8	6	1	Battle-No change of territory	Military Forces of Chad (1990-)		8	Military Forces of Central African Republic (1993-2003)		1	18	Central African Republic	Ouham	Kabo	Sido	Moyenne-Sido	8.22450	18.71320	1	Agence France-Presse		0482	140CEN	9943	11/08/2002	2002	8	11	1	Battle-No change of territory	Mutiny of Military Forces of Central African Republic (1993-2003)	Unidentified Armed Group (Chad)	1	Military Forces of Central African Republic (1993-2003)	Military Forces of Libya (1969-2011)	1	11	Central African Republic	Ouham	Kabo	Sido	Kabo	7.58330	18.63330	1	Agence France-Presse	At least 20 deaths	20482	142CEN	9945	15/09/2002	2002	9	15	2	Violence against civilians	Civilians (Central African Republic)		7	Unidentified Armed Group (Sudan)		3	37	Central African Republic	Nana-Mambere	Abba	Abba	Tomassa	5.40000	15.05000	1	Agence France-Presse	Sudanese on horseback attacked villages. Killed civilians and set houses on fire.	0482	143CEN	9946	15/09/2002	2002	9	15	2	Violence against civilians	Civilians (Central African Republic)		7	Unidentified Armed Group (Sudan)		3	37	Central African Republic	Ouham Pende	Ngaoundaye	Yeme	Kore	7.48330	15.96670	1	Agence France-Presse	Sudanese on horseback attacked villages. Killed civilians and set houses on fire.	0482	145CEN	9948	15/09/2002	2002	9	15	2	Violence against civilians	Civilians (Central African Republic)		7	Unidentified Armed Group (Sudan)		3	37	Central African Republic	Vakaga	Birao	Ouandja	Oulou	10.08330	22.01670	1	Agence France-Presse	Sudanese on horseback attacked villages. Killed civilians and set houses on fire.	0482	141CEN	9944	15/09/2002	2002	9	15	3	Battle-No change of territory	Military Forces of Chad (1990-)		8	FDPC: Democratic Front for the People of the Central African Republic		2	28	Central African Republic	Bamingui-Bangoran	Bamingui	Vassako	Sido	8.58330	19.05000	1	Africa Research Bulletin		0482	144CEN	9947	15/09/2002	2002	9	15	3	Violence against civilians	Unidentified Armed Group (Sudan)	Unidentified Ethnic Militia (Sudan)	3	Civilians (Central African Republic)		7	37	Central African Republic	Vakaga	Birao	Ridina	Birao	10.28000	22.78000	1	Agence France-Presse 21/9/02	"Raiders from Sudan, on horseback and camels and backed by poachers from Am Dafog in Sudan's western Darfur province attacked civilian villages in the Central African Republic, it was said that they were avenging a recent tribal attack"	0482	146CEN	9949	15/09/2002	2002	9	15	3	Violence against civilians	Unidentified Armed Group (Sudan)	Unidentified Ethnic Militia (Sudan)	3	Civilians (Central African Republic)		7	37	Central African Republic	Vakaga	Birao	Ouandja	Oulou	10.08333	22.01667	1	Agence France-Presse 21/9/02	"Raiders from Sudan, on horseback and camels and backed by poachers from Am Dafog in Sudan's western Darfur province attacked civilian villages in the Central African Republic, it was said that they were avenging a recent tribal attack - 10 civilians were"	10482	147CEN	9950	16/09/2002	2002	9	16	3	Battle-No change of territory	FDPC: Democratic Front for the People of the Central African Republic		2	Military Forces of Central African Republic (1993-2003)		1	12	Central African Republic	Ouham	Batangafo	Batangafo	Batangafo	7.30000	18.30000	1	Africa Research Bulletin	rebel group led by Miskine attacked areas	0482	148CEN	9951	16/09/2002	2002	9	16	3	Battle-No change of territory	FDPC: Democratic Front for the People of the Central African Republic		2	Military Forces of Central African Republic (1993-2003)		1	12	Central African Republic	Ouham	Kabo	Sido	Kabo	7.58330	18.63330	1	Africa Research Bulletin	rebel group led by Miskine attacked areas	0482	149CEN	9952	16/09/2002	2002	9	16	3	Battle-No change of territory	FDPC: Democratic Front for the People of the Central African Republic		2	Military Forces of Central African Republic (1993-2003)		1	12	Central African Republic	Ouham	Kabo	Sido	Moyenne-Sido	8.22450	18.71320	1	Africa Research Bulletin	rebel group led by Miskine attacked areas	0482	150CEN	9953	25/10/2002	2002	10	25	1	Battle-No change of territory	Mutiny of Military Forces of Central African Republic (1993-2003)		1	Military Forces of Central African Republic (1993-2003)	Military Forces of Libya (1969-2011)	1	11	Central African Republic	Bangui	Bangui	Bangui	Bangui	4.36670	18.58330	1	Associated Press	Mutiny led by Bozize followers aftter Bozize obtained asylum in France	0482	151CEN	9954	25/10/2002	2002	10	25	1	Battle-No change of territory	Mutiny of Military Forces of Central African Republic (1993-2003)		1	Military Forces of Central African Republic (1993-2003)		1	11	Central African Republic	Ombella M'Poko	Bogangolo	Bogangolo	Bogangolo	5.56670	18.25000	1	Associated Press	Mutiny led by Bozize followers aftter Bozize obtained asylum in France	0482	152CEN	9955	25/10/2002	2002	10	25	1	Battle-Non-state actor overtakes territory	Mutiny of Military Forces of Central African Republic (1993-2003)		1	Military Forces of Central African Republic (1993-2003)		1	11	Central African Republic	Ombella M'Poko	Damara	Damara	Damara	4.96670	18.70000	1	Associated Press	Mutiny led by Bozize followers aftter Bozize obtained asylum in France	0482	153CEN	9956	26/10/2002	2002	10	26	1	Battle-No change of territory	Mutiny of Military Forces of Central African Republic (1993-2003)		1	Military Forces of Central African Republic (1993-2003)	Military Forces of Libya (1969-2011)	1	11	Central African Republic	Bangui	Bangui	Bangui	Bangui	4.36670	18.58330	1	Reuters		0482	154CEN	9957	26/10/2002	2002	10	26	1	Violence against civilians	Mutiny of Military Forces of Central African Republic (1993-2003)		1	Civilians (Central African Republic)		7	17	Central African Republic	Ombella M'Poko	Damara	Damara	Damara	4.96075	18.70350	1	Bemba Trial Website (The Hague)	"Witness D04-29' told the Bemba trial at the International Criminal Court (ICC) that Bozize rebels raped his wife when they arrived in his neighborhood on October 26, 2002, near Damara."	0482	156CEN	9959	27/10/2002	2002	10	27	1	Remote violence	Military Forces of Libya (1969-2011)		8	Unidentified Armed Group (Central African Republic)		3	38	Central African Republic	Bangui	Bangui	Bangui	Bangui	4.36670	18.58330	1	Agence France Presse	Libyan forces bomb CAR rebel forces led by ex-army chief Francois BozizT. Causalities unknown.	0482	155CEN	9958	27/10/2002	2002	10	27	1	Battle-No change of territory	Mutiny of Military Forces of Central African Republic (1993-2003)		1	Military Forces of Libya (1969-2011)		8	18	Central African Republic	Bangui	Bangui	Bangui	Bangui	4.36670	18.58330	1	Agence France-Presse		0482	158CEN	9961	28/10/2002	2002	10	28	2	Violence against civilians	Civilians (Central African Republic)		7	MLC: Movement for the Liberation of Congo		2	27	Central African Republic	Bangui	Bangui	Bangui	Bangui	4.36670	18.58330	1	IRIN	MLC raped and looted areas during attempted coup	0482	157CEN	9960	28/10/2002	2002	10	28	1	Battle-No change of territory	Mutiny of Military Forces of Central African Republic (1993-2003)		1	Military Forces of Central African Republic (1993-2003)	Military Forces of Libya (1969-2011)	1	11	Central African Republic	Bangui	Bangui	Bangui	Bangui	4.36670	18.58330	1	Associated Press		0482	160CEN	9963	29/10/2002	2002	10	29	1	Non-violent activity by a conflict actor	MLC: Movement for the Liberation of Congo		2			0	20	Central African Republic	Bangui	Bangui	Bangui	Bangui	4.36670	18.58330	1	BBC Monitoring Service: Africa	"Uganda-backed Congolese rebel leader, Jean Pierre Bemba, has sent about 1,000 troops into the Central Africa Republic [CAR] to help the government defend itself against the rebels."	0482	159CEN	9962	29/10/2002	2002	10	29	1	Battle-No change of territory	Mutiny of Military Forces of Central African Republic (1993-2003)		1	Military Forces of Central African Republic (1993-2003)	Military Forces of Libya (1969-2011)	1	11	Central African Republic	Bangui	Bangui	Bangui	Bangui	4.36670	18.58330	1	Agence France-Presse		0482	161CEN	9964	30/10/2002	2002	10	30	1	Battle-No change of territory	Mutiny of Military Forces of Central African Republic (1993-2003)		1	Military Forces of Central African Republic (1993-2003)	Military Forces of Libya (1969-2011)	1	11	Central African Republic	Bangui	Bangui	Bangui	Bangui	4.36670	18.58330	1	Reuters		0482	163CEN	9966	31/10/2002	2002	10	31	1	Violence against civilians	Civilians (Chad)		7	Military Forces of Central African Republic (1993-2003)		1	17	Central African Republic	Bangui	Bangui	Bangui	Bangui	4.36670	18.58330	1	Agence France-Presse	Chad govt alleges that CAR soldiers killed between 80-120 Chadians in Bangui	100482	162CEN	9965	31/10/2002	2002	10	31	1	Battle-Government regains territory	Mutiny of Military Forces of Central African Republic (1993-2003)		1	Military Forces of Central African Republic (1993-2003)	Military Forces of Libya (1969-2011)	1	11	Central African Republic	Bangui	Bangui	Bangui	Bangui	4.36670	18.58330	1	Reuters		0482	164CEN	9967	15/11/2002	2002	11	15	3	Violence against civilians	Civilians (Central African Republic)		7	MLC: Movement for the Liberation of Congo		2	27	Central African Republic	Bangui	Bangui	Bangui	Bangui	4.36670	18.58330	1	Africa Research Bulletin	MLC continues to rape and loot. MLC entered CAR to aid CAR troops with rebellions	0482	165CEN	9968	20/11/2002	2002	11	20	1	Battle-No change of territory	Mutiny of Military Forces of Central African Republic (1993-2003)		1	Military Forces of Central African Republic (1993-2003)		1	11	Central African Republic	Ouham	Bossangoa	Bossangoa	Bossangoa	6.48330	17.45000	1	BBC Monitoring	Total fatalities: 16	16482	166CEN	9969	26/11/2002	2002	11	26	2	Battle-No change of territory	Mutiny of Military Forces of Central African Republic (1993-2003)		1	Military Forces of Central African Republic (1993-2003)		1	11	Central African Republic	Ombella M'Poko	Bossembele	Bossembele	Bossembélé	5.26670	17.65000	1	BBC Monitoring		0482	167CEN	9970	30/11/2002	2002	11	30	1	Violence against civilians	Mutiny of Military Forces of Central African Republic (1993-2003)		1	Civilians (Central African Republic)		7	17	Central African Republic	Ouham	Bossangoa	Bossangoa	Bossangoa	6.48330	17.45000	1	BBC Monitoring	"Missionaries attacked, homes looted"	0482	169CEN	9972	06/12/2002	2002	12	6	2	Battle-Non-state actor overtakes territory	Mutiny of Military Forces of Central African Republic (1993-2003)		1	Military Forces of Central African Republic (1993-2003)		1	11	Central African Republic	Kemo	Dekoa	Dekoa	Dekoa	6.31670	19.06670	1	Agence France-Presse		0482	170CEN	9973	06/12/2002	2002	12	6	2	Battle-Non-state actor overtakes territory	Mutiny of Military Forces of Central African Republic (1993-2003)		1	Military Forces of Central African Republic (1993-2003)		1	11	Central African Republic	Nana-Gribizi	Kaga-Bandoro	Kaga-Bandoro	Kaga Bandoro	6.98330	19.18330	1	Agence France-Presse		0482	171CEN	9974	06/12/2002	2002	12	6	2	Battle-Non-state actor overtakes territory	Mutiny of Military Forces of Central African Republic (1993-2003)		1	Military Forces of Central African Republic (1993-2003)		1	11	Central African Republic	Ombella M'Poko	Damara	Damara	Damara	4.96670	18.70000	1	Agence France-Presse		0482	172CEN	9975	06/12/2002	2002	12	6	2	Battle-Non-state actor overtakes territory	Mutiny of Military Forces of Central African Republic (1993-2003)		1	Military Forces of Central African Republic (1993-2003)		1	11	Central African Republic	Ouham	Batangafo	Batangafo	Batangafo	7.30000	18.30000	1	Agence France-Presse		0482	173CEN	9976	06/12/2002	2002	12	6	2	Battle-No change of territory	Mutiny of Military Forces of Central African Republic (1993-2003)		1	Military Forces of Central African Republic (1993-2003)		1	11	Central African Republic	Ouham	Kabo	Sido	Kabo	7.58330	18.63330	1	Agence France-Presse		0482	168CEN	9971	06/12/2002	2002	12	6	1	Riots/Protests	Protesters (Central African Republic)		6			0	60	Central African Republic	Bangui	Bangui	Bangui	Bangui	4.36670	18.58330	1	IRIN	Protesters demonstrated against behaviour of MLC rebels in CAR	0482	174CEN	9977	07/12/2002	2002	12	7	1	Battle-Government regains territory	Mutiny of Military Forces of Central African Republic (1993-2003)		1	Military Forces of Central African Republic (1993-2003)	Military Forces of Libya (1969-2011)	1	11	Central African Republic	Ombella M'Poko	Damara	Damara	Damara	4.96670	18.70000	1	Associated Press		0482	175CEN	9978	08/12/2002	2002	12	8	1	Violence against civilians	Civilians (Central African Republic)		7	Mutiny of Military Forces of Central African Republic (1993-2003)		1	17	Central African Republic	Ouham	Bossangoa	Bossangoa	Bossangoa	6.48330	17.45000	1	BBC Monitoring	Priest killed at roadblock	0482	177CEN	9980	12/12/2002	2002	12	12	1	Violence against civilians	Civilians (Central African Republic)		7	MLC: Movement for the Liberation of Congo		2	27	Central African Republic	Bangui	Bangui	Bangui	Bangui	4.36670	18.58330	1	Associated Press	MLC opened fire on protesters demonstrating against MLC in CAR	0482	176CEN	9979	12/12/2002	2002	12	12	1	Violence against civilians	Protesters (Central African Republic)		6	MLC: Movement for the Liberation of Congo		2	26	Central African Republic	Bangui	Bangui	Bangui	Bangui	4.36670	18.58330	1	Associated Press	MLC opened fire on protesters demonstrating against MLC in CAR	0482	178CEN	9981	13/12/2002	2002	12	13	1	Riots/Protests	Rioters (Central African Republic)		5	Police Forces of Central African Republic (1993-2003)		1	15	Central African Republic	Bangui	Bangui	Bangui	Bangui	4.36670	18.58330	1	IRIN	"Youth rioting for the MLC to leave CAR, clashed with police"	0482	179CEN	9982	15/12/2002	2002	12	15	3	Battle-No change of territory	Mutiny of Military Forces of Central African Republic (1993-2003)		1	MLC: Movement for the Liberation of Congo		2	12	Central African Republic	Ombella M'Poko	Damara	Damara	Malo	5.11670	18.83330	1	Africa Research Bulletin	Fighting between MLC and mutiny. Fatalities: 125 MLC	125482	180CEN	9983	17/12/2002	2002	12	17	1	Riots/Protests	Protesters (Central African Republic)		6			0	60	Central African Republic	Bangui	Bangui	Bangui	Bangui	4.36670	18.58330	1	Associated Press	Demonstration against MLC rapes and lootings	0482	181CEN	9984	19/12/2002	2002	12	19	1	Battle-Non-state actor overtakes territory	Mutiny of Military Forces of Central African Republic (1993-2003)		1	Military Forces of Central African Republic (1993-2003)		1	11	Central African Republic	Ouham Pende	Bozoum	Bozoum	Bozoum	6.31670	16.38330	1	BBC Monitoring		0482	182CEN	9985	20/12/2002	2002	12	20	1	Battle-Government regains territory	Mutiny of Military Forces of Central African Republic (1993-2003)		1	Military Forces of Central African Republic (1993-2003)		1	11	Central African Republic	Ouham Pende	Bozoum	Bozoum	Bozoum	6.31670	16.38330	1	All Africa		0482	183CEN	9986	24/12/2002	2002	12	24	1	Violence against civilians	Military Forces of Central African Republic (1993-2003)		1	Civilians (Central African Republic)		7	17	Central African Republic	Bangui	Bangui	Bangui	Bangui	4.36670	18.58330	1	Economist	Soldier of the Libyan peacekeeping force allied with FACA shot and killed.	1482	185CEN	9988	27/12/2002	2002	12	27	1	Violence against civilians	Civilians (Libya)		7	Unidentified Armed Group (Central African Republic)		3	37	Central African Republic	Bangui	Bangui	Bangui	Bangui	4.36670	18.58330	1	Agence France-Presse	armed group shot and killed libyan soldier and his wife.	2482	184CEN	9987	27/12/2002	2002	12	27	1	Riots/Protests	Protesters (Central African Republic)		6			0	60	Central African Republic	Bangui	Bangui	Bangui	Bangui	4.36670	18.58330	1	Agence France-Presse	Protesters demonstrated to make president aware of their suffering	0482	186CEN	9989	28/12/2002	2002	12	28	1	Riots/Protests	Protesters (Central African Republic)		6			0	60	Central African Republic	Bangui	Bangui	Bangui	Bangui	4.36670	18.58330	1	Agence France-Presse	Protesters demonstrated to make president aware of their suffering	0482	187CEN	9990	29/12/2002	2002	12	29	1	Violence against civilians	Military Forces of Central African Republic (1993-2003)		1	Civilians (Central African Republic)		7	17	Central African Republic	Bangui	Bangui	Bangui	Bangui	4.36670	18.58330	1	Associated Press	"Soldiers, who claimed to be protesting unpaid wages, fired 'in the air' throughout the night on new years eve. 20 people injured. 2 killed."	2482	189CEN	9992	07/01/2003	2003	1	7	1	Violence against civilians	Police Forces of Central African Republic (2003-2013)		1	Civilians (Central African Republic)		7	17	Central African Republic	Bangui	Bangui	Bangui	Bangui	4.36670	18.58330	1	Agence France Press(AFP)	Police violently broke up a student demonstration held in protest at the government's failure to pay grants using tear gas and firearms. No fatalities.	0482	188CEN	9991	07/01/2003	2003	1	7	1	Riots/Protests	Rioters (Central African Republic)		5			0	50	Central African Republic	Bangui	Bangui	Bangui	Bangui	4.36670	18.58330	1	Agence France Press(AFP)	Student demonstration held in protest at the government's failure to pay grants devolved into stone throwing and burning of things.	0482	190CEN	9993	15/01/2003	2003	1	15	1	Battle-Non-state actor overtakes territory	Military Forces of Central African Republic (1993-2003)	MLC: Movement for the Liberation of Congo	1	Patriots Militia		3	13	Central African Republic	Ouham Pende	Bozoum	Bozoum	Bozoum	6.31670	16.38330	1	BBC Monitoring	No fatality numbers available.	0482	191CEN	9994	28/01/2003	2003	1	28	1	Battle-Non-state actor overtakes territory	Military Forces of Central African Republic (1993-2003)		1	Patriots Militia		3	13	Central African Republic	Ouham	Kabo	Sido	Sido	8.21670	18.71670	1	BBC Monitoring	No fatality numbers available.	0482	192CEN	9995	28/01/2003	2003	1	28	1	Battle-Non-state actor overtakes territory	Military Forces of Central African Republic (1993-2003)		1	Patriots Militia		3	13	Central African Republic	Ouham Pende	Bozoum	Bozoum	Bozoum	6.31670	16.38330	1	BBC Monitoring	No fatality numbers available.	0482	193CEN	9996	30/01/2003	2003	1	30	1	Battle-No change of territory	Military Forces of Central African Republic (1993-2003)		1	Patriots Militia		3	13	Central African Republic	Ouham Pende	Bocaranga	Bocaranga	Bocaranga	6.98330	15.65000	1	All Africa	Refugees fleeing into Chad report clashes between government forces and rebels. No specific information available.	0482	194CEN	9997	01/02/2003	2003	2	1	1	Battle-Government regains territory	Military Forces of Central African Republic (1993-2003)		1	Patriots Militia		3	13	Central African Republic	Nana-Mambere	Baoro	Bawi Tédoa	Baoro	5.66670	15.96670	1	All Africa	Government claims to have taken this village and several others in securing the Bangui/Douala road. The report is of dubious reliability.	0482	195CEN	9998	01/02/2003	2003	2	1	1	Battle-Government regains territory	Military Forces of Central African Republic (1993-2003)		1	Patriots Militia		3	13	Central African Republic	Nana-Mambere	Bouar	Herman-Brousse	Bouar	5.95000	15.60000	1	All Africa	Government claims to have taken this village and several others in securing the Bangui/Douala road. The report is of dubious reliability.	0482	196CEN	9999	01/02/2003	2003	2	1	1	Battle-Government regains territory	Military Forces of Central African Republic (1993-2003)		1	Patriots Militia		3	13	Central African Republic	Ombella M'Poko	Bossembele	Bossembele	Bossembélé	5.26670	17.65000	1	All Africa	Government claims to have taken this village and several others in securing the Bangui/Douala road. The report is of dubious reliability.	0482	197CEN	10000	01/02/2003	2003	2	1	1	Battle-Government regains territory	Military Forces of Central African Republic (1993-2003)		1	Patriots Militia		3	13	Central African Republic	Ouham Pende	Bossembele	Binon	Bossemptele I	5.80000	16.51670	1	All Africa	Government claims to have taken this village and several others in securing the Bangui/Douala road. The report is of dubious reliability.	0482	198CEN	10001	04/02/2003	2003	2	4	1	Battle-Non-state actor overtakes territory	Military Forces of Central African Republic (1993-2003)	MLC: Movement for the Liberation of Congo	1	Patriots Militia		3	13	Central African Republic	Ouham Pende	Bocaranga	Bocaranga	Bocaranga	6.98330	15.65000	1	BBC Monitoring	No casualty figures available.	0482	199CEN	10002	05/02/2003	2003	2	5	1	Battle-Non-state actor overtakes territory	Military Forces of Central African Republic (1993-2003)	MLC: Movement for the Liberation of Congo	1	Patriots Militia		3	13	Central African Republic	Ouham Pende	Bozoum	Bozoum	Bozoum	6.31670	16.38330	1	All Africa	Government denied that Bozoum was taken and sent FACA and MLC fighters to retake it. No casualty figures available.	0482	200CEN	10003	11/02/2003	2003	2	11	1	Violence against civilians	Military Forces of Central African Republic (1993-2003)	MLC: Movement for the Liberation of Congo	1	Civilians (Central African Republic)		7	17	Central African Republic	Nana-Gribizi	Kaga-Bandoro	Kaga-Bandoro	Kaga Bandoro	6.98330	19.18330	1	All Africa	"Extensive reports of brutality against civilians in retaking of towns, particularly by MLC fighters. Violations target particularly Muslims and Chadian residents. Government denies reports."	0482	201CEN	10004	11/02/2003	2003	2	11	1	Violence against civilians	Military Forces of Central African Republic (1993-2003)	MLC: Movement for the Liberation of Congo	1	Civilians (Central African Republic)		7	17	Central African Republic	Ouaka	Grimari	Grimari	Grimari	5.73330	20.05000	1	All Africa	"Extensive reports of brutality against civilians in retaking of towns, particularly by MLC fighters. Violations target particularly Muslims and Chadian residents. Government denies reports."	0482	202CEN	10005	12/02/2003	2003	2	12	1	Battle-Government regains territory	Military Forces of Central African Republic (1993-2003)		1	Patriots Militia		3	13	Central African Republic	Nana-Gribizi	Kaga-Bandoro	Kaga-Bandoro	Kaga Bandoro	6.98330	19.18330	1	All Africa	Part of a regional push to retake the north. No fatality numbers available.	0482	203CEN	10006	12/02/2003	2003	2	12	1	Battle-No change of territory	MLC: Movement for the Liberation of Congo		2	Patriots Militia		3	23	Central African Republic	Ouaka	Grimari	Grimari	Grimari	5.73330	20.05000	1	All Africa	Part of a regional push to retake the north. No casualty numbers available.	0482	205CEN	10008	13/02/2003	2003	2	13	1	Violence against civilians	Military Forces of Central African Republic (1993-2003)	MLC: Movement for the Liberation of Congo	1	Civilians (Central African Republic)		7	17	Central African Republic	Kemo	Sibut	Sibut	Sibut	5.73330	19.08330	1	All Africa	"Extensive reports of brutality against civilians in retaking of towns, particularly by MLC fighters. Violations target particularly Muslims and Chadian residents. Government denies reports."	0482	207CEN	10010	13/02/2003	2003	2	13	1	Violence against civilians	Military Forces of Central African Republic (1993-2003)	MLC: Movement for the Liberation of Congo	1	Civilians (Central African Republic)		7	17	Central African Republic	Ouham	Bossangoa	Bossangoa	Bossangoa	6.48330	17.45000	1	All Africa	"Extensive reports of brutality against civilians in retaking of towns, particularly by MLC fighters. Violations target particularly Muslims and Chadian residents. Government denies reports."	0482	204CEN	10007	13/02/2003	2003	2	13	1	Battle-Government regains territory	Military Forces of Central African Republic (1993-2003)	MLC: Movement for the Liberation of Congo	1	Patriots Militia		3	13	Central African Republic	Kemo	Sibut	Sibut	Sibut	5.73330	19.08330	1	Agence France Press(AFP)	Part of ongoing struggle over the region bordering Chad. Patriots believed to be sheltering in Chad. No fatality numbers available.	0482	206CEN	10009	13/02/2003	2003	2	13	1	Battle-Government regains territory	Military Forces of Central African Republic (1993-2003)	MLC: Movement for the Liberation of Congo	1	Patriots Militia		3	13	Central African Republic	Ouham	Bossangoa	Bossangoa	Bossangoa	6.48330	17.45000	1	Agence France Press(AFP)	Part of ongoing struggle over the region bordering Chad. Patriots believed to be sheltering in Chad. No fatality numbers available.	0482	208CEN	10011	13/02/2003	2003	2	13	1	Battle-Government regains territory	Military Forces of Central African Republic (1993-2003)	MLC: Movement for the Liberation of Congo	1	Patriots Militia		3	13	Central African Republic	Ouham Pende	Bozoum	Bozoum	Bozoum	6.31670	16.38330	1	Agence France Press(AFP)	Part of ongoing struggle over the region bordering Chad. Patriots believed to be sheltering in Chad. No fatality numbers available.	0482	209CEN	10012	17/02/2003	2003	2	17	1	Battle-Government regains territory	Military Forces of Central African Republic (1993-2003)	MLC: Movement for the Liberation of Congo	1	Patriots Militia		3	13	Central African Republic	Ouham	Bossangoa	Bossangoa	Bossangoa	6.48330	17.45000	1	All Africa	No fatality numbers available.	0482	210CEN	10013	17/02/2003	2003	2	17	1	Violence against civilians	Unidentified Armed Group (Central African Republic)		3	Civilians (Chad)		7	37	Central African Republic	Ouham Pende	Bozoum	Bozoum	Bozoum	6.31670	16.38330	1	Associated Press	Two Chadian Imams shot. No information on who killed them.	2482	211CEN	10014	18/02/2003	2003	2	18	1	Battle-Non-state actor overtakes territory	Military Forces of Central African Republic (1993-2003)		1	Patriots Militia		3	13	Central African Republic	Ouham Pende	Bozoum	Bozoum	Bozoum	6.31670	16.38330	1	All Africa	No fatality numbers available. Reports unconfirmed.	0482	212CEN	10015	24/02/2003	2003	2	24	1	Violence against civilians	Military Forces of Central African Republic (1993-2003)		1	Civilians (Central African Republic)		7	17	Central African Republic	Bangui	Bangui	Bangui	Bangui	4.36670	18.58330	1	Agence France Press(AFP)	"Socrate Bozize, son of rebel leader Francois Bozize and student at Bangui University was arrested and beaten without charges."	0482	213CEN	10016	28/02/2003	2003	2	28	1	Battle-No change of territory	Military Forces of Central African Republic (1993-2003)		1	MLC: Movement for the Liberation of Congo		2	12	Central African Republic	Lobaye	Mongoumba	Mongoumba	Mongoumba	3.63330	18.60000	1	All Africa	Soldiers stopped two boats of MLC fighters withdrawing from the country with good looted from CAR. Fighters arrested. Goods and boats seized.	0482	214CEN	10017	03/03/2003	2003	3	3	1	Battle-No change of territory	Military Forces of Central African Republic (1993-2003)		1	MLC: Movement for the Liberation of Congo		2	12	Central African Republic	Lobaye	Mongoumba	Mongoumba	Mongoumba	3.63330	18.60000	1	All Africa	"A night of fighting' sent some 600 new refugees to Betikoumba, in DRC. It is unclear why FACA and MLC were fighting, since they are allies. No casualty figures available."	0482	215CEN	10018	03/03/2003	2003	3	3	1	Remote violence	Military Forces of Central African Republic (1993-2003)		1	MLC: Movement for the Liberation of Congo		2	12	Central African Republic	Lobaye	Mongoumba	Mongoumba	Mongoumba	3.63330	18.60000	1	All Africa	MLC soldiers who had been arrested and then released on 02-03-2003 returned from DRC with reinforcements to loot the village. They exchanged small arms and mortar fire with FACA.	0482	216CEN	10019	05/03/2003	2003	3	5	1	Battle-Government regains territory	Military Forces of Central African Republic (1993-2003)		1	Patriots Militia		3	13	Central African Republic	Ouham	Bossangoa	Bossangoa	Bossangoa	6.48330	17.45000	1	All Africa	"Government announces that, contrary to rumour, it definitely controls the town."	0482	217CEN	10020	05/03/2003	2003	3	5	1	Battle-Government regains territory	Military Forces of Central African Republic (1993-2003)		1	Patriots Militia		3	13	Central African Republic	Ouham Pende	Bozoum	Bozoum	Bozoum	6.31670	16.38330	1	All Africa	"Government announces that, contrary to rumour, it definitely controls the town."	0482	219CEN	10022	13/03/2003	2003	3	13	1	Battle-Non-state actor overtakes territory	Military Forces of Central African Republic (1993-2003)	CEMAC: Economic and Monetary Community of Central Africa	1	Patriots Militia		3	13	Central African Republic	Bangui	Bangui	Bangui	Bangui	4.36670	18.58330	1	Agence France Press(AFP)	Rebels attack from north of city. Take Patasse's residence and offices. 5 unknown people and 3 Congolese from CEMAC force killed. Dozens injured.	8482	218CEN	10021	13/03/2003	2003	3	13	1	Battle-Non-state actor overtakes territory	Military Forces of Central African Republic (1993-2003)		1	Patriots Militia		3	13	Central African Republic	Bangui	Bangui	Bangui	Bangui	4.36670	18.58330	1	Agence France Press(AFP)	"Rebels take hospital, radio and tv stations."	0482	220CEN	10023	13/03/2003	2003	3	13	1	Riots/Protests	Rioters (Central African Republic)		5			0	50	Central African Republic	Bangui	Bangui	Bangui	Bangui	4.36670	18.58330	1	Agence France Press(AFP)	Extensive looting and arson leaves central Bangui 'a wasteland.' Bozize's Patriots Militia reported to have both participated in the looting and also shot looters who ignored orders to stop. Bozize finally imposed a curfew Sunday night to restore order	0482	221CEN	10024	13/03/2003	2003	3	13	1	Riots/Protests	Rioters (Central African Republic)		5			0	50	Central African Republic	Bangui	Bangui	Bangui	Bangui	4.36670	18.58330	1	Agence France Press(AFP)	Extensive civil unrest and looting in the wake of Bozize's coup. Hospitals later report as many as 50 killed and hundreds wounded in the attack and ensuing unrest.	50482	223CEN	10026	14/03/2003	2003	3	14	1	Violence against civilians	Military Forces of Central African Republic (2003-2013)	Patriots Militia	1	Civilians (Central African Republic)		7	17	Central African Republic	Bangui	Bangui	Bangui	Bangui	4.36670	18.58330	1	Agence France Press(AFP)	Security forces throughout the city firing in an effort to stop looting in the wake of Bozize's coup.	0482	222CEN	10025	14/03/2003	2003	3	14	1	Riots/Protests	Rioters (Central African Republic)	Patriots Militia	5			0	50	Central African Republic	Bangui	Bangui	Bangui	Bangui	4.36670	18.58330	1	Agence France Press(AFP)	Extensive looting and arson leaves central Bangui 'a wasteland.' Bozize's Patriots Militia reported to have both participated in the looting and also shot looters who ignored orders to stop. Bozize finally imposed a curfew Sunday night to restore order	0482	225CEN	10028	16/03/2003	2003	3	16	1	Violence against civilians	Patriots Militia		3	Civilians (Central African Republic)		7	37	Central African Republic	Bangui	Bangui	Bangui	Bangui	4.36670	18.58330	1	Associated Press	Rebels (now acting as security forces) interrupted four armed civilians looting homes. They opened fire killing one and driving the others into the nearby forest.	1482	224CEN	10027	16/03/2003	2003	3	16	1	Riots/Protests	Rioters (Central African Republic)		5			0	50	Central African Republic	Bangui	Bangui	Bangui	Bangui	4.36670	18.58330	1	All Africa	"Youths with weapons stolen from Patasse's home go on a looting spree wearing turbans to disguise themselves as Chadians. Main targets are vehicles, petrol stations and other portable property."	0482	226CEN	10029	17/03/2003	2003	3	17	1	Riots/Protests	Rioters (Central African Republic)		5			0	50	Central African Republic	Bangui	Bangui	Bangui	Bangui	4.36670	18.58330	1	Associated Press	"Looters stormed the UN World Food Program's warehouse complex and carried off 1,800 tons of food in one night. An eyewitness said 'as though half the population of the capitol had converged.'"	0482	227CEN	10030	29/04/2003	2003	4	29	1	Violence against civilians	Military Forces of Central African Republic (2003-2013)		1	Civilians (Central African Republic)		7	17	Central African Republic	Bangui	Bangui	Bangui	Bangui	4.36670	18.58330	1	Pan Africa News	"2 killed, 8 injured as the army attempted to disperse civilians who came to a military camp in response to a recruitment call."	2482	228CEN	10031	09/05/2003	2003	5	9	1	Battle-No change of territory	Military Forces of Central African Republic (2003-2013)		1	Unidentified Armed Group (Central African Republic)		3	13	Central African Republic	Ouham	Bossangoa	Bossangoa	Bossangoa	6.48330	17.45000	1	All Africa	4 children rescued from abduction by cattle rustlers. One soldier and five rustlers wounded.	1482	229CEN	10032	30/05/2003	2003	5	30	1	Battle-No change of territory	CEMAC: Economic and Monetary Community of Central Africa		8	Unidentified Armed Group (Central African Republic)		3	38	Central African Republic	Ouaka	Bambari	Bambari	Bambari	5.76190	20.66720	1	All Africa	CEMAC unit ambushed. No further details available.	0482	230CEN	10033	04/06/2003	2003	6	4	1	Battle-Government regains territory	Military Forces of Central African Republic (2003-2013)	CEMAC: Economic and Monetary Community of Central Africa	1	Patriots Militia		3	13	Central African Republic	Bangui	Bangui	Bangui	Bangui	4.36670	18.58330	1	All Africa	"May 23rd Bozize initiates a push to rid Bangui of unauthorized firearms, particularly to disarm his own former rebels. By 06-06-2003 187 former rebels are disarmed and cantoned. Some willingly and some otherwise. Stores of arms and ammunition recovere"	0482	231CEN	10034	15/06/2003	2003	6	15	1	Battle-No change of territory	CEMAC: Economic and Monetary Community of Central Africa		8	Patriots Militia		3	38	Central African Republic	Bangui	Bangui	Bangui	Bangui	4.36670	18.58330	1	All Africa	CEMAC troops move in to disperse a rebel roadblock protesting unpaid wages.	0482	232CEN	10035	15/06/2003	2003	6	15	1	Remote violence	Patriots Militia		3	Civilians (Central African Republic)		7	37	Central African Republic	Bangui	Bangui	Bangui	Bangui	4.36670	18.58330	1	All Africa	"Former Bozize supporters erect a roadblock protesting unpaid wages, firing a rocket into a nearby house and shooting a truck driver who tried to pass."	1482	233CEN	10036	19/06/2003	2003	6	19	1	Battle-No change of territory	CEMAC: Economic and Monetary Community of Central Africa		8	Unidentified Armed Group (Central African Republic)		3	38	Central African Republic	Ouaka	Ippy	Yéngou	Coia	6.11670	21.78330	1	All Africa	CEMAC patrol ambushed by 16 men. No casualty figures available.	0482	234CEN	10037	21/06/2003	2003	6	21	1	Battle-No change of territory	CEMAC: Economic and Monetary Community of Central Africa		8	Unidentified Armed Group (Central African Republic)		3	38	Central African Republic	Ouaka	Bambari	Bambari	Bambari	5.76190	20.66720	1	All Africa	CEMAC patrol ambushed by 11 men. No casualty figures available.	0482	235CEN	10038	23/06/2003	2003	6	23	1	Battle-No change of territory	CEMAC: Economic and Monetary Community of Central Africa		8	Unidentified Armed Group (Central African Republic)		3	38	Central African Republic	Kemo	Sibut	Sibut	Sibut	5.73330	19.08330	1	All Africa	CEMAC patrol ambushed by 6 men. No casualty figures available. Two prisoners taken.	0482	236CEN	10039	26/07/2003	2003	7	26	1	Battle-Government regains territory	Military Forces of Central African Republic (2003-2013)		1	Unidentified Armed Group (Central African Republic)		3	13	Central African Republic	Ouham	Bouca	Bouca Bobo	Bouca	6.51046	18.27331	1	All Africa	"Government claims the north of CAR has been secured after a 4 day campaign to drive out bandits, rebels and robbers."	0482	237CEN	10040	27/07/2003	2003	7	27	1	Battle-Government regains territory	Military Forces of Central African Republic (2003-2013)		1	Unidentified Armed Group (Central African Republic)		3	13	Central African Republic	Ouham	Bouca	Bouca Bobo	Bouca	6.51046	18.27331	1	All Africa	"Government claims the north of CAR has been secured after a 4 day campaign to drive out bandits, rebels and robbers."	0482	238CEN	10041	28/07/2003	2003	7	28	1	Battle-Government regains territory	Military Forces of Central African Republic (2003-2013)		1	Unidentified Armed Group (Central African Republic)		3	13	Central African Republic	Ouham	Bouca	Bouca Bobo	Bouca	6.51046	18.27331	1	All Africa	"Government claims the north of CAR has been secured after a 4 day campaign to drive out bandits, rebels and robbers."	0482	239CEN	10042	29/07/2003	2003	7	29	1	Battle-Government regains territory	Military Forces of Central African Republic (2003-2013)		1	Unidentified Armed Group (Central African Republic)		3	13	Central African Republic	Ouham	Bouca	Bouca Bobo	Bouca	6.51046	18.27331	1	All Africa	"Government claims the north of CAR has been secured after a 4 day campaign to drive out bandits, rebels and robbers."	0482	241CEN	10044	16/08/2003	2003	8	16	1	Violence against civilians	Military Forces of Central African Republic (2003-2013)		1	Civilians (Central African Republic)		7	17	Central African Republic	Bangui	Bangui	Bangui	Bangui	4.36670	18.58330	1	Associated Press	Soldiers using live ammo dispersed high school students took to the streets to protest the delay in their exam scores.	1482	240CEN	10043	16/08/2003	2003	8	16	1	Riots/Protests	Protesters (Central African Republic)		6			0	60	Central African Republic	Bangui	Bangui	Bangui	Bangui	4.36670	18.58330	1	Associated Press	High school students took to the streets to protest the delay in their exam scores.	0482	242CEN	10045	13/10/2003	2003	10	13	1	Violence against civilians	Military Forces of Central African Republic (2003-2013)		1	Civilians (Nigeria)		7	17	Central African Republic	Bangui	Bangui	Bangui	Bangui	4.36670	18.58330	1	Agence France Press(AFP)	Nigerian national abducted and killed by soldiers.	1482	243CEN	10046	16/10/2003	2003	10	16	1	Violence against civilians	Unidentified Armed Group (Central African Republic)		3	Civilians (Central African Republic)		7	37	Central African Republic	Bangui	Bangui	Bangui	Bangui	4.36670	18.58330	1	All Africa	Rebels built a roadblock on the main road into Bangui to demand integration into the army. They stoned passing cars and extorted money and cell phones from passers-by. FACA and CEMAC troops arrived with tanks but urged them to discussions rather than a	0482	244CEN	10047	26/10/2003	2003	10	26	1	Violence against civilians	Military Forces of Central African Republic (2003-2013)		1	Civilians (Central African Republic)		7	17	Central African Republic	Bangui	Bangui	Bangui	Bangui	4.36670	18.58330	1	Agence France Press(AFP)	"5 republican guard gang raped a woman. The men and their 2 commanders were fired and arrested. The head of the guard, Louis Mazangue was sacked and named prefect of Haut Mbomou."	0482	245CEN	10048	18/11/2003	2003	11	18	1	Violence against civilians	Unidentified Armed Group (Central African Republic)		3	Civilians (Central African Republic)		7	37	Central African Republic	Bangui	Bangui	Bangui	Bangui	4.36670	18.58330	1	All Africa	Woman raped by 5 unidentified men in Boeing suberb.	0482	246CEN	10049	21/11/2003	2003	11	21	1	Battle-No change of territory	CEMAC: Economic and Monetary Community of Central Africa		8	Unidentified Armed Group (Central African Republic)		3	38	Central African Republic	Bangui	Bangui	Bangui	Bangui	4.36670	18.58330	1	All Africa	CEMAC unit ambushed on the way to the home of a gendarme besieged by men identified as robbers. One Chadian soldier killed trying to prevent the rape of the gendarme's 14 yr old daughter.	1482	247CEN	10050	21/11/2003	2003	11	21	1	Violence against civilians	Unidentified Armed Group (Central African Republic)		3	Civilians (Central African Republic)		7	37	Central African Republic	Bangui	Bangui	Bangui	Bangui	4.36670	18.58330	1	All Africa	A group identified as robbers besieged the home of a gendarme and raped his 14 yr old daughter.	0482	248CEN	10051	25/11/2003	2003	11	25	1	Battle-No change of territory	Military Forces of Central African Republic (2003-2013)		1	Unidentified Armed Group (Central African Republic)		3	13	Central African Republic	Haute-Kotto	Ouadda	Ouadda	Ouadda	8.06670	22.40000	1	All Africa	10 children freed from ransoming cattle rustlers.	0482	249CEN	10052	01/12/2003	2003	12	1	1	Violence against civilians	Military Forces of Central African Republic (2003-2013)		1	Civilians (Central African Republic)		7	17	Central African Republic	Bangui	Bangui	Bangui	Bangui	4.36670	18.58330	1	Agence France Press(AFP)	Security forces arrested several members of a citizens' self-defence committee. Most were later released but three were summarily executed without explanation.	3482	250CEN	10053	02/12/2003	2003	12	2	1	Violence against civilians	Military Forces of Central African Republic (2003-2013)		1	Civilians (Central African Republic)		7	17	Central African Republic	Bangui	Bangui	Bangui	Bangui	4.36670	18.58330	1	All Africa	Victims were members of a local self defence group. Bodies found in a cemetery.	4482	251CEN	10054	04/12/2003	2003	12	4	1	Battle-No change of territory	Military Forces of Central African Republic (2003-2013)		1	Patriots Militia		3	13	Central African Republic	Bangui	Bangui	Bangui	Bangui	4.36670	18.58330	1	Associated Press	Chadian mercenaries who helped Bozize's coup d'etat killed a soldier.	1482	252CEN	10055	04/12/2003	2003	12	4	1	Riots/Protests	Rioters (Central African Republic)		5			0	50	Central African Republic	Bangui	Bangui	Bangui	Bangui	4.36670	18.58330	1	Associated Press	At least 4000 civilians riot because Chadian mercenaries who helped Bozize's coup d'etat killed a soldier. 3 Chadians killed.	3482	253CEN	10056	13/12/2003	2003	12	13	1	Violence against civilians	Military Forces of Central African Republic (2003-2013)		1	Civilians (Central African Republic)		7	17	Central African Republic	Bangui	Bangui	Bangui	Bangui	4.36670	18.58330	1	Agence France Press(AFP)	"Youths abducted, tortured and killed by security forces."	3482	254CEN	10057	30/12/2003	2003	12	30	1	Violence against civilians	Military Forces of Central African Republic (2003-2013)		1	Civilians (Central African Republic)		7	17	Central African Republic	Bangui	Bangui	Bangui	Bangui	4.36670	18.58330	1	Pan Africa News	Bodyguards of first lady Monique Bozize killed two and wounded several others when they were overwhelmed by crowds welcoming the first lady on a hospital visit.	2482	255CEN	10058	15/01/2004	2004	1	15	1	Violence against civilians	Patriots Militia		3	Civilians (Central African Republic)		7	37	Central African Republic	Bangui	Bangui	Bangui	Bangui	4.36670	18.58330	1	Pan Africa News	"Bozize's ex-fighters blocked the pk 12 road, a main access road to Bangui, to protest unpaid wages. They took hostage several security officers hostage after a brief shootout, built a barricade, raped and beat passers-by etc. Bozize eventually met with"	0482	256CEN	10059	15/02/2004	2004	2	15	1	Riots/Protests	Rioters (Central African Republic)		5			0	50	Central African Republic	Bangui	Bangui	Bangui	Bangui	4.36670	18.58330	1	Pan Africa News	Students of Bangui university demonstrating and rioting for better conditions on campus.	0482	257CEN	10060	16/02/2004	2004	2	16	1	Riots/Protests	Rioters (Central African Republic)		5			0	50	Central African Republic	Bangui	Bangui	Bangui	Bangui	4.36670	18.58330	1	Pan Africa News	Students of Bangui university demonstrating and rioting for better conditions on campus.	0482	258CEN	10061	17/02/2004	2004	2	17	1	Riots/Protests	Rioters (Central African Republic)		5			0	50	Central African Republic	Bangui	Bangui	Bangui	Bangui	4.36670	18.58330	1	Pan Africa News	Students of Bangui university demonstrating and rioting for better conditions on campus.	0482	259CEN	10062	18/02/2004	2004	2	18	1	Riots/Protests	Rioters (Central African Republic)		5			0	50	Central African Republic	Bangui	Bangui	Bangui	Bangui	4.36670	18.58330	1	Pan Africa News	Students of Bangui university demonstrating and rioting for better conditions on campus.	0482	260CEN	10063	19/02/2004	2004	2	19	1	Riots/Protests	Rioters (Central African Republic)		5			0	50	Central African Republic	Bangui	Bangui	Bangui	Bangui	4.36670	18.58330	1	Pan Africa News	Students of Bangui university demonstrating and rioting for better conditions on campus.	0482	261CEN	10064	20/02/2004	2004	2	20	1	Riots/Protests	Rioters (Central African Republic)		5			0	50	Central African Republic	Bangui	Bangui	Bangui	Bangui	4.36670	18.58330	1	Pan Africa News	Students of Bangui university demonstrating and rioting for better conditions on campus.	0482	262CEN	10065	21/02/2004	2004	2	21	1	Riots/Protests	Rioters (Central African Republic)		5			0	50	Central African Republic	Bangui	Bangui	Bangui	Bangui	4.36670	18.58330	1	Pan Africa News	Students of Bangui university demonstrating and rioting for better conditions on campus.	0482	263CEN	10066	21/02/2004	2004	2	21	1	Violence against civilians	Unidentified Armed Group (Central African Republic)		3	Civilians (Central African Republic)		7	37	Central African Republic	Ouham	Bouca	Fafa Boungou	Donzi	6.26670	18.35000	1	All Africa	"6 armed men on horseback raided the village, wounding two civilians and looting."	0482	264CEN	10067	15/04/2004	2004	4	15	1	Battle-No change of territory	Military Forces of Central African Republic (2003-2013)		1	Patriots Militia		3	13	Central African Republic	Bangui	Bangui	Bangui	Bangui	4.36670	18.58330	1	BBC Monitoring	"Ex-rebels mounted roadblocks in a residential district. 17 wounded including the CAR minister of mines hit by a stray bullet while driving home. Some of the dead may have been civilians, no further info available."	6482	265CEN	10068	15/04/2004	2004	4	15	1	Battle-No change of territory	Military Forces of Central African Republic (2003-2013)		1	Patriots Militia		3	13	Central African Republic	Bangui	Bangui	Bangui	Bangui	4.36670	18.58330	1	Afrol News	Former rebels built barricades on the outskirts of town and engaged government troops demanding 1 million CFA apiece.	6482	266CEN	10069	20/04/2004	2004	4	20	1	Battle-No change of territory	CEMAC: Economic and Monetary Community of Central Africa		8	Patriots Militia		3	38	Central African Republic	Bangui	Bangui	Bangui	Bangui	4.36670	18.58330	1	Agence France Press(AFP)	Clash between armed services and rebels. No further details available.	0482	267CEN	10070	22/04/2004	2004	4	22	1	Battle-No change of territory	CEMAC: Economic and Monetary Community of Central Africa		8	Patriots Militia		3	38	Central African Republic	Bangui	Bangui	Bangui	Bangui	4.36670	18.58330	1	Agence France Press(AFP)	Clash between armed services and rebels. No further details available.	0482	268CEN	10071	03/05/2004	2004	5	3	1	Violence against civilians	Military Forces of Central African Republic (2003-2013)		1	Civilians (Chad)		7	17	Central African Republic	Bangui	Bangui	Bangui	Bangui	4.36670	18.58330	1	Pan Africa News	A former rebel was seized and beaten by uniformed men.	0482	269CEN	10072	14/05/2004	2004	5	14	1	Violence against civilians	Military Forces of Central African Republic (2003-2013)		1	Civilians (Chad)		7	17	Central African Republic	Bangui	Bangui	Bangui	Bangui	4.36670	18.58330	1	Pan Africa News	Chadian resident of Bangui and former rebel was seized and beaten after uniformed men broke into his house in the night. He was released only after his wife informed the Chadian embassy.	0482	270CEN	10073	21/05/2004	2004	5	21	1	Violence against civilians	Police Forces of Central African Republic (2003-2013)		1	Civilians (Chad)		7	17	Central African Republic	Bangui	Bangui	Bangui	Bangui	4.36670	18.58330	1	Agence France Press(AFP)	A Chadian trader was arrested after threatening police with a knife when they tried to search him. The trader's relatives say he was then beaten to death by the police.	0482	272CEN	10075	22/05/2004	2004	5	22	1	Violence against civilians	Police Forces of Central African Republic (2003-2013)		1	Civilians (Chad)		7	17	Central African Republic	Bangui	Bangui	Bangui	Bangui	4.36670	18.58330	1	Agence France Press(AFP)	Police fired in the air to disperse Chadian protesters after a Chadian trader was allegedly beaten to death by the police. No fatalities.	0482	271CEN	10074	22/05/2004	2004	5	22	1	Riots/Protests	Protesters (Central African Republic)		6			0	60	Central African Republic	Bangui	Bangui	Bangui	Bangui	4.36670	18.58330	1	Agence France Press(AFP)	Some 200 Chadian protesters took to the streets and built barricades after a Chadian trader was allegedly beaten to death by the police. No fatalities.	0482	273CEN	10076	05/07/2004	2004	7	5	1	Battle-No change of territory	Military Forces of Central African Republic (2003-2013)		1	Unidentified Armed Group (Central African Republic)		3	13	Central African Republic	Nana-Gribizi	Kaga-Bandoro	Kaga-Bandoro	Kaga Bandoro	6.98330	19.18330	1	BBC Monitoring	Part of a general push to secure the countryside from rebels and bandits.	2482	274CEN	10077	05/07/2004	2004	7	5	1	Battle-No change of territory	Military Forces of Central African Republic (2003-2013)		1	Unidentified Armed Group (Central African Republic)		3	13	Central African Republic	Ouham Pende	Bozoum	Bozoum	Bozoum	6.31670	16.38330	1	BBC Monitoring	Part of a push to secure the countryside from rebels and bandits.Fight took place on the road from Paoua to Bozoum.	4482	275CEN	10078	05/07/2004	2004	7	5	1	Battle-No change of territory	Military Forces of Central African Republic (2003-2013)		1	Unidentified Armed Group (Central African Republic)		3	13	Central African Republic	Ouham Pende	Paoua	Paoua	Paoua	7.25000	16.43330	1	BBC Monitoring	Part of a push to secure the countryside from rebels and bandits.Fight took place on the road from Paoua to Bozoum.	4482	276CEN	10079	28/10/2004	2004	10	28	1	Battle-No change of territory	Military Forces of Central African Republic (2003-2013)		1	Unidentified Armed Group (Central African Republic)		3	13	Central African Republic	Ouham Pende	Paoua	Bimbi	Bavara	6.78330	16.60000	1	Associated Press	Rebels attacked killing 3 soldiers and taking 10 captive.	3482	277CEN	10080	30/10/2004	2004	10	30	1	Battle-No change of territory	Military Forces of Central African Republic (2003-2013)		1	PRL: Redeemed Patriots Former Liberators		2	12	Central African Republic	Ouham Pende	Bocaranga	Bocaranga	Bocaranga	6.98330	15.65000	1	BBC Monitoring	No further details available.	0482	278CEN	10081	30/10/2004	2004	10	30	1	Battle-No change of territory	Military Forces of Central African Republic (2003-2013)		1	PRL: Redeemed Patriots Former Liberators		2	12	Central African Republic	Ouham Pende	Bocaranga	Bocaranga	Bocaranga	6.98330	15.65000	1	BBC Monitoring	"Two soldiers killed in an ambush. Responsibility later claimed by previously unknown group, PRL."	2482	279CEN	10082	05/11/2004	2004	11	5	1	Violence against civilians	Unidentified Armed Group (Central African Republic)		3	Civilians (Central African Republic)		7	37	Central African Republic	Nana-Mambere	Bouar	Herman-Brousse	Bouar	5.95000	15.60000	1	BBC Monitoring	Leader of Mbororo nomads killed about 100km from the city. Many Mbororo fleeing to Cameroon to avoid further attacks.	0482	280CEN	10083	05/11/2004	2004	11	5	1	Non-violent transfer of territory	Unidentified Armed Group (Central African Republic)		3			0	30	Central African Republic	Ouham	Batangafo	Batangafo	Batangafo	7.30000	18.30000	1	BBC Monitoring	"Armed men suspected of being Sudanese took over the road between Batangafo and Sarh, possibly in an attempt to control oil resources."	0482	281CEN	10084	05/11/2004	2004	11	5	1	Non-violent transfer of territory	Unidentified Armed Group (Central African Republic)		3			0	30	Central African Republic	Ouham Pende	Paoua	Paoua	Paoua	7.25000	16.43330	1	BBC Monitoring	Armed men rumoured to be Chadians who backed Bozize's coup took over the town.	0482	282CEN	10085	17/11/2004	2004	11	17	1	Violence against civilians	Civilians (Central African Republic)		7	Unidentified Armed Group (Central African Republic)		3	37	Central African Republic	Vakaga	Birao	Ridina	Birao	10.28000	22.78000	1	Agence France Press(AFP)	Sudanese force suspected of being SPLA raided apparently to steal fuel. They were driven off by FACA. 4 civilians and 1 FACA soldier killed. Several injured. Attackers later thought to be Chadian	5482	283CEN	10086	17/11/2004	2004	11	17	1	Violence against civilians	SPLA/M: Sudanese People's Liberation Army/Movement		2	Civilians (Central African Republic)	Military Forces of Central African Republic (2003-2013) Bozize Faction	7	27	Central African Republic	Vakaga	Birao	Ridina	Birao	10.28000	22.78000	1	Agence France Press(AFP)	Identity of attackers uncertain. Later reports suspect unspecific Chadians. Several people wounded and property damaged. Officials including UN reps held hostage but later released One soldier and 6 civilians killed.	7482	284CEN	10087	21/11/2004	2004	11	21	1	Violence against civilians	Unidentified Armed Group (Central African Republic)		3	Civilians (Central African Republic)		7	37	Central African Republic	Vakaga	Birao	Ridina	Birao	10.28000	22.78000	1	BBC	No identity on raiders. May have been either CAR or Sudanese bandits.	20482	285CEN	10088	23/11/2004	2004	11	23	1	Violence against civilians	Civilians (Central African Republic)		7	Unidentified Armed Group (Central African Republic)		3	37	Central African Republic	Vakaga	Birao	Ridina	Birao	10.28000	22.78000	1	BBC News	At least 20 individuals killed by Unknown Raiders in Birao. Suspected opponents of President Francois Bozize.	20482	286CEN	10089	20/03/2005	2005	3	20	1	Battle-No change of territory	Military Forces of Central African Republic (2003-2013)		1	Private Security Forces (Central African Republic)		8	18	Central African Republic	Bangui	Bangui	Bangui	Bangui	4.36670	18.58330	1	Agence France Press(AFP)	Post electoral skirmish between Bozize's Republican guard and security forces of defeated candidate Kolingba. Govt. blames a misunderstanding. One soldier wounded.	0482	288CEN	10091	17/04/2005	2005	4	17	1	Violence against civilians	Police Forces of Central African Republic (2003-2013)		1	Civilians (Central African Republic)		7	17	Central African Republic	Ouham Pende	Paoua	Banh	Bambala	7.11670	16.38330	1	BBC	"A police officer shot a young man, apparently for calling him 'auxiliary.'"	1482	287CEN	10090	17/04/2005	2005	4	17	1	Riots/Protests	Protesters (Central African Republic)		6			0	60	Central African Republic	Ouham Pende	Paoua	Banh	Bambala	7.11670	16.38330	1	BBC	Citizens stormed a police post to protest the police killing of a young man.	0482	289CEN	10092	01/05/2005	2005	5	1	1	Violence against civilians	Military Forces of Central African Republic (2003-2013)		1	Civilians (Central African Republic)		7	17	Central African Republic	Haut-Mbomou	Djema	Djema	Djema	6.05000	25.31667	1	BBC Monitoring	An opposition party MP was struck by a stray bullet fired by soldiers guarding the presidential coalition. Supporters claim deliberate intimidation.	0482	290CEN	10093	13/05/2005	2005	5	13	1	Riots/Protests	Protesters (Central African Republic)		6			0	60	Central African Republic	Bangui	Bangui	Bangui	Bangui	4.36670	18.58330	1	Agence France Press(AFP)	Opposition party members protesting election results.	0482	291CEN	10094	03/07/2005	2005	7	3	1	Battle-No change of territory	Military Forces of Central African Republic (2003-2013)		1	Unidentified Armed Group (Central African Republic)		3	13	Central African Republic	Nana-Mambere	Baboua	Baboua	Sakani	5.33330	14.90000	1	Agence France Press(AFP)	"On Cameroonian intellegence, FACA attacked bandits believed to be the remnants of the Chadian Zakawa who helped Bozize to office in 2003. 50 hostages were released."	36482	292CEN	10095	11/07/2005	2005	7	11	1	Battle-No change of territory	Military Forces of Central African Republic (2003-2013)		1	Unidentified Armed Group (Central African Republic)		3	13	Central African Republic	Nana-Mambere	Abba	Abba	Baboua	5.50000	15.00000	1	BBC Monitoring	"In cooperation with Cameroon, CAR forces took a rebel base and released some 50 hostages."	36482	293CEN	10096	17/07/2005	2005	7	17	1	Violence against civilians	Unidentified Armed Group (Central African Republic)		3	Civilians (Central African Republic)		7	37	Central African Republic	Ouham	Batangafo	Batangafo	Batangafo	7.30000	18.30000	1	All Africa	Refugees arriving in Chad report that 25 men attacked their village. No casualty figures available.	0482	294CEN	10097	07/08/2005	2005	8	7	1	Violence against civilians	Unidentified Armed Group (Central African Republic)		3	Civilians (Central African Republic)		7	37	Central African Republic	Vakaga	Birao	Ridina	Birao	10.28000	22.78000	1	BBC	Unknown raiders looting and driving out civilians. No further details available.	0482	295CEN	10098	13/09/2005	2005	9	13	1	Battle-Government regains territory	Military Forces of Central African Republic (2003-2013)		1	Unidentified Armed Group (Central African Republic)		3	13	Central African Republic	Vakaga	Birao	Ridina	Birao	10.28000	22.78000	1	Global Insight	Major push to secure the north/west cleans out a raiders base. No casualty figures available.	0482	296CEN	10099	13/09/2005	2005	9	13	1	Battle-No change of territory	Military Forces of Central African Republic (2003-2013)		1	Unidentified Armed Group (Central African Republic)		3	13	Central African Republic	Vakaga	Birao	Ridina	Birao	10.28000	22.78000	1	Global Insight	During a major push to secure the north/west suppressed four bandits. No casualty figures available.	0482	297CEN	10100	26/09/2005	2005	9	26	1	Non-violent transfer of territory	FDPC: Democratic Front for the People of the Central African Republic		2			0	20	Central African Republic	Ouham	Markounda	Nana Markounda	Markounda	7.61670	16.98330	1	Global Insight/Alwidha	FACA representatives deny rebels claims of taking territory.	0482	298CEN	10101	04/10/2005	2005	10	4	1	Violence against civilians	Unidentified Armed Group (Central African Republic)		3	Civilians (Central African Republic)		7	37	Central African Republic	Ouham Pende	Bozoum	Bozoum	Bozoum	6.31670	16.38330	1	Agence France Press(AFP)	Bandits kidnapped 24 children. No casualty figures available.	0482	299CEN	10102	18/10/2005	2005	10	18	1	Non-violent transfer of territory	Unidentified Armed Group (Central African Republic)		3			0	30	Central African Republic	Nana-Mambere	Baoro	Bawi Tédoa	Baoro	5.66670	15.96670	1	Global Insight/Centrafrique Presse	Unknown armed men took over a village '25km from Baoro.'	0482	300CEN	10103	19/10/2005	2005	10	19	1	Battle-No change of territory	Military Forces of Central African Republic (2003-2013)		1	Unidentified Armed Group (Central African Republic)		3	13	Central African Republic	Nana-Mambere	Baoro	Bawi Tédoa	Baoro	5.66670	15.96670	1	Global Insight/Centrafrique Presse	FACA attacked a group holding a village 25km from Baoro. It is unclear who held the village after the fight.	0482	301CEN	10104	25/10/2005	2005	10	25	1	Battle-No change of territory	Military Forces of Central African Republic (2003-2013)	FOMUC: Multinational Force in the Central African Republic	1	APRD: Popular Army for the Restoration of the Republic and Democracy		2	12	Central African Republic	Ouham	Markounda	Nana Markounda	Markounda	7.61670	16.98330	1	Global Insight	This is the first appearance of APRD. Fatalities mentioned but no numbers available.	0482	302CEN	10105	28/10/2005	2005	10	28	1	Battle-No change of territory	Military Forces of Central African Republic (2003-2013)	FOMUC: Multinational Force in the Central African Republic	1	APRD: Popular Army for the Restoration of the Republic and Democracy		2	12	Central African Republic	Ouham	Markounda	Nana Markounda	Markounda	7.61670	16.98330	1	Global Insight	Fatalities mentioned but no numbers available.	0482	303CEN	10106	28/10/2005	2005	10	28	1	Battle-No change of territory	Military Forces of Central African Republic (2003-2013)	FOMUC: Multinational Force in the Central African Republic	1	APRD: Popular Army for the Restoration of the Republic and Democracy		2	12	Central African Republic	Ouham	Markounda	Nana Markounda	Markounda	7.61670	16.98330	1	Global Insight	Fatalities mentioned but no numbers available. Article refers to APRD as a previously unknown group.	0482	304CEN	10107	29/11/2005	2005	11	29	1	Battle-No change of territory	Police Forces of Central African Republic (2003-2013)		1	APRD: Popular Army for the Restoration of the Republic and Democracy		2	12	Central African Republic	Ouham	Kabo	Sido	Kabo	7.65000	18.61670	1	BBC Monitoring	"Assorted Kabo officials later dismissed on charges of conspiring with the rebels, who said they were trying to overthrow Bozize. No casualty figures available."	0482	305CEN	10108	04/01/2006	2006	1	4	1	Battle-No change of territory	Military Forces of Central African Republic (2003-2013)		1	Unidentified Armed Group (Central African Republic)		3	13	Central African Republic	Vakaga	Birao	Ouandja	Vakaga	9.80000	21.53330	2	BBC Monitoring and Central African Republic Radio	The defense ministry has issued a communique acknowledging the violent fighting on 26 May in the prefecture of Vakaga between CAR regular forces and rebels.	0482	306CEN	10109	05/01/2006	2006	1	5	2	Riots/Protests	Protesters (Central African Republic)		6			0	60	Central African Republic	Bangui	Bangui	Bangui	Bangui	4.36670	18.58330	2	IRIN weekly reports		0482	307CEN	10110	10/01/2006	2006	1	10	1	Violence against civilians	Military Forces of Chad (1990-)		8	Civilians (Central African Republic)		7	78	Central African Republic	Ouham Pende	Paoua	Mia-Péndé	Bemal	7.58330	16.63330	1	Human Rights Watch	"Chadian troops in three army trucks attacked B?¬mal firing randomly at the population and taking 32 cows from the village, as well as farming implements and sacks of peanuts."	0482	308CEN	10111	31/01/2006	2006	1	31	1	Battle-No change of territory	Military Forces of Central African Republic (2003-2013)		1	Unidentified Armed Group (Central African Republic)		3	13	Central African Republic	Ouham Pende	Paoua	Paoua	Paoua	7.25000	16.43330	1	Agence France Presse AFPR000020060205e225009kh	"Troops in the CAR killed about 10 unidentified ""armed bandits"" who attacked Paoua, 500 km north of the capital Bangui. Several of the attackers were wounded and others taken prisoner."	10482	309CEN	10112	10/02/2006	2006	2	10	1	Battle-Government regains territory	Military Forces of Central African Republic (2003-2013)	Military Forces of France	1	UFDR: Union of Democratic Forces for Unity		2	12	Central African Republic	Ouham	Bouca	Fafa Boungou	Yangou	6.28330	18.35000	1	Agence France Presse AFPR000020061202e2c2005vo	"FACA recaptured the town of Sam Ouandja supported by French troops. Sam Ouandja lies 800 km northeast of Bangui. UFDR accused the army of killing 28 civilians, all young men, and then ransacking the town. Sam Ouandja is not in the database, but Yangou is"	28482	310CEN	10113	13/02/2006	2006	2	13	1	Battle-No change of territory	Military Forces of Central African Republic (2003-2013)		1	APRD: Popular Army for the Restoration of the Republic and Democracy		2	12	Central African Republic	Ouham	Markounda	Nana Markounda	Bodjomo	7.40000	17.15000	1	IRIN weekly reports		0482	311CEN	10114	13/02/2006	2006	2	13	1	Battle-No change of territory	Military Forces of Central African Republic (2003-2013)		1	APRD: Popular Army for the Restoration of the Republic and Democracy		2	12	Central African Republic	Ouham	Markounda	Nana Markounda	Markounda	7.61670	16.98330	1	IRIN weekly reports		0482	312CEN	10115	13/02/2006	2006	2	13	1	Battle-No change of territory	Military Forces of Central African Republic (2003-2013)		1	APRD: Popular Army for the Restoration of the Republic and Democracy		2	12	Central African Republic	Ouham Pende	Paoua	Mia-Péndé	Bemal	7.58330	16.63330	1	IRIN weekly reports		0482	313CEN	10116	26/02/2006	2006	2	26	1	Battle-No change of territory	Military Forces of Central African Republic (2003-2013)		1	UFDR: Union of Democratic Forces for Unity		2	12	Central African Republic	Ouham Pende	Paoua	Paoua	Paoua	7.25000	16.43330	1	IRIN weekly reports		0482	314CEN	10117	10/03/2006	2006	3	10	1	Battle-Government regains territory	Military Forces of France	Military Forces of Central African Republic (1993-2003)	8	UFDR: Union of Democratic Forces for Unity		2	28	Central African Republic	Bamingui-Bangoran	Ndele	Dar El Kouti	Ndele	8.40910	20.65300	1	Agence France Presse AFPR000020061203e2c300593	"UFDR has surrendered Ndele and now only controls Ouadda Djalle. After the fall of the town of Sam Ouandja on Saturday, and Ndele, the rebels only hold one major town, Ouadda Djalle, around 800 km northeast of Bangui."	0482	315CEN	10118	29/04/2006	2006	4	29	1	Violence against civilians	Police Forces of Central African Republic (2003-2013)		1	Civilians (Central African Republic)		7	17	Central African Republic	Bangui	Bangui	Bangui	Bangui	4.36670	18.58330	1	Reuters LBA0000020060105e215001i4	"Two people were killed in rioting in CAR after security forces opened fire in a confrontation with a crowd mourning a murdered soldier. The soldier killed was by a member of the presidential guard in a tit-for-tat killing. Allegedly, the dead man had kil"	2482	316CEN	10119	10/05/2006	2006	5	10	1	Battle-No change of territory	Military Forces of Central African Republic (2003-2013)	Military Forces of France	1	UFDR: Union of Democratic Forces for Unity		2	12	Central African Republic	Bangui	Bangui	Bangui	Bangui	4.36670	18.58330	1	Agence France Presse LBA0000020061205e2c5001me	"Presidential press spokesman Barthelemy Feidoka said UFDR rebels, General Damane Zakaria and Capt. Diego Albator Yao, were killed in fighting with government troops. There was no independent confirmation."	2482	317CEN	10120	22/05/2006	2006	5	22	1	Violence against civilians	Civilians (Central African Republic)		7	Military Forces of Central African Republic (2003-2013)		1	17	Central African Republic	Ouham Pende	Paoua	Mia-Péndé	Bemal	7.58330	16.63330	1	Human Rights Watch	Single GP unit beheaded a teacher in Bemal. Same GP unit as Feb. civilian murders.	0482	318CEN	10121	26/05/2006	2006	5	26	1	Battle-No change of territory	Unidentified Armed Group (Central African Republic)		3	Military Forces of Central African Republic (2003-2013)		1	13	Central African Republic	Vakaga	Birao	Ouandja	Tiroungoulou	9.56660	22.15000	1	Reuters LBA0000020060627e26r000sg	A raid by Chadian rebels near Tiroungoulou left two Central African soldiers dead.	2482	319CEN	10122	03/06/2006	2006	6	3	1	Violence against civilians	APRD: Popular Army for the Restoration of the Republic and Democracy		2	Civilians (Central African Republic)		7	27	Central African Republic	Vakaga	Birao	Ouandja	Gordil	9.73330	21.58330	2	IRIN weekly reports		0482	320CEN	10123	18/06/2006	2006	6	18	1	Violence against civilians	Unidentified Armed Group (Central African Republic)		3	Civilians (Central African Republic)		7	37	Central African Republic	Ouham Pende	Bozoum	Bozoum	Bozoum	6.31670	16.38330	1	BBC Monitoring and Radio France Internationale BBC	"Seven children of shepherds were abducted and killed by highway bandits in the north of the CAR. The children were held 15 days and bandits demanded a ""lion's ransom"" from their parents."	0482	322CEN	10125	27/06/2006	2006	6	27	1	Battle-No change of territory	Military Forces of Central African Republic (2003-2013)	CEMAC: Economic and Monetary Community of Central Africa	1	Unidentified Armed Group (Chad)		3	13	Central African Republic	Vakaga	Birao	Ouandja	Gordil	9.73330	21.58330	1	Agence France Presse AFPR000020060627e26r0039z	Clashes between the CAR army/CEMAC and Chadian rebels resulted in 71 Chadian rebels and five members of the CAR/CEMAC force dying in the fighting.	76482	321CEN	10124	27/06/2006	2006	6	27	1	Battle-No change of territory	Military Forces of Central African Republic (2003-2013)		1	Unidentified Armed Group (Chad)		3	13	Central African Republic	Vakaga	Birao	Ouandja	Gordil	9.73330	21.58330	1	Agence France Presse AFPR000020060627e26r0039z	"""Heavily armed"" Chadian rebels attacked forces of the CAR and the Economic and Monetary Community of Central Africa (CEMAC) and 71 Chadian rebels and five members of the CAR/CEMAC force died."	71482	323CEN	10126	29/06/2006	2006	6	29	1	Battle-No change of territory	APRD: Popular Army for the Restoration of the Republic and Democracy		2	Military Forces of Central African Republic (2003-2013)	CEMAC: Economic and Monetary Community of Central Africa	1	12	Central African Republic	Vakaga	Birao	Ouandja	Gordil	9.73330	21.58330	1	IRIN weekly reports		0482	324CEN	10127	09/08/2006	2006	8	9	1	Battle-Non-state actor overtakes territory	Military Forces of Central African Republic (2003-2013)		1	UFDR: Union of Democratic Forces for Unity		2	12	Central African Republic	Haute-Kotto	Ouadda	Ouadda	Ouadda	8.06660	22.40000	1	Reuters UK	20 government troops were killed in the attack and 12 more were taken prisoner. The rebels suffered three dead and two wounded.	20482	325CEN	10128	01/09/2006	2006	9	1	1	Violence against civilians	Civilians (Central African Republic)		7	Unidentified Armed Group (Central African Republic)		3	37	Central African Republic	Ouham Pende	Paoua	Paoua	Paoua	7.25000	16.43330	1	Agence France Presse AFPR000020060308e238006sw	"The prime minister of the CAR admitted publicly for the first time that 27 people were killed during clashes between the army and ""insurgents"" on Jan. 29, 2006. ""Some reliable information that we now have indicates for the first time that it was an unide"	27482	328CEN	10131	02/10/2006	2006	10	2	1	Violence against civilians	Civilians (Central African Republic)		7	Military Forces of Chad (1990-)		8	78	Central African Republic	Ouham Pende	Paoua	Mia-Péndé	Betoko	7.58330	16.58330	1	Human Rights Watch	"Chadian soldiers raided B?¬toko, located 20 km south of Gor?¬, firing randomly at the population and looting the village. During this raid, the Chadian troops raped five women at B?¬toko."	0482	326CEN	10129	02/10/2006	2006	10	2	1	Violence against civilians	Civilians (Central African Republic)		7	Police Forces of Central African Republic (2003-2013)		1	17	Central African Republic	Bangui	Bangui	Bangui	Bangui	4.36670	18.58330	1	Agence France Presse AFPR000020060410e24a0048m	"Police fired live bullets at high school students demonstrating in Bangui, injuring some. Police also fired tear gas to disperse the students, who took to the streets, in support of a month-long strike by temporary teaching staff. Several students had to"	0482	327CEN	10130	02/10/2006	2006	10	2	1	Violence against civilians	Civilians (Central African Republic)		7	Unidentified Armed Group (Central African Republic)		3	37	Central African Republic	Ombella M'Poko	Bossembele	Bossembele	Bossembélé	5.26670	17.65000	1	Agence France Presse AFPR000020060410e24a0049v	"Two doctors on a mission in the CAR for WHO have been shot dead by unknown armed men. The doctors' vehicle was hit by automatic weapons fire between Bossembele and Yaloke, 200 KM northwest of Bangui."	2482	329CEN	10132	09/10/2006	2006	10	9	1	Battle-Non-state actor overtakes territory	Military Forces of Central African Republic (2003-2013)		1	UFDR: Union of Democratic Forces for Unity		2	12	Central African Republic	Vakaga	Ouanda-Djalle	Vokouma	Ouanda Djalle	8.90000	22.80000	1	BBC Monitoring and Radio France Internationale BBC	"UFDR rebels have taken over Ouanda Djalle. The UFDR says it attacked the town very early today morning and killed some 20 soldiers. CAR govt. denies, but FACA confirms."	20482	330CEN	10133	10/10/2006	2006	10	10	1	Battle-No change of territory	Military Forces of Central African Republic (2003-2013)	Military Forces of France	1	UFDR: Union of Democratic Forces for Unity		2	12	Central African Republic	Vakaga	Ouanda-Djalle	Vokouma	Ouanda Djalle	8.90000	22.80000	1	Agence France Presse AFPR000020061210e2ca0050s	"FACA has recaptured the last town in UFDR rebel hands, Ouadda Djalle, with French military help."	0482	331CEN	10134	30/10/2006	2006	10	30	1	Battle-Non-state actor overtakes territory	Military Forces of Central African Republic (2003-2013)		1	UFDR: Union of Democratic Forces for Unity		2	12	Central African Republic	Vakaga	Birao	Ridina	Birao	10.28000	22.78000	1	Reuters UK	Bozize's govt. says the occupiers of Birao came from Darfur. Sudan has denied this.	0482	332CEN	10135	30/10/2006	2006	10	30	1	Battle-Non-state actor overtakes territory	UFR: Union of Republican Forces		3	Military Forces of Central African Republic (2003-2013)		1	13	Central African Republic	Vakaga	Birao	Ridina	Birao	10.28000	22.78000	1	Agence France Presse AFPR000020061030e2au00436	"Rebels took control of Birao the CAR near the Chad and Sudan borders after pushing back the army, military and rebel sources said. Rebels came from the direction of Am-Dafock (on the Sudanese border)."	0482	333CEN	10136	31/10/2006	2006	10	31	1	Violence against civilians	Civilians (Central African Republic)		7	Military Forces of Central African Republic (2003-2013)		1	17	Central African Republic	Ouham Pende	Paoua	Mia-Péndé	Bemal	7.58330	16.63330	1	Human Rights Watch	A GP unit of CAR killed at least 30 civilians in more than a dozen separate villages located along the Nana-Barya to B?¬mal road.	30482	334CEN	10137	31/10/2006	2006	10	31	1	Battle-Non-state actor overtakes territory	UFDR: Union of Democratic Forces for Unity		2	Military Forces of Central African Republic (2003-2013)		1	12	Central African Republic	Vakaga	Birao	Ridina	Birao	10.28000	22.78000	1	IRIN weekly reports		0482	335CEN	10138	10/11/2006	2006	11	10	1	Battle-Non-state actor overtakes territory	APRD: Popular Army for the Restoration of the Republic and Democracy		2	Military Forces of Central African Republic (2003-2013)		1	12	Central African Republic	Vakaga	Ouanda-Djalle	Vokouma	Ouanda Djalle	8.90000	22.80000	1	IRIN weekly reports		0482	336CEN	10139	13/11/2006	2006	11	13	1	Non-violent activity by a conflict actor	Military Forces of Central African Republic (2003-2013)		1	Military Forces of France		8	18	Central African Republic	Bangui	Bangui	Bangui	Bangui	4.36670	18.58330	1	Agence France Presse AFPR000020061113e2bd0048q	France is to aid the CAR's army with logistics and aerial reconnaissance in its fight against rebels in the north-east of the country.	0482	337CEN	10140	15/11/2006	2006	11	15	3	Battle-Non-state actor overtakes territory	APRD: Popular Army for the Restoration of the Republic and Democracy		2	Military Forces of Central African Republic (2003-2013)		1	12	Central African Republic	Vakaga	Ouanda-Djalle	Vokouma	Ouanda Djalle	8.90000	22.80000	1			0482	338CEN	10141	20/11/2006	2006	11	20	1	Battle-No change of territory	APRD: Popular Army for the Restoration of the Republic and Democracy		2	Military Forces of Central African Republic (2003-2013)		1	12	Central African Republic	Ouham Pende	Paoua	Paoua	Paoua	7.25000	16.43330	1	IRIN weekly reports		0482	339CEN	10142	20/11/2006	2006	11	20	1	Battle-No change of territory	Military Forces of Chad (1990-)		8	APRD: Popular Army for the Restoration of the Republic and Democracy		2	28	Central African Republic	Ouham Pende	Paoua	Paoua	Paoua	7.25000	16.43330	1	BBC Monitoring and Radio France Internationale BBC	"Clashes were reported Saturday [18 November] in the CAR between the Army for the Restoration of the Republic and Democracy, PARRD, and the Chadian national army which used its right to pursue [rebels beyond Chad's border]."	0482	340CEN	10143	21/11/2006	2006	11	21	1	Battle-No change of territory	Military Forces of Central African Republic (2003-2013)		1	Unidentified Armed Group (Central African Republic)		3	13	Central African Republic	Ouham Pende	Paoua	Nana-Barya	Bodoli	7.26660	16.65000	1	Reuters LBA0000020061121e2bl0024b	Village was looted and burned during conflicts between FACA and rebels/unidentified gunmen.	0482	341CEN	10144	21/11/2006	2006	11	21	1	Battle-No change of territory	Military Forces of Chad (1990-)		8	APRD: Popular Army for the Restoration of the Republic and Democracy		2	28	Central African Republic	Ouham Pende	Paoua	Paoua	Paoua	7.25000	16.43330	1	Agence France Presse AFPR000020061121e2bl00470	"A Chadian unit of 150 entered CAR ""to exercise its right to pursue the People's Army for the Restoration of the Republic and Democracy (APRD)."""	0482	342CEN	10145	22/11/2006	2006	11	22	1	Battle-No change of territory	Military Forces of Central African Republic (2003-2013)		1	Unidentified Armed Group (Central African Republic)		3	13	Central African Republic	Haute-Kotto	Bria	Samba-Boungou	Mouka	7.26660	21.86660	1	Agence France Presse AFPR000020061122e2bm004c8	"Three FACA soldiers were killed in clashes with rebels, located about 80 km northeast of Bria. Rebels disguised in govt. fatigues approached the troops. The rebels killed three men before the government troops realized their error."	3482	343CEN	10146	25/11/2006	2006	11	25	1	Non-violent activity by a conflict actor	Military Forces of Central African Republic (2003-2013)		1	UFDR: Union of Democratic Forces for Unity		2	12	Central African Republic	Bangui	Bangui	Bangui	Bangui	4.36670	18.58330	1	Agence France Presse AFPR000020061125e2bp006hp	"Police in Benin have arrested the leader of the rebel Union of Democratic Forces for Unity, Michel Am Non Droko Djotodia, and his spokesman Abakar Sabone, in Benin's capital, Cotonou, under an intl. arrest warrant."	0482	344CEN	10147	27/11/2006	2006	11	27	1	Battle-No change of territory	UFDR: Union of Democratic Forces for Unity		2	Military Forces of France		8	28	Central African Republic	Vakaga	Birao	Ridina	Birao	10.28000	22.78000	1	Agence France Presse Document AFPR000020061128e2bs	French troops exchanged fire with rebels near Birao airport.	0482	345CEN	10148	28/11/2006	2006	11	28	1	Battle-Government regains territory	Military Forces of France	Military Forces of Central African Republic (1993-2003)	8	UFDR: Union of Democratic Forces for Unity		2	28	Central African Republic	Vakaga	Birao	Ridina	Birao	10.28000	22.78000	1	Agence France Presse AFPR000020061128e2bs004vm	"FACA, with French military support, moved to seize Birao and Bria from UFDR. The army recaptured Birao and aimed to drive rebels out of Ouadda-Djalle and Sam Ouandja."	0482	346CEN	10149	29/11/2006	2006	11	29	1	Battle-No change of territory	Military Forces of France		8	UFDR: Union of Democratic Forces for Unity		2	28	Central African Republic	Vakaga	Birao	Ridina	Birao	10.28000	22.78000	1	Agence France Presse AFPR000020061129e2bt005ey	"French warplanes have been involved in fighting in the CAR, firing on rebels near Birao. The French military had initially said that its forces in the CAR had shot at rebels near Birao in ""self-defense"", but had not made mention that its aircraft were us"	0482	347CEN	10150	30/11/2006	2006	11	30	1	Remote violence	Military Forces of Central African Republic (2003-2013)	Military Forces of France	1	UFDR: Union of Democratic Forces for Unity		2	12	Central African Republic	Vakaga	Birao	Ridina	Birao	10.28000	22.78000	1	Agence France Presse AFPR000020061130e2bu004hc	"UFDR tried to recapture Birao but were driven back by FACA and French fighter jets providing air support. UFDR claimed that casualties on both sides were high, but without giving figures."	0482	348CEN	10151	01/12/2006	2006	12	1	1	Battle-No change of territory	UFDR: Union of Democratic Forces for Unity		2	Military Forces of France		8	28	Central African Republic	Vakaga	Birao	Ridina	Birao	10.28000	22.78000	1	IRIN weekly reports		0482	349CEN	10152	09/12/2006	2006	12	9	1	Non-violent transfer of territory	UFDR: Union of Democratic Forces for Unity		2			0	20	Central African Republic	Haute-Kotto	Bria	Samba-Boungou	Bria	6.53330	21.98330	1	Agence France Presse AFPR000020061112e2bc00816	"UFDR advanced towards the west threatening Bria. UFDR claimed they had already taken control of Sam Ouandja, a small town between Ouadda Djalle and Bria. A military source confirmed the rebel troop movements towards Bria."	0482	350CEN	10153	11/12/2006	2006	12	11	1	Battle-Government regains territory	Military Forces of Central African Republic (2003-2013)		1	UFDR: Union of Democratic Forces for Unity		2	12	Central African Republic	Vakaga	Ouanda-Djalle	Vokouma	Ouanda Djalle	8.90000	22.80000	1	IRIN weekly reports		0482	351CEN	10154	15/12/2006	2006	12	15	3	Battle-Government regains territory	Military Forces of Central African Republic (2003-2013)		1	UFDR: Union of Democratic Forces for U