GWNO	EVENT_ID_CNTY	EVENT_ID_NO_CNTY	EVENT_DATE	YEAR	MONTH	DAY	TIME_PRECISION	Event Type	Actor	ALLY_ACTOR_1	INTER1	ACTOR2	ALLY_ACTOR_2	INTER2	INTERACTION	COUNTRY	ADMIN1	ADMIN2	ADMIN3	LOCATION	LATITUDE	LONGITUDE	GEO_PRECIS	SOURCE	Notes	Fatalities626	1SSD	78664	23/07/2011	2011	7	23	1	Battle-No change of territory	Unidentified Armed Group (Sudan)		3	Military Forces of South Sudan (2011-)		1	13	South Sudan	Jonglei	Duk		Koich	7.63333	31.43333	1	Sudan Tribune	"A rebel leader in South Sudans Unity State was shot dead in Koich, only three days after he signed a peace deal with South Sudan army, the Sudan Peoples Liberation Army (SPLA). It was later learned there was conspiring among his lieutenants."	1626	2SSD	78665	03/08/2011	2011	8	3	1	Non-violent activity by a conflict actor	Peter Gadet Rebel Group		2			0	20	South Sudan	Central Equatoria	Juba		Juba	4.85165	31.58247	1	Platts Commodity News	A South Sudan rebel group led by renegade general Peter Gadet has agreed to an unconditional ceasefire and is committed to talks on merging its troops with the army.	0626	3SSD	78666	04/08/2011	2011	8	4	2	Non-violent activity by a conflict actor	SSLM/A: South Sudan Liberation Movement/Army		2			0	20	South Sudan	Central Equatoria	Juba		Juba	4.85165	31.58247	1	Agence France Presse	"The SSLM rejected a peace deal with the Sudanese government believing their former leader, Peter Gadet, had been corrupted by members of the Sudanese government. "	0626	5SSD	78668	18/08/2011	2011	8	18	1	Violence against civilians	Murle Ethnic Militia (South Sudan)		4	Civilians (Sudan)		7	47	South Sudan	Jonglei	Uror		Pieri District	8.03333	32.03333	2	The Canadian Press	"Cattle raiders of the Murle ethnic group crossed the border from Sudan, raided and looted five unincorporated locations in Jonglei state including the villages of Matot, Pulchuol, Guancot, Rumaker, Dorganwel, and Tongyang. 600 deaths spread over these days unless specifically reported in an event"	67626	4SSD	78667	18/08/2011	2011	8	18	1	Battle-No change of territory	Murle Ethnic Militia (South Sudan)		4	Military Forces of South Sudan (2011-)		1	14	South Sudan	Jonglei	Uror		Pieri District	8.03333	32.03333	2	The Canadian Press	"Cattle raiders of the Murle ethnic group crossed the border from Sudan, raided and looted five unincorporated locations in Jonglei state including the villages of Matot, Pulchuol, Guancot, Rumaker, Dorganwel, and Tongyang. This is believed to be revenge against the Lou Nuer tribe for earlier raids against them."	67626	9SSD	78672	19/08/2011	2011	8	19	1	Violence against civilians	Military Forces of Sudan (1989-)		8	Civilians (Sudan)		7	78	South Sudan	Northern Bahr el Ghazal	Aweil West		Alan	9.06089	27.10903	1	The Katmandu Post	"15 South Sudanese fighters are killed, 31 injured in clashes with border-crossing Sudanese forces, who attacked several towns, including an unnamed area on day two, and returned across the border the following day. 57 members of the raiding force were killed in the incident. Many believe this was an effort by the north to intimidate civilians expose the Souths new government as a failure."	67626	11SSD	78674	19/08/2011	2011	8	19	1	Violence against civilians	Military Forces of Sudan (1989-)		8	Civilians (Sudan)		7	78	South Sudan	Upper Nile	Manyo		Kaka	10.57880	32.15156	1	The Katmandu Post	"15 South Sudanese fighters are killed, 31 injured in clashes with border-crossing Sudanese forces, who attacked several towns, including an unnamed area on day two, and returned across the border the following day. 57 members of the raiding force were killed in the incident. Many believe this was an effort by the north to intimidate civilians expose the Souths new government as a failure."	66626	8SSD	78671	19/08/2011	2011	8	19	1	Battle-No change of territory	Military Forces of Sudan (1989-)		8	Military Forces of South Sudan (2011-)		1	18	South Sudan	Northern Bahr el Ghazal	Aweil West		Alan	9.06089	27.10903	1	The Katmandu Post	"15 South Sudanese fighters are killed, 31 injured in clashes with border-crossing Sudanese forces, who attacked several towns, including an unnamed area on day two, and returned across the border the following day. 57 members of the raiding force were killed in the incident. Many believe this was an effort by the north to intimidate civilians expose the Souths new government as a failure."	24626	10SSD	78673	19/08/2011	2011	8	19	1	Battle-No change of territory	Military Forces of Sudan (1989-)		8	Military Forces of South Sudan (2011-)		1	18	South Sudan	Upper Nile	Manyo		Kaka	10.57880	32.15156	1	The Katmandu Post	"15 South Sudanese fighters are killed, 31 injured in clashes with border-crossing Sudanese forces, who attacked several towns, including an unnamed area on day two, and returned across the border the following day. 57 members of the raiding force were killed in the incident. Many believe this was an effort by the north to intimidate civilians expose the Souths new government as a failure."	24626	7SSD	78670	19/08/2011	2011	8	19	1	Violence against civilians	Murle Ethnic Militia (South Sudan)		4	Civilians (Sudan)		7	47	South Sudan	Jonglei	Uror		Pieri District	8.03333	32.03333	2	The Canadian Press	Cattle raiders from Sudan continue clashes and raids on villages of Pieri District.	66626	6SSD	78669	19/08/2011	2011	8	19	1	Battle-No change of territory	Murle Ethnic Militia (South Sudan)		4	Military Forces of South Sudan (2011-)		1	14	South Sudan	Jonglei	Uror		Pieri District	8.03333	32.03333	2	The Canadian Press	Cattle raiders from Sudan continue clashes and raids on villages of Pieri District.	66626	16SSD	78679	20/08/2011	2011	8	20	1	Violence against civilians	Military Forces of Sudan (1989-)		8	Civilians (Sudan)		7	78	South Sudan	Upper Nile	Baliet		Upper Nile	9.76667	32.73333	3	The Katmandu Post	"15 South Sudanese fighters are killed, 31 injured in clashes with border-crossing Sudanese forces, who attacked several towns, including an unnamed area on day two, and returned across the border the following day. 57 members of the raiding force were killed in the incident. Many believe this was an effort by the north to intimidate civilians expose the Souths new government as a failure."	66626	15SSD	78678	20/08/2011	2011	8	20	1	Battle-No change of territory	Military Forces of Sudan (1989-)		8	George Athor Deng Rebel Group		2	28	South Sudan	Upper Nile	Baliet		Upper Nile	9.76667	32.73333	3	Agence France Presse	"A clash between Sudanese forces and the rebel group lead by Athor clash, killing 60 and injuring 43. "	60626	14SSD	78677	20/08/2011	2011	8	20	1	Battle-No change of territory	Military Forces of Sudan (1989-)		8	Military Forces of South Sudan (2011-)		1	18	South Sudan	Upper Nile	Baliet		Upper Nile	9.76667	32.73333	3	The Katmandu Post	"15 South Sudanese fighters are killed, 31 injured in clashes with border-crossing Sudanese forces, who attacked several towns, including an unnamed area on day two, and returned across the border the following day. 57 members of the raiding force were killed in the incident. Many believe this was an effort by the north to intimidate civilians expose the Souths new government as a failure."	24626	13SSD	78676	20/08/2011	2011	8	20	1	Violence against civilians	Murle Ethnic Militia (South Sudan)		4	Civilians (Sudan)		7	47	South Sudan	Jonglei	Uror		Pieri District	8.03333	32.03333	2	Agence France Presse	"After three days of cattle raids and clashes with authorities at total of 600 are reported dead, another 985 reported injured. Over 25,000 heads of cattle stolen, which are a fixture of the local economy. "	66626	12SSD	78675	20/08/2011	2011	8	20	1	Battle-No change of territory	Murle Ethnic Militia (South Sudan)		4	Military Forces of South Sudan (2011-)		1	14	South Sudan	Jonglei	Uror		Pieri District	8.03333	32.03333	2	Agence France Presse	"After three days of cattle raids and clashes with authorities at total of 600 are reported dead, another 985 reported injured. Over 25,000 heads of cattle stolen, which are a fixture of the local economy. "	66626	17SSD	78680	21/08/2011	2011	8	21	2	Remote violence	Military Forces of South Sudan (2011-)		1	Civilians (Sudan)		7	17	South Sudan	Jonglei	Ayod		Ruboani	8.08667	30.73139	1	All Africa	"A Toyota landcrusier hits a SPLA placed landmine, killing three and injuring 15."	3626	18SSD	78681	21/08/2011	2011	8	21	1	Remote violence	Military Forces of South Sudan (2011-)		1	Civilians (Sudan)		7	17	South Sudan	Unity	Koch		Unity State	8.65000	29.85000	2	All Africa	"A public bus carrying 12 passengers rolls over a SPLA landmine as it traveled between Bentiu town and Nhialdiu. Two killed, six injured. "	2626	19SSD	78682	23/08/2011	2011	8	23	2	Battle-Government regains territory	Military Forces of South Sudan (2011-)		1	Military Forces of Sudan (1989-)		8	18	South Sudan	Upper Nile	Manyo		Kaka	10.57880	32.15156	1	Sudan Tribune	The South Sudanese military touts it has made gains by expelling all northern forces from Kaka.	0626	20SSD	78683	09/09/2011	2011	9	9	2	Violence against civilians	LRA: Lord's Resistance Army		2	Civilians (Sudan)		7	27	South Sudan	Western Bahr el Ghazal	Raga		Raga	8.45955	25.67800	1	All Africa	"LRA rebels crossed the border from CAR, looted property, and returned to CAR."	0626	22SSD	78685	26/09/2011	2011	9	26	1	Violence against civilians	George Athor Deng Rebel Group		2	Civilians (Sudan)		7	27	South Sudan	Jonglei	Canal/Pigi		Wunalong	9.25904	31.67007	1	All Africa	Two rebels are killed when they clash with local police forces. Many of the villages civilians were displaced during the fighting. 	0626	21SSD	78684	26/09/2011	2011	9	26	1	Battle-No change of territory	Police Forces of South Sudan (2011-)		1	George Athor Deng Rebel Group		2	12	South Sudan	Jonglei	Canal/Pigi		Wunalong	9.25904	31.67007	1	All Africa	Two rebels are killed when they clash with local police forces. Many of the villages civilians were displaced during the fighting. 	2626	23SSD	78686	09/10/2011	2011	10	9	1	Remote violence	Unidentified Armed Group (Sudan)		3	Civilians (Sudan)	Military Forces of South Sudan (2011-)	7	37	South Sudan	Unity	Mayom		Mayom	9.22000	29.17000	1	Agence France Presse	"A landmine explodes, hitting a bus in a remote area killing 20, including two soldiers, and injuring five more. "	20626	24SSD	78687	23/10/2011	2011	10	23	1	Riots/Protests	Protesters (South Sudan)	SPLM-DC: Sudanese People's Liberation Movement (Democratic Change)	6			0	60	South Sudan	Central Equatoria	Juba		Juba	4.85165	31.58247	1	All Africa	" A major South Sudanese opposition party, the Sudan Peoples Liberation Movement for Democratic Change (SPLM-DC) protested against the ""targeted"" arrest of its members in Juba."	0626	25SSD	78688	29/10/2011	2011	10	29	1	Battle-No change of territory	Military Forces of South Sudan (2011-)		1	SLM/A: Sudan Liberation Movement/Army		2	12	South Sudan	Unity	Mayom		Mayom	9.22000	29.17000	1	Agence France Presse	"60 rebels are killed when government forces repel an attack. 15 civilians were also killed when they were shot by rebels as they ran for shelter. 18 others were wounded. Conflicting reports have the numbers of dead at 39, others 80. "	60626	26SSD	78689	29/10/2011	2011	10	29	1	Violence against civilians	SSLM/A: South Sudan Liberation Movement/Army		2	Civilians (Sudan)		7	27	South Sudan	Unity	Mayom		Mayom	9.22000	29.17000	1	Agence France Presse	"60 rebels are killed when government forces repel an attack. 15 civilians were also killed when they were shot by rebels as they ran for shelter. 18 others were wounded. Conflicting reports have the numbers of dead at 39, others 80. "	15626	27SSD	78690	02/11/2011	2011	11	2	1	Non-violent activity by a conflict actor	Police Forces of South Sudan (2011-)		1	Civilians (Sudan)		7	17	South Sudan	Central Equatoria	Juba		Juba	4.85165	31.58247	1	Sudan Tribune	A Sudanese journalist is arrested in Juba. 	0626	28SSD	78691	03/11/2011	2011	11	3	1	Non-violent activity by a conflict actor	Police Forces of South Sudan (2011-)		1	UDF: United Democratic Front		3	13	South Sudan	Western Equatoria	Mundri East		Chief Jambo	5.06260	30.73187	1	Agence France Presse	South Sudan has arrested a prominent opposition leader it claims was launching a guerrilla movement to topple the government.	0626	29SSD	78692	08/11/2011	2011	11	8	1	Remote violence	Military Forces of Sudan (1989-)		8	Civilians (Sudan)		7	78	South Sudan	Upper Nile	Baliet		Upper Nile	9.76667	32.73333	3	Agence France Presse	An aerial bombing kills seven civilians near a border area. 	7626	30SSD	78693	09/11/2011	2011	11	9	1	Remote violence	Military Forces of Sudan (1989-)		8	Civilians (Sudan)	Civilians (International)	7	78	South Sudan	Unity	Pariang		Yida	10.10417	30.09028	1	Agence France Presse/Africa Research Bulletin	"Sudanese bombers hit Yida refugee camp in Upper Nile State. A government official initially reported deaths, but an American activist who spoke to aid workers at the camp later said there were no casualties. The air strike came at around 3 pm, just hours after a speech by South Sudan President Salva Kiir in which he condemned an earlier air strike in Upper Nile that killed seven civilians two days earlier. "	0626	31SSD	78694	11/11/2011	2011	11	11	1	Battle-No change of territory	Military Forces of Sudan (1989-)		8	Military Forces of South Sudan (2011-)		1	18	South Sudan	Upper Nile	Manyo		Kaka	10.57880	32.15156	1	Agence France Presse	"Sudanese forces cross the border into Upper Nile State and attacked a base controlled by the SPLA, 18 dead 73 wounded. The SPLA believes Sudanese forces are trying to capture the surrounding oil fields. Sudanese forces were eventually driven back across the border. "	18626	32SSD	78695	15/11/2011	2011	11	15	1	Non-violent activity by a conflict actor	Military Forces of South Sudan (2011-)		1			0	10	South Sudan	Unity	Koch		Unity State	8.65000	29.85000	2	All Africa	South Sudans army released 53 children from its barracks in Unity State after they forcibly recruited earlier this year to help fight their rebellion. 	0626	33SSD	78696	21/11/2011	2011	11	21	2	Violence against civilians	LRA: Lord's Resistance Army		2	Civilians (Sudan)		7	27	South Sudan	Western Equatoria	Ibba		Western Equatoria	5.00000	29.00000	2	BBC Monitoring Africa	Attacks at the hands of the LRA reported near the location of Ezo. 	0626	34SSD	78697	05/12/2011	2011	12	5	1	Violence against civilians	Unidentified Armed Group (Sudan)		3	Civilians (Sudan)		7	37	South Sudan	Jonglei	Bor South		Bor	6.20720	31.55920	1	Agence France Presse	Unknown assailants kill at least 37 people and wound 22 others when a small village is raided. 	37626	35SSD	78698	11/12/2011	2011	12	11	1	Violence against civilians	George Athor Deng Rebel Group		2	Civilians (Sudan)		7	27	South Sudan	Jonglei	Bor South		Bor	6.20720	31.55920	1	Agence France Presse	A George Athor rebel raid claims the lives of town in a village near Bor. 	2626	37SSD	78700	11/12/2011	2011	12	11	1	Violence against civilians	George Athor Deng Rebel Group		2	Civilians (Sudan)		7	27	South Sudan	Jonglei	Uror		Jonglei State	7.40000	32.40000	2	Agence France Presse	"Suspected rebels under the command of renegade general George Athor attacked Atar town area (unincorporated), in Pigi County, killing nine people. There were three SPLA killed and six civilians, including one woman."	6626	36SSD	78699	11/12/2011	2011	12	11	1	Battle-No change of territory	George Athor Deng Rebel Group		2	Military Forces of South Sudan (2011-)		1	12	South Sudan	Jonglei	Uror		Jonglei State	7.40000	32.40000	2	Agence France Presse	"Suspected rebels under the command of renegade general George Athor attacked Atar town area (unincorporated), in Pigi County, killing nine people. There were three SPLA killed and six civilians, including one woman."	3626	38SSD	78701	20/12/2011	2011	12	20	1	Battle-No change of territory	Military Forces of South Sudan (2011-)		1	George Athor Deng Rebel Group		2	12	South Sudan	Central Equatoria	Morobo		Morobo	3.69194	30.77639	1	Agence France Presse	South Sudanese rebel chief George Athor has been killed in a clash with soldiers of South Sudan. One other fighter killed. Many homes were destroyed due to clashes. 	2626	40SSD	78703	24/12/2011	2011	12	24	1	Violence against civilians	Military Forces of South Sudan (2011-)		1	Civilians (Sudan)		7	17	South Sudan	Jonglei	Uror		Jonglei State	7.40000	32.40000	2	Sudan Tribune	"Members of the SPLA shot and killed four Christmas Eve worshipers, three civilians, one soldier in a church in Khorfulus District, Pigi County. Following the shootings the raiders looted the church. Days after the incident SPLA leadership characterized the shooting as an accident. "	3626	39SSD	78702	24/12/2011	2011	12	24	1	Battle-No change of territory	Military Forces of South Sudan (2011-)		1	Military Forces of South Sudan (2011-)		1	11	South Sudan	Jonglei	Uror		Jonglei State	7.40000	32.40000	2	Sudan Tribune	"Members of the SPLA shot and killed four Christmas Eve worshipers, three civilians, one soldier in a church in Khorfulus District, Pigi County. Following the shootings the raiders looted the church. Days after the incident SPLA leadership characterized the shooting as an accident. "	1626	41SSD	78704	26/12/2011	2011	12	26	2	Battle-No change of territory	Lou Nuer Ethnic Militia (South Sudan)		4	Murle Ethnic Militia (South Sudan)		4	44	South Sudan	Jonglei	Pibor		Pibor Post	6.79853	33.13044	1	Sudan Tribune	"Members of the Lou Nuer militia raid villages around Pibor, continuing a long running dispute over cattle and land with Murle. No report of causalities, though there has been many since their fighting began in June 2011. "	0626	43SSD	78706	29/12/2011	2011	12	29	1	Violence against civilians	Military Forces of Sudan (1989-)		8	Civilians (Sudan)		7	78	South Sudan	Western Bahr el Ghazal	Raga		Raga	8.45955	25.67800	1	Agence France Presse	"Sudanese air raids killed 40 people in the South Sudan border state of Western Bahr al-Ghazal, the South Sudanese military said, but Khartoum dismissed the allegation. The majority of the deceased were cattle hearing civilians, and 17 were SPLA soldiers. "	23626	42SSD	78705	29/12/2011	2011	12	29	1	Battle-No change of territory	Military Forces of Sudan (1989-)		8	Military Forces of South Sudan (2011-)		1	18	South Sudan	Western Bahr el Ghazal	Raga		Raga	8.45955	25.67800	1	BBC Monitoring Africa	"Sudanese air raids killed 40 people in the South Sudan border state of Western Bahr al-Ghazal, the South Sudanese military said, but Khartoum dismissed the allegation. The majority of the deceased were cattle hearing civilians, and 17 were SPLA soldiers. "	17626	44SSD	78707	31/12/2011	2011	12	31	1	Violence against civilians	Lou Nuer Ethnic Militia (South Sudan)		4	Civilians (Sudan)	Murle Ethnic Group (South Sudan)	7	47	South Sudan	Jonglei	Pibor		Pibor Post	6.79853	33.13044	1	BBC Monitoring Africa	"5,000 members of a Lou Nuer militia attacked a town and caused at least 150 causalities and 20,000 residents were displaced. Houses were reported to have been set on fire and much of the town, including the airport and main hospital, were occupied. The group apparently were on a revenge vendetta against members of the Murle community over cattle."	150626	45SSD	78708	01/01/2012	2012	1	1	1	Violence against civilians	Lou Nuer Ethnic Militia (South Sudan)		4	Civilians (South Sudan)	Murle Ethnic Group (South Sudan)	7	47	South Sudan	Jonglei	Pibor		Pibor Post	6.79853	33.13044	1	Al Jazeera English	"Following four days of clashes over cattle, members of the Lou Nuer occupy a Murle village, take cattle and destroy property. Much of the former population had fled prior to this. "	0626	46SSD	78709	02/01/2012	2012	1	2	1	Battle-No change of territory	Lou Nuer Ethnic Militia (South Sudan)		4	Murle Ethnic Militia (South Sudan)		4	44	South Sudan	Jonglei	Pibor		Pibor Post	6.79853	33.13044	1	Al Jazeera English	Warring youths of the Lou Nuer tribe continue to inhabit a Murle village and continue to destroy their property. Five Murle corpses were seen by a witness to the event. 	5626	47SSD	78710	08/01/2012	2012	1	8	1	Battle-No change of territory	Lou Nuer Ethnic Militia (South Sudan)		4	Murle Ethnic Militia (South Sudan)		4	44	South Sudan	Jonglei	Akobo		Akobo	7.78330	33.01670	1	Agence France Presse	Renewed tribal cashes. Two Lou Nuer women are killed and cattle is reported taken. 11 reported missing. 	2626	48SSD	78711	08/01/2012	2012	1	8	1	Battle-No change of territory	Lou Nuer Ethnic Militia (South Sudan)		4	Murle Ethnic Militia (South Sudan)		4	44	South Sudan	Jonglei	Bor South		Deng	6.15996	31.71837	1	Agence France Presse	Renewed tribal clashes kill 22 and send 20 others to local hospitals with injuries. 	22626	49SSD	78712	09/01/2012	2012	1	9	1	Battle-No change of territory	Lou Nuer Ethnic Militia (South Sudan)		4	Murle Ethnic Militia (South Sudan)		4	44	South Sudan	Jonglei	Bor South		Deng	6.15996	31.71837	1	Associated Press Newswires	Sunday's tribal fighting carries over into Monday. 	0626	50SSD	78713	11/01/2012	2012	1	11	1	Battle-No change of territory	Lou Nuer Ethnic Militia (South Sudan)		4	Murle Ethnic Militia (South Sudan)		4	44	South Sudan	Jonglei	Uror		Jonglei	8.00000	32.00000	2	Agence France Presse	"New ethnic clashes in South Sudan's troubled Jonglei state have killed 57 people, wounded 53. The attack was in an area known as Wek. "	57626	51SSD	78714	16/01/2012	2012	1	16	1	Battle-No change of territory	Lou Nuer Ethnic Militia (South Sudan)		4	Murle Ethnic Militia (South Sudan)		4	44	South Sudan	Jonglei	Duk		Duk Fadiet	7.74987	31.39584	1	Agence France Presse	Renewed ethnic fighting kills 51. The Murles incited the attack. 	51626	52SSD	78715	23/01/2012	2012	1	23	1	Violence against civilians	Military Forces of Sudan (1989-)		8	Civilians (Sudan)		7	78	South Sudan	Upper Nile	Baliet		Upper Nile	9.76667	32.73333	3	Agence France Presse	"Sudanese military aircraft targeted a Sudanese refugee camp on two separate occasions in northern Upper Nile State, near the border. "	0626	53SSD	78716	30/01/2012	2012	1	30	1	Violence against civilians	Unidentified Armed Group (South Sudan)		3	Civilians (South Sudan)		7	37	South Sudan	Warrap	Tonj North		Warrap	8.00000	28.85000	2	Agence France Presse	An unidentified militia group crossed into Warrap State from Unity State and killed 40 civilians. Juba blames Khartoum for financing the group. 	40626	54SSD	78717	01/02/2012	2012	2	1	1	Battle-No change of territory	Lou Nuer Ethnic Militia (South Sudan)		4	Murle Ethnic Militia (South Sudan)		4	44	South Sudan	Unity	Koch		Unity State	8.65000	29.85000	2	Agence France Presse	A shootout in the remote town of Mayendit peace meeting kills 37. The UN was mediating the meeting. 	37626	55SSD	78718	12/02/2012	2012	2	12	1	Remote violence	Military Forces of Sudan (1989-)		8	Military Forces of South Sudan (2011-)		1	18	South Sudan	Unity	Koch		Unity State	8.65000	29.85000	2	Reuters News	The SPLA claims military forces of Sudan launched an aerial attack on them in two locations. Four soldiers killed. The Sudanese deny the attack occurred. 	0626	56SSD	78719	12/02/2012	2012	2	12	1	Remote violence	Military Forces of Sudan (1989-)		8	Military Forces of South Sudan (2011-)		1	18	South Sudan	Western Bahr el Ghazal	Raga		Raga	8.45955	25.67800	1	BBC Monitoring Newsfile	The SPLA claims military forces of Sudan launched an aerial attack on them in two locations. No report of casualties. The Sudanese government denies the attack occurred. 	0626	57SSD	78720	26/02/2012	2012	2	26	1	Battle-No change of territory	Military Forces of Sudan (1989-)		8	SPLM-N: Sudan People's Liberation Movement (North)		2	28	South Sudan	Unity	Koch		Unity State	8.65000	29.85000	2	Platts Commodity News	Sudanese rebels of the north claim to have killed at least 200 Sudanese government soldiers in a border area around Jau. Other reports claim the death figure was around 130. No report on South Sudanese causalities. 	200626	58SSD	78721	01/03/2012	2012	3	1	1	Remote violence	Military Forces of Sudan (1989-)		8	Civilians (South Sudan)		7	78	South Sudan	Unity	Koch		Unity State	8.65000	29.85000	2	The Wall Street Journal Europe	"The South Sudanese government accuse the northern government of staging military attacks 50 miles into Unity State in an oil rich area and amassing their forces in contested areas. The bombing caused leaks to two oil wells in Pariang County, near El Nar. "	0626	59SSD	78722	05/03/2012	2012	3	5	1	Battle-No change of territory	Military Forces of South Sudan (2011-)		1	Military Forces of Uganda (1986-)		8	18	South Sudan	Eastern Equatoria	Magwi		Nimule	3.60000	32.05000	1	BBC Monitoring Africa	A 24 hour standoff across the southern border with Uganda over the alleged mistreatment of Ugandans in South Sudan. 	0626	61SSD	78724	12/03/2012	2012	3	12	3	Violence against civilians	Military Forces of South Sudan (2011-)		1	Civilians (South Sudan)		7	17	South Sudan	Jonglei	Uror		Jonglei	8.00000	32.00000	3	Inter Press Service (Johannesburg)	Report launched by civil society groups in Jonglei detailing violence against civilians between 12 March and 30 April as part of a campaign of disarmament in the territory.	0626	60SSD	78723	12/03/2012	2012	3	12	3	Battle-No change of territory	Military Forces of South Sudan (2011-)		1	Lou Nuer Ethnic Militia (South Sudan)		4	14	South Sudan	Jonglei	Uror		Jonglei	8.00000	32.00000	3	Inter Press Service (Johannesburg)	"Report launched by civil society groups in Jonglei detailing a battle between 12 March and 30 April, involving South Sudanese military and Luo-Nuer ethnic militia, as part of a campaign of disarmament in the territory."	0626	62SSD	78725	15/03/2012	2012	3	15	2	Remote violence	Military Forces of South Sudan (2011-)		1	Military Forces of Sudan (1989-)		8	18	South Sudan	Unity	Koch		Unity State	8.65000	29.85000	1	BBC Monitoring Middle East	South Sudanese forces down a Northern drone that was bombing positions in Unity State. Precise date unknown. The North denies these claims. 	0626	63SSD	78726	19/03/2012	2012	3	19	1	Violence against civilians	Military Forces of South Sudan (2011-)		1	Civilians (South Sudan)		7	17	South Sudan	Jonglei	Bor South		Pariak	5.97684	31.66651	1	Sudan Tribune	A resident of a town claims South Sudanese soldiers kidnapped his relative and raped her.	0626	64SSD	78727	19/03/2012	2012	3	19	1	Battle-No change of territory	Military Forces of South Sudan (2011-)		1	George Athor Deng Rebel Group		2	12	South Sudan	Jonglei	Uror		Pieri	8.03333	32.03333	1	All Africa	White army and South Sudanese SPLA forces clash. The White Army lost seven and there was 24 wounded.	7626	65SSD	78728	26/03/2012	2012	3	26	1	Remote violence	Military Forces of South Sudan (2011-)		1	Military Forces of Sudan (1989-)		8	18	South Sudan	Unity	Koch		Unity State	8.65000	29.85000	2	CNN Wire	"South Sudan claims northern forces launched several aerial and ground attacks on border regions in Unity State, jeopardizing upcoming peace talks in Juba. Unknown casualties. "	0626	67SSD	78730	27/03/2012	2012	3	27	1	Battle-No change of territory	Military Forces of South Sudan (2011-)		1	Military Forces of Sudan (1989-)		8	18	South Sudan	Unity	Koch		Unity State	8.65000	29.85000	2	Agence France Presse	Northern force renew attacks on strategic locations (mainly oil fields) in Unity State. 	0626	68SSD	78731	27/03/2012	2012	3	27	1	Battle-Non-state actor overtakes territory	Military Forces of Sudan (1989-)		8	SSLA/M: South Sudan Liberation Army/Movement		2	28	South Sudan	Unity	Koch		Unity State	8.65000	29.85000	2	All Africa	The SSLA/M captures an army base from Southern forces in Unity State. The two typically function as allies. 	0626	66SSD	78729	27/03/2012	2012	3	27	1	Riots/Protests	Rioters (South Sudan)		5			0	50	South Sudan	Central Equatoria	Juba		Juba	4.85170	31.58250	1	All Africa	University students go on a violent riot when the group believes campus security personnel carried out indiscriminate beating of some students. One injured. 	0626	69SSD	78732	28/03/2012	2012	3	28	1	Remote violence	Military Forces of Sudan (1989-)		8	Civilians (South Sudan)		7	78	South Sudan	Unity	Rubkona		Bentiu	9.23333	29.83333	1	Agence France Presse	Northern forces bomb a town overnight. 	0626	70SSD	78733	01/04/2012	2012	4	1	1	Battle-No change of territory	Military Forces of Sudan (1989-)		8	Military Forces of South Sudan (2011-)		1	18	South Sudan	Unity	Koch		Unity State	8.65000	29.85000	2	Agence France Presse	The Southern government accuses the of launching renewed aerial attacks as well as land battles in the Panakuach area. 	0626	71SSD	78734	01/04/2012	2012	4	1	1	Remote violence	Military Forces of Sudan (1989-)		8	Military Forces of South Sudan (2011-)		1	18	South Sudan	Western Bahr el Ghazal	Wau		Manga	7.66791	27.84467	1	Agence France Presse	Northern forces launch an aerial attack on Southern forces. 	0626	72SSD	78735	03/04/2012	2012	4	3	1	Battle-No change of territory	Military Forces of Sudan (1989-)		8	Military Forces of South Sudan (2011-)		1	18	South Sudan	Unity	Koch		Unity State	8.65000	29.85000	2	Agence France Presse	Southern forces shoot down a northern MiG-29.	0626	73SSD	78736	10/04/2012	2012	4	10	1	Remote violence	Military Forces of Sudan (1989-)		8	Military Forces of South Sudan (2011-)		1	18	South Sudan	Unity	Koch		Unity State	8.65000	29.85000	2	Al Arabiya	Northern forces launch an aerial attack on a border region. 	0626	74SSD	78737	10/04/2012	2012	4	10	1	Remote violence	Military Forces of Sudan (1989-)		8	Military Forces of South Sudan (2011-)		1	18	South Sudan	Unity	Koch		Unity State	8.65000	29.85000	2	Al Arabiya	Sudan carries out a series of air strikes	0626	75SSD	78738	12/04/2012	2012	4	12	1	Remote violence	Military Forces of Sudan (1989-)		8	Military Forces of South Sudan (2011-)		1	18	South Sudan	Unity	Mayom		Bentiu	9.23333	29.83333	1	Al Arabiya	Sudanese warplanes drop bombs on a major border town. No causalities reported. 	0626	76SSD	78739	12/04/2012	2012	4	12	1	Remote violence	Military Forces of Sudan (1989-)		8	Military Forces of South Sudan (2011-)		1	18	South Sudan	Unity	Rubkona		Bentiu	9.23333	28.83333	1	Agence France Presse	"Sudanese warplanes launch an attack on a Southern town, apparently aiming for a bridge. This was the first attack on a major Southern town. The attack wounded three civilians and killed one person. "	1626	77SSD	78740	14/04/2012	2012	4	14	1	Remote violence	Military Forces of Sudan (1989-)		8	Military Forces of South Sudan (2011-)		1	18	South Sudan	Unity	Mayom		Bentiu	9.23333	28.83333	1	Agence France Presse	"Sudanese warplanes launch another bombardment on a Unity State town, five killed six wounded. "	5626	79SSD	78742	15/04/2012	2012	4	15	1	Battle-No change of territory	Military Forces of Sudan (1989-)		8	Military Forces of South Sudan (2011-)		1	18	South Sudan	Upper Nile	Melut		Kuek	10.00000	32.70000	2	Sudan Tribune	SPLA fighters repulse an attack by northern forces in a location known as Kuek.	0626	78SSD	78741	15/04/2012	2012	4	15	1	Remote violence	Military Forces of Sudan (1989-)		8	UN: United Nations		8	88	South Sudan	Lakes	Wulu		Meyom	6.34886	29.48918	1	Agence France Presse	Sudanese warplanes bombed a UN peacekeepers' camp in the border regions of South Sudan but no one was injured. The event occurred in the evening. 	0626	80SSD	78743	19/04/2012	2012	4	19	2	Non-violent activity by a conflict actor	SSDA: South Sudan Democratic Army	Government of Eritrea (1993-)	2			0	20	South Sudan	Central Equatoria	Juba		Juba	4.85170	31.58250	1	Forecast International Defense Intelligence Newsletters	Report of South Sudanese rebels receiving aid and armaments from Eritrea. 	0626	81SSD	78744	23/04/2012	2012	4	23	1	Remote violence	Military Forces of Sudan (1989-)		8	Civilians (South Sudan)		7	78	South Sudan	Unity	Rubkona		Bentiu	9.23333	29.83333	1	Agence France Presse	"Sudanese war planes launched a fresh bombing raid on Bentiu, capital of the oil-rich South Sudan border state of Unity. Heavy explosions rocked the town as several bombs were dropped near a key bridge and in a market, killing at least one child and fourteen other civilians. "	15626	82SSD	78745	23/04/2012	2012	4	23	1	Remote violence	Military Forces of Sudan (1989-)		8	Civilians (South Sudan)		7	78	South Sudan	Unity	Rubkona		Rubkona	9.29349	29.78920	1	Sudan Tribune	One killed during an air strike on a border town. 	1626	83SSD	78746	23/04/2012	2012	4	23	1	Remote violence	Military Forces of Sudan (1989-)		8	Civilians (South Sudan)		7	78	South Sudan	Upper Nile	Manyo		Toro	10.59341	32.12341	1	The New York Times	Sudanese warplanes bomb a small town near the border over the course of two days. 	0626	84SSD	78747	24/04/2012	2012	4	24	1	Remote violence	Military Forces of Sudan (1989-)		8	Civilians (South Sudan)		7	78	South Sudan	Upper Nile	Manyo		Toro	10.59341	32.12341	1	The New York Times	Sudanese warplanes bomb a small town near the border over the course of two days. 	0626	85SSD	78748	27/04/2012	2012	4	27	1	Non-violent activity by a conflict actor	Military Forces of South Sudan (2011-)		1			0	10	South Sudan	Central Equatoria	Juba		Juba	4.85170	31.58250	2	BBC Monitoring Newsfile	Elements of leadership in the SPLA announce plans to launch a coup in South Sudan. The group has been plotting to overthrow Salva Kiir as a result of the widespread arrest campaign targeting senior members of the Nuer tribe in the SPLA.	0626	86SSD	78749	27/04/2012	2012	4	27	1	Battle-No change of territory	Military Forces of Sudan (1989-)		8	Military Forces of South Sudan (2011-)	SSDA: South Sudan Democratic Army	1	18	South Sudan	Upper Nile	Malakal		Malakal	9.53342	31.66048	1	Agence France Presse	South Sudan forces report they have repelled an attack of northern and northern backed forces against them. 21 reported KIA.	21626	87SSD	78750	28/04/2012	2012	4	28	1	Battle-No change of territory	Military Forces of Sudan (1989-)		8	Military Forces of South Sudan (2011-)	SSDA: South Sudan Democratic Army	1	18	South Sudan	Upper Nile	Malakal		Malakal	9.53342	31.66048	1	Reuters News	Clashes in Upper Nile continue into the second day. 	0626	88SSD	78751	29/04/2012	2012	4	29	1	Battle-No change of territory	Military Forces of Sudan (1989-)		8	Military Forces of South Sudan (2011-)		1	18	South Sudan	Unity	Koch		Unity State	8.65000	29.85000	2	The Wall Street Journal	Northern forces attempt to hit southern positions in Unity State over the course of two days. 	0626	89SSD	78752	29/04/2012	2012	4	29	1	Remote violence	Military Forces of Sudan (1989-)		8	SPLM-N: Sudan People's Liberation Movement (North)		2	28	South Sudan	Upper Nile	Melut		Wedakona	10.00000	32.70000	2	Platts Commodity News	Sudanese war planes make bombing runs on Southern positions near Wedaknoa. 	0626	93SSD	78756	30/04/2012	2012	4	30	1	Non-violent transfer of territory	Military Forces of South Sudan (2011-)		1	Military Forces of Sudan (1989-)		8	18	South Sudan	Western Bahr el Ghazal	Raga		Western Bahr el Ghazal	7.88333	25.86667	2	Agence France Presse	The Sudanese foreign ministry said South Sudanese troops on Monday occupied a disputed area on the border of Sudan's Darfur and South Sudan's Western Bahr el-Ghazal state.	0626	92SSD	78755	30/04/2012	2012	4	30	1	Battle-No change of territory	Military Forces of Sudan (1989-)		8	Military Forces of South Sudan (2011-)	SSDA: South Sudan Democratic Army	1	18	South Sudan	Upper Nile	Melut		Wedakona	10.00000	32.70000	2	Platts Commodity News	Aerial bombardments continue into the second day. Local residents flee the fighting in great number. 	0626	91SSD	78754	30/04/2012	2012	4	30	1	Battle-No change of territory	Military Forces of Sudan (1989-)		8	Military Forces of South Sudan (2011-)		1	18	South Sudan	Unity	Koch		Unity State	8.65000	29.85000	2	The Wall Street Journal	Northern forces attempt to hit southern positions in Unity State for the second day. 	0626	90SSD	78753	30/04/2012	2012	4	30	1	Violence against civilians	Unidentified Armed Group (South Sudan)		3	Civilians (South Sudan)		7	37	South Sudan	Jonglei	Bor South		Anyidi	6.21701	31.55548	1	Sudan Tribune	"An attack by Jonglei raiders was carried out against a car travelling to Pibor county from Bor, a day before a peace conference was launched to address the issue of raiding and violence against civilians."	0626	94SSD	78757	01/05/2012	2012	5	1	1	Battle-No change of territory	Military Forces of South Sudan (2011-)		1	Military Forces of Sudan (1989-)	Unidentified Armed Group (Sudan)	8	18	South Sudan	Unity	Pariang		Hofra	9.69417	29.57794	2	Agence France Presse	"""Sudanese forces, militias and mercenaries attacked our positions in Hofra in the oil region of Unity state,"" the South Sudanese army spokesperson reported. 30 soldiers reported killed."	30626	95SSD	78758	03/05/2012	2012	5	3	1	Remote violence	Military Forces of Sudan (1989-)		8	Civilians (South Sudan)		7	78	South Sudan	Unity	Pariang		Laloba	9.67522	29.59168	2	Associated Press	"South Sudan's military spokesmanthat Sudanese aircraft dropped 10 bombs in an oil-rich region near a military base south of the shared border, in the town of Laloba, late Thursday. 2 civilians reported wounded in the bombings. Nearby military base in Teshwin shelled at the same time."	0626	96SSD	78759	03/05/2012	2012	5	3	1	Remote violence	Military Forces of Sudan (1989-)		8	Military Forces of South Sudan (2011-)		1	18	South Sudan	Unity	Pariang		Teswhin	9.67522	29.59168	2	Associated Press	"South Sudan's military spokesmanthat Sudanese aircraft dropped 10 bombs in an oil-rich region near a military base south of the shared border, in the town of Laloba, late Thursday. 2 civilians reported wounded in the bombings. Nearby military base in Teshwin shelled at the same time."	0626	97SSD	78760	03/05/2012	2012	5	3	1	Battle-No change of territory	Military Forces of Sudan (1989-)		8	SPLM-N: Sudan People's Liberation Movement (North)		2	28	South Sudan	Upper Nile	Maiwut		Bau	8.81670	34.03330	1	Sudanese Media Centre	"The Sudanese Media Centre reported that the army had regained control of Bau town in Blue Nile, but rebels of the Sudan People's Liberation Movement-North (SPLM-N) denied losing control of the area."	0626	98SSD	78761	04/05/2012	2012	5	4	1	Remote violence	Military Forces of Sudan (1989-)		8	Civilians (South Sudan)		7	78	South Sudan	Western Bahr el Ghazal	Raga		Raga	8.45955	25.67800	1	The Citizen (Juba)	Sudanese warplane on Friday bombed SPLA positions in Sera Malakal in Raja County and all the villages surrounding it injuring civilians.	0626	99SSD	78762	04/05/2012	2012	5	4	1	Remote violence	Military Forces of Sudan (1989-)		8	Military Forces of South Sudan (2011-)		1	18	South Sudan	Western Bahr el Ghazal	Raga		Raga	8.45955	25.67800	1	The Citizen (Juba)	Sudanese warplane on Friday bombed SPLA positions in Sera Malakal in Raja County and all the villages surrounding it injuring civilians.	0626	101SSD	78764	07/05/2012	2012	5	7	1	Remote violence	Military Forces of Sudan (1989-)		8	Civilians (South Sudan)		7	78	South Sudan	Unity	Koch		Unity State	8.65000	29.85000	3	New Vision	"Sudanese war planes have launched renewed air strikes against South Sudan, violating a UN Security Council resolution to end weeks of border conflict, the South's army said. Bombing was reported in civilian areas of Upper Nile, Unity and Western Bahr el Ghazal."	0626	102SSD	78765	07/05/2012	2012	5	7	1	Remote violence	Military Forces of Sudan (1989-)		8	Civilians (South Sudan)		7	78	South Sudan	Upper Nile	Baliet		Upper Nile	9.76667	32.73333	3	New Vision	"Sudanese war planes have launched renewed air strikes against South Sudan, violating a UN Security Council resolution to end weeks of border conflict, the South's army said. Bombing was reported in civilian areas of Upper Nile, Unity and Western Bahr el Ghazal."	0626	103SSD	78766	07/05/2012	2012	5	7	1	Remote violence	Military Forces of Sudan (1989-)		8	Civilians (South Sudan)		7	78	South Sudan	Western Bahr el Ghazal	Raga		Western Bahr el Ghazal	7.88333	25.86667	2	New Vision	"Sudanese war planes have launched renewed air strikes against South Sudan, violating a UN Security Council resolution to end weeks of border conflict, the South's army said. Bombing was reported in civilian areas of Upper Nile, Unity and Western Bahr el Ghazal."	0626	100SSD	78763	07/05/2012	2012	5	7	1	Non-violent transfer of territory	Militia (John Dueth Yiech)		3			0	30	South Sudan	Central Equatoria	Juba		Juba	4.85170	31.58250	1	Sudan Tribune	South Sudan announced on Monday that a group of rebels have abandoned their armed struggle and returned to the country's capital Juba. A rebel militia of 215 men under the command of Major General John Dueth Yiech and Brigadier General James Duoth Lam are now part of the South Sudan army (SPLA) claims Juba.	0626	104SSD	78767	08/05/2012	2012	5	8	1	Remote violence	Military Forces of Sudan (1989-)		8	Civilians (South Sudan)		7	78	South Sudan	Unity	Koch		Unity State	8.65000	29.85000	3	New Vision	"Sudanese war planes have launched renewed air strikes against South Sudan, violating a UN Security Council resolution to end weeks of border conflict, the South's army said. Bombing was reported in civilian areas of Upper Nile, Unity and Western Bahr el Ghazal."	0626	105SSD	78768	08/05/2012	2012	5	8	1	Remote violence	Military Forces of Sudan (1989-)		8	Civilians (South Sudan)		7	78	South Sudan	Upper Nile	Baliet		Upper Nile	9.76667	32.73333	3	New Vision	"Sudanese war planes have launched renewed air strikes against South Sudan, violating a UN Security Council resolution to end weeks of border conflict, the South's army said. Bombing was reported in civilian areas of Upper Nile, Unity and Western Bahr el Ghazal."	0626	106SSD	78769	08/05/2012	2012	5	8	1	Remote violence	Military Forces of Sudan (1989-)		8	Civilians (South Sudan)		7	78	South Sudan	Western Bahr el Ghazal	Raga		Western Bahr el Ghazal	7.88333	25.86667	2	New Vision	"Sudanese war planes have launched renewed air strikes against South Sudan, violating a UN Security Council resolution to end weeks of border conflict, the South's army said. Bombing was reported in civilian areas of Upper Nile, Unity and Western Bahr el Ghazal."	0626	107SSD	78770	09/05/2012	2012	5	9	1	Violence against civilians	Murle Ethnic Militia (South Sudan)		4	Civilians (South Sudan)		7	47	South Sudan	Jonglei	Uror		Jonglei	8.00000	32.00000	3	Sudan Tribune	"In Twic East two people were killed and one person was injured on Wednesday 9 May when attackers, assumed to be members of the Murle tribe, captured 32 heads of cattle, according to Dau Akoy, the county commissioner. South Sudan's army (SPLA) later rescued the cows."	2626	109SSD	78772	10/05/2012	2012	5	10	1	Violence against civilians	Murle Ethnic Militia (South Sudan)		4	Civilians (South Sudan)		7	47	South Sudan	Jonglei	Bor South		Bangachorot	6.20609	31.54724	2	Sudan Tribune	"On Thursday 10 May a car belonging to the South Sudan Ministry of Roads and Bridges was traveling from Juba to Jonglei when its was attacked by suspected Murle ethnic militia members near Panwell village of Bangachorot. Two policemen were wounded and the driver was killed, according to Jonglei police."	1626	108SSD	78771	10/05/2012	2012	5	10	1	Battle-No change of territory	Murle Ethnic Militia (South Sudan)		4	Police Forces of South Sudan (2011-)		1	14	South Sudan	Jonglei	Bor South		Bangachorot	6.20609	31.54724	2	Sudan Tribune	"On Thursday 10 May a car belonging to the South Sudan Ministry of Roads and Bridges was traveling from Juba to Jonglei when its was attacked by suspected Murle ethnic militia members near Panwell village of Bangachorot. Two policemen were wounded and the driver was killed, according to Jonglei police."	0626	110SSD	78773	13/05/2012	2012	5	13	1	Violence against civilians	Military Forces of South Sudan (2011-)		1	Civilians (Kenya)		7	17	South Sudan	Central Equatoria	Juba		Juba	4.85170	31.58250	1	The Citizen (Juba)	"A teacher from Kenya was shot dead by a soldier along the road passing the Mausoleum of Dr. John Garang de Mabior. The shooting took place during the lowering of the flag, during which time it is customary for all vehicles to halt. The teacher appeared unaware of this practice, and was shot by the soldier."	1626	111SSD	78774	14/05/2012	2012	5	14	1	Riots/Protests	Protesters (South Sudan)		6			0	60	South Sudan	Central Equatoria	Juba		Juba	4.85170	31.58250	1	The Citizen (Juba)	South Sudanese women yesterday hold a peaceful nationwide demonstration against Khartoum's continuous aggressions and bombardment of territories within their country as a result leading to deaths of innocent women and children. Women marchedmarched from Dr. John Garang Mausoleum to the United Nations Mission in South Sudan (UNMISS) headquarters in Jebel Kujur.	0626	112SSD	78775	15/05/2012	2012	5	15	1	Battle-No change of territory	Military Forces of Sudan (1989-)		8	Military Forces of South Sudan (2011-)		1	18	South Sudan	Upper Nile	Renk		Wedakona	11.49650	32.72720	2	Sudan Tribune	"Aguer claimed a 15 May attack took place north of Wedakona in Unity state. He said a SAF attack on the area was immediately rpulsed by the SPLA, back to White Nile state."	0626	113SSD	78776	21/05/2012	2012	5	21	1	Non-violent activity by a conflict actor	Military Forces of Sudan (1989-)		8			0	80	South Sudan	Central Equatoria	Juba		Juba	4.85170	31.58250	1	Sudan Tribune	The public in Juba were in a state of panic after military officials claimed that a Sudan-owned military aircraft flew for several hours over Juba.	0626	114SSD	78777	21/05/2012	2012	5	21	1	Riots/Protests	Protesters (South Sudan)		6			0	60	South Sudan	Central Equatoria	Juba		Juba	4.85170	31.58250	1	Sudan Tribune	"Hundred of citizens from the contested region of Abyei demonstrated across South Sudan in protest at the failure of the Sudanese government to withdraw troops from the area. Demonstrations were held in Agok, Wau and Juba."	0626	115SSD	78778	21/05/2012	2012	5	21	1	Riots/Protests	Protesters (South Sudan)		6			0	60	South Sudan	Northern Bahr el Ghazal	Aweil South		Agok	8.55440	27.93930	2	Sudan Tribune	"Hundred of citizens from the contested region of Abyei demonstrated across South Sudan in protest at the failure of the Sudanese government to withdraw troops from the area. Demonstrations were held in Agok, Wau and Juba."	0626	116SSD	78779	21/05/2012	2012	5	21	1	Riots/Protests	Protesters (South Sudan)		6			0	60	South Sudan	Western Bahr el Ghazal	Wau		Wau	7.70278	27.99528	2	Sudan Tribune	"Hundred of citizens from the contested region of Abyei demonstrated across South Sudan in protest at the failure of the Sudanese government to withdraw troops from the area. Demonstrations were held in Agok, Wau and Juba."	0626	117SSD	78780	22/05/2012	2012	5	22	1	Non-violent activity by a conflict actor	Military Forces of South Sudan (2011-)		1			0	10	South Sudan	Jonglei	Uror		Jonglei	8.00000	32.00000	3	Sudan Tribune	"The Deputy Governor of Jonglei has confirmed that the state government has deployed security forces throughout the 11 counties, to protect civilians recently disarmed by the South Sudan army (SPLA)."	0626	118SSD	78781	22/05/2012	2012	5	22	1	Non-violent activity by a conflict actor	Unidentified Armed Group (Sudan)		3			0	30	South Sudan	Unity	Abiemnhom		Abiemnom	9.33300	28.91700	2	Radio Miraya	"The Sudan People's Liberation Army [SPLA] on Monday [21 May] said it has detected movements of a militia group in Unity State, South Sudan. SPLA spokesperson, Col. Philip Aguer says the militants appear to be stationed in Abiemnhom and Mayom counties. "	0626	119SSD	78782	22/05/2012	2012	5	22	1	Non-violent activity by a conflict actor	Unidentified Armed Group (Sudan)		3			0	30	South Sudan	Unity	Mayom		Mayom	9.22000	29.17000	2	Radio Miraya	"The Sudan People's Liberation Army [SPLA] on Monday [21 May] said it has detected movements of a militia group in Unity State, South Sudan. SPLA spokesperson, Col. Philip Aguer says the militants appear to be stationed in Abiemnhom and Mayom counties. "	0626	120SSD	78783	23/05/2012	2012	5	23	1	Non-violent activity by a conflict actor	Murle Ethnic Militia (South Sudan)	Lou Nuer Ethnic Group (South Sudan)	4			0	40	South Sudan	Jonglei	Bor South		Bor	6.20720	31.55920	2	Sudan Tribune	The three counties of Greater Akobo in Jonglei State are holding a political reconciliation conference in Bor town the capital of Jonglei State.	0626	121SSD	78784	23/05/2012	2012	5	23	1	Violence against civilians	Unidentified Armed Group (Sudan)	PDF: Popular Defence Forces	3	Civilians (South Sudan)		7	37	South Sudan	Northern Bahr el Ghazal	Aweil West		Aweil	8.76670	27.40000	1	Sudan Tribune	"South Sudan said Wednesday that militia groups aligned to the government of neighbouring Sudan, collaboratively attempted to attack the border states of Western and Northern Bahr el Ghazal. Eyewitnesses and state officials from Aweil East County, Northern Bahr el Ghazal, said, in series of interviews with Sudan Tribune, that the attack was carried out by militia groups acting in collaboration with the Khartoum-sponsored Popular Defence Forces (PDF) and the Sudan Armed Forces."	0626	122SSD	78785	24/05/2012	2012	5	24	2	Violence against civilians	Military Forces of South Sudan (2011-)		1	Civilians (South Sudan)	Murle Ethnic Group (South Sudan)	7	17	South Sudan	Jonglei	Uror		Jonglei	8.00000	32.00000	3	Associated Press	"South Sudan military forces tasked with carrying out a disarmament campaign among feuding ethnic groups are raping, torturing and killing members of the minority Murle community, according to aid and community groups. At least 10 people reported killed."	10626	123SSD	78786	25/05/2012	2012	5	25	1	Violence against civilians	Military Forces of South Sudan (2011-)		1	Civilians (South Sudan)	Murle Ethnic Group (South Sudan)	7	17	South Sudan	Jonglei	Pibor		Pibor	6.79833	33.13028	2	Associated Press	"Leaders of a minority community said South Sudan troops shot and killed a teenager on Friday while he was fishing, linking the death to the military's disarmament campaign in a conflict-torn state."	1626	124SSD	78787	26/05/2012	2012	5	26	1	Violence against civilians	PDF: Popular Defence Forces		3	Civilians (South Sudan)		7	37	South Sudan	Northern Bahr el Ghazal	Aweil North		Majakbaai	9.15381	26.83067	1	Sudan Tribune	"South Sudan claimed on Saturday one woman was killed on her farm in Majakbaai village, Northern Bahr el Ghazal state, following a raid carried out by Khartoum-backed Arab tribesmen"	1626	125SSD	78788	27/05/2012	2012	5	27	2	Non-violent activity by a conflict actor	SSPLA/M: South Sudan People's Liberation Army/Movement		2			0	20	South Sudan	Central Equatoria	Juba		Juba	4.85170	31.58250	1	Sudan Tribune	"The leader of the former rebel group, the South Sudan People's Liberation Movement/Army (SSPLM/A), Tong Lual Ayat, said on Sunday that arrangements to integrate over 4,000 of his troops into the SPLA will be completed within days."	0626	127SSD	78790	28/05/2012	2012	5	28	1	Violence against civilians	Military Forces of Sudan (1989-)		8	Civilians (South Sudan)		7	78	South Sudan	Northern Bahr el Ghazal	Aweil West		Aweil	8.76816	27.40019	1	Sudan Tribune	"South Sudan said Monday said 10 people, most of whom were innocent civilians, have lost their lives following an attack allegedly carried out by the armed forces of the neigbouring Sudan."	8626	126SSD	78789	28/05/2012	2012	5	28	1	Battle-No change of territory	Military Forces of Sudan (1989-)		8	Military Forces of South Sudan (2011-)		1	18	South Sudan	Northern Bahr el Ghazal	Aweil West		Aweil	8.76816	27.40019	1	Sudan Tribune	"South Sudan said Monday said 10 people, most of whom were innocent civilians, have lost their lives following an attack allegedly carried out by the armed forces of the neigbouring Sudan."	2626	128SSD	78791	29/05/2012	2012	5	29	1	Battle-No change of territory	Military Forces of Sudan (1989-)		8	Military Forces of South Sudan (2011-)		1	18	South Sudan	Northern Bahr el Ghazal	Aweil Centre		Northern Bahr-el-Ghazal	8.73333	26.90000	3	Sudan Tribune	"Military spokesperson yesterday in press briefing put Sudan Armed Forces (SAF) death toll to 64 soldiers killed following Monday fighting. For the past three days there has been continuous aggression of aerial bombardment by Khartoum in Warguet, Majak Woi and Kiirkou in Northern Bahr el Ghazal State."	16626	129SSD	78792	04/06/2012	2012	6	4	1	Battle-No change of territory	Unidentified Armed Group (South Sudan)		3	Police Forces of South Sudan (2011-)		1	13	South Sudan	Eastern Equatoria	Torit		Torit	4.54905	32.23938	2	Sudan Tribune	"A top police officer in South Sudan's Eastern Equatoria State was gunned down on Saturday by unknown assailants, near Juba, the country's capital."	1626	130SSD	78793	09/06/2012	2012	6	9	1	Battle-No change of territory	Unidentified Armed Group (South Sudan)		3	Police Forces of South Sudan (2011-)		1	13	South Sudan	Central Equatoria	Juba		Juba/Torit Road	4.84597	31.60120	2	Sudan Tribune	High ranking police commissioner killed by an unidentified armed group in a car between Juba & Torit.	1626	131SSD	78794	10/06/2012	2012	6	10	1	Battle-No change of territory	Military Forces of Sudan (1989-)		8	SPLM-N: Sudan People's Liberation Movement (North)		2	28	South Sudan	Upper Nile	Maiwut		Bau	8.81670	34.03330	1	Agence France Presse	Military forces of Sudan (1989-) and SPLM continue fighting in Bau. Military forces of Sudan (1989-) dispute claims of this battle.	0626	132SSD	78795	10/06/2012	2012	6	10	1	Battle-No change of territory	Unidentified Armed Group (South Sudan)		3	Unidentified Armed Group (South Sudan)		3	33	South Sudan	Warrap	Tonj South		Tonj urban	7.27369	28.68223	1	Africa News	Local residents in Tonj fought over land distribution. Figures unkown for injuries/casualties. 	0626	133SSD	78796	11/06/2012	2012	6	11	1	Violence against civilians	Unidentified Armed Group (South Sudan)	SPLA/M: Sudanese People's Liberation Army/Movement	3	Civilians (South Sudan)		7	37	South Sudan	Central Equatoria	Juba		Khor Angereb	4.70136	31.91880	2	allafrica.com	"Unidentified armed group (South Sudan) wearing military uniforms, similar to those worn by the SPLA/M: Sudan People's Liberation Army/Movement attacked a vehicle carrying three passengers travelling to Juba in the Khor Angereb area near Ngangala."	0626	134SSD	78797	13/06/2012	2012	6	13	2	Non-violent activity by a conflict actor	Military Forces of South Sudan (2011-)		1			0	10	South Sudan	Lakes	Wulu		Lakes	6.35000	29.48330	3	allafrica.com	SPLA/M recruit 1000 new troops across Lake States in Bahr el Ghazal.	0626	135SSD	78798	15/06/2012	2012	6	15	1	Non-violent activity by a conflict actor	Police Forces of South Sudan (2011-)	Police Forces of Uganda (1986-)	1			0	10	South Sudan	Central Equatoria	Juba		Juba	4.85170	31.58250	1	allafrica.com	Police Forces of Uganda (1986-) leader travelled to Juba to meet Police Forces of Southern Sudan (2011-) leader to resolve the issues surrounding last week's strike by traders and truck drivers at the border posts. 	0626	136SSD	78799	16/06/2012	2012	6	16	1	Non-violent activity by a conflict actor	Military Forces of Sudan (1989-)		8			0	80	South Sudan	Western Bahr el Ghazal	Raga		Raga	8.45955	25.67800	1	BBC Monitoring	Military Forces of Sudan (1989-) carrying forces by helicopters and bringing them to the border at Raja.	0626	138SSD	78801	17/06/2012	2012	6	17	1	Non-violent activity by a conflict actor	Military Forces of Sudan (1989-)		8			0	80	South Sudan	Western Bahr el Ghazal	Raga		Raga	8.45955	25.67800	1	BBC Monitoring	Military Forces of Sudan (1989-) carrying forces by helicopters and bringing them to the border at Raja.	0626	137SSD	78800	17/06/2012	2012	6	17	1	Battle-No change of territory	Unidentified Armed Group (South Sudan)		3	Unidentified Armed Group (South Sudan)		3	33	South Sudan	Jonglei	Bor South		Bor	6.20720	31.55920	2	allafrica.com	Supporters of opposing village chief election candidates fought to death in Pan-Pandiar village in Kolnyang district of Bor County on Sunday. SPLA/M calmed the groups after the fight. 2 killed.	2626	139SSD	78802	18/06/2012	2012	6	18	1	Non-violent activity by a conflict actor	Military Forces of Sudan (1989-)		8			0	80	South Sudan	Western Bahr el Ghazal	Raga		Raga	8.45955	25.67800	1	BBC Monitoring	Military Forces of Sudan (1989-) carrying forces by helicopters and bringing them to the border at Raja.	0626	140SSD	78803	19/06/2012	2012	6	19	1	Battle-No change of territory	Military Forces of Sudan (1989-)	Unidentified Armed Group (Sudan)	8	SPLM-N: Sudan People's Liberation Movement (North)		2	28	South Sudan	Upper Nile	Manyo		Kaka	10.57880	32.15156	1	BBC Monitoring	Military forces of Sudan (1989-) supported by a political militia clash with SPLA/M forces in Kaka Tuesday evening but were repulsed. Unknown casualities. Military forces of Sudan (1989-) dispute claims of this battle.	0626	141SSD	78804	19/06/2012	2012	6	19	1	Battle-No change of territory	Military Forces of Sudan (1989-)		8	SPLM-N: Sudan People's Liberation Movement (North)		2	28	South Sudan	Upper Nile	Malakal		Malakal	9.53342	31.66049	1	BBC Monitoring	Military Forces of Sudan (1989-) attack SPLA/M forces at Malakal	0626	142SSD	78805	21/06/2012	2012	6	21	1	Battle-No change of territory	Unidentified Armed Group (South Sudan)		3	SPLM-N: Sudan People's Liberation Movement (North)		2	23	South Sudan	Jonglei	Nyirol		Sobat River	8.91662	32.42958	3	Sudan Radio Service (Juba)	"At least 10 people were killed and several others are missing or wounded in an attack on boats in Akobo county, Jonglei state. 5 soldiers and 5 attackers killed when unidentified gunmen attacked SPLA forces on the Sobat River, Jonglei."	10626	143SSD	78806	26/06/2012	2012	6	26	1	Battle-No change of territory	Military Forces of Ethiopia (1991-)		8	Militia (Gen Peter Kuol Chol)		3	38	South Sudan	Jonglei	Akobo		Ethiopia-South Sudan border	7.76542	33.24463	3	Sudan Tribune	South Sudan's army says a spiritual leader who fled disarmament in Jonglei state to neighbouring Ethiopia has been captured along with 200 others by the Ethiopian military on the border between the two countries.	0626	144SSD	78807	29/06/2012	2012	6	29	1	Non-violent activity by a conflict actor	Militia (Gen. Peter Kuol Chol)		3			0	30	South Sudan	Central Equatoria	Juba		Juba	4.85170	31.58250	1	Daily Monitor (Kampala)	"South Sudan rebel forces formerly commanded by late George Athor Deng are laying down arms to reintegrate into the regular army, officials from both sides have said. Gen Peter Kuol Chol, the rebel leader who took over leadership of the rebel group following the death of Athor, said 1,085 officers from his force are joining the SPLA."	0626	145SSD	78808	01/07/2012	2012	7	1	1	Violence against civilians	Military Forces of South Sudan (2011-)		1	Civilians (South Sudan)		7	17	South Sudan	Lakes	Rumbek Centre		Achol Malek	7.10975	29.78874	2	Sudan Tribune	"Two men in military uniform are alleged to have killed a cattle herder in Lakes State on a roadside near the Achol Malek residential area, in Cueibet County. The dead man, Makol Mabuoc Nyintok, was alleged to have been shot for refusing to take off a cap of the South Sudan's army (SPLA). NB: CORRECTION FROM 3 JULY. Contrary to previous reports, the man shot by soldiers on Monday, Makol Mabuoc Nyintok, was not killed but was taken to Rumbek Civil Hospital by a relative on Tuesday with an injured mouth."	0626	146SSD	78809	03/07/2012	2012	7	3	1	Violence against civilians	Unidentified Armed Group (South Sudan)		3	Civilians (South Sudan)		7	37	South Sudan	Lakes	Rumbek Centre		Rumbek	6.81837	29.68128	1	Sudan Tribune	"A group of people travelling from Rumbek Central County to Maper in Rumbek North County were ambushed on Tuesday, according to local officials, who have blamed armed men from neighbouring Cueibet County, which is also in Lakes state."	0626	147SSD	78810	07/07/2012	2012	7	7	1	Violence against civilians	Civilians (Sudan)		7	Unidentified Armed Group (Sudan)		3	37	South Sudan	Central Equatoria	Juba		Juba	4.85170	31.58250	1	Sudan Tribune	"The Chairperson of South Sudan's Civil Society Alliance, Deng Athuai, who is a prominent anti-corruption and human rights activist, was on Saturday found by the side of a road in Juba tied in a sack and severely beaten, according to military sources."	0626	148SSD	78811	08/07/2012	2012	7	8	1	Battle-No change of territory	Gok Ethnic Militia (Sudan)		4	Gok Ethnic Militia (Sudan)		4	44	South Sudan	Lakes	Rumbek Centre		Cueibet	6.81837	29.68128	1	Sudan Tribune	At least 16 people are reported to have been killed and several injured in a conflict between two ethnic groups in Cueibet county of South Sudan's Lakes state on Saturday	16626	149SSD	78812	18/07/2012	2012	7	18	1	Violence against civilians	Military Forces of South Sudan (2011-)		1	Civilians (South Sudan)		7	17	South Sudan	Lakes	Rumbek Centre		Rumbek	6.81837	29.68128	1	Sudan Tribune	"Lakes State security services patrolling in Rumbek as Lakes State celebrates South Sudan's first year of independence, 9 July 2012 (ST)_The civilian was stopped upon discovery that was carrying an AK47 machine gun. He was shot dead by SPLA troops while fleeing, after he had placed his weapon on the ground. "	1626	150SSD	78813	20/07/2012	2012	7	20	1	Remote violence	Military Forces of Sudan (1989-)		8	Civilians (South Sudan)		7	78	South Sudan	Northern Bahr el Ghazal	Aweil West		Rumaker	9.01259	26.99341	2	Sudan Tribune	South Sudan on Friday accused the Sudan Armed Forces (SAF) of carrying out fresh air strike in Northern Bahr el-Ghazal state triggering the suspension of ongoing talks in the Ethiopian town of Bahir Dar.	1626	151SSD	78814	25/07/2012	2012	7	25	1	Battle-No change of territory	Unidentified Armed Group (Sudan)		3	Military Forces of South Sudan (2011-)		1	13	South Sudan	Unity	Mayom		Mayom	9.22000	29.17000	2	Sudan Tribune	An armed man suspected to be an next soldier was shot dead by South Sudan's army on Wednesday in Unity States Mayom County after he shot and wounded two women in their homes.	2626	152SSD	78815	09/08/2012	2012	8	9	1	Riots/Protests	Protesters (South Sudan)		6			0	60	South Sudan	Central Equatoria	Juba		University of Juba	4.84597	31.60120	1	The Citizen	Ten days after official reopening of University of Juba the claimed 560 dismissed students in a surprise rally yesterday threatened to stage a protest if the concerned officials in the government particularly the Ministry of Higher Education and others concerned with education affairs failed to intervened in the University administration and students row.	0626	153SSD	78816	12/08/2012	2012	8	12	1	Violence against civilians	Military Forces of Sudan (1989-)		8	Civilians (South Sudan)		7	78	South Sudan	Upper Nile	Renk		Renk	11.74310	32.80490	1	Sudan Tribune	"At least three people were killed and several wounded on 12 and 17 August when the Sudanese army (SAF) twice attacked Renk county of Upper Nile state, according to a government official The state governor, Simon Kun Puoc, on Saturday told Sudan Tribune that SAF troops invaded Renk agricultural scheme in the Adham area of Samadi payam [district], killing and wounding innocent civilians on their farms, before a South Sudanese army (SPLA) company in the area intervened."	1626	154SSD	78817	15/08/2012	2012	8	15	1	Violence against civilians	Military Forces of South Sudan (2011-)		1	Civilians (South Sudan)		7	17	South Sudan	Jonglei	Pibor		Pibor	6.79833	33.13028	2	Sudan Tribune	"Government soldiers committed murder, torture and rape in the largest and troubled South Sudanese state of Jonglei Between 15 July and 20 August, the [UNAMID] mission said that the SPLA soldiers allegedly killed one person. It further said there are ""27 allegations of torture or ill-treatment, such as beatings, and simulated drowning in some cases, 12 rapes, six attempted rapes and eight abductions."""	1626	155SSD	78818	16/08/2012	2012	8	16	1	Violence against civilians	Military Forces of South Sudan (2011-)		1	Civilians (South Sudan)		7	17	South Sudan	Jonglei	Pibor		Pibor	6.79833	33.13028	2	Sudan Tribune	"Government soldiers committed murder, torture and rape in the largest and troubled South Sudanese state of Jonglei Between 15 July and 20 August, the [UNAMID] mission said that the SPLA soldiers allegedly killed one person. It further said there are ""27 allegations of torture or ill-treatment, such as beatings, and simulated drowning in some cases, 12 rapes, six attempted rapes and eight abductions."""	1626	156SSD	78819	17/08/2012	2012	8	17	1	Violence against civilians	Military Forces of South Sudan (2011-)		1	Civilians (South Sudan)		7	17	South Sudan	Jonglei	Pibor		Pibor	6.79833	33.13028	2	Sudan Tribune	"Government soldiers committed murder, torture and rape in the largest and troubled South Sudanese state of Jonglei Between 15 July and 20 August, the [UNAMID] mission said that the SPLA soldiers allegedly killed one person. It further said there are ""27 allegations of torture or ill-treatment, such as beatings, and simulated drowning in some cases, 12 rapes, six attempted rapes and eight abductions."""	1626	157SSD	78820	17/08/2012	2012	8	17	1	Battle-No change of territory	Military Forces of Sudan (1989-)		8	Military Forces of South Sudan (2011-)		1	18	South Sudan	Upper Nile	Renk		Renk	11.74310	32.80490	1	Sudan Tribune	"At least three people were killed and several wounded on 12 and 17 August when the Sudanese army (SAF) twice attacked Renk county of Upper Nile state, according to a government official The state governor, Simon Kun Puoc, on Saturday told Sudan Tribune that SAF troops invaded Renk agricultural scheme in the Adham area of Samadi payam [district], killing and wounding innocent civilians on their farms, before a South Sudanese army (SPLA) company in the area intervened."	2626	158SSD	78821	18/08/2012	2012	8	18	1	Violence against civilians	Military Forces of South Sudan (2011-)		1	Civilians (South Sudan)		7	17	South Sudan	Jonglei	Pibor		Pibor	6.79833	33.13028	2	Sudan Tribune	"Government soldiers committed murder, torture and rape in the largest and troubled South Sudanese state of Jonglei Between 15 July and 20 August, the [UNAMID] mission said that the SPLA soldiers allegedly killed one person. It further said there are ""27 allegations of torture or ill-treatment, such as beatings, and simulated drowning in some cases, 12 rapes, six attempted rapes and eight abductions."""	1626	159SSD	78822	19/08/2012	2012	8	19	1	Violence against civilians	Military Forces of South Sudan (2011-)		1	Civilians (South Sudan)		7	17	South Sudan	Jonglei	Pibor		Pibor	6.79833	33.13028	2	Sudan Tribune	"Government soldiers committed murder, torture and rape in the largest and troubled South Sudanese state of Jonglei Between 15 July and 20 August, the [UNAMID] mission said that the SPLA soldiers allegedly killed one person. It further said there are ""27 allegations of torture or ill-treatment, such as beatings, and simulated drowning in some cases, 12 rapes, six attempted rapes and eight abductions."""	1626	160SSD	78823	20/08/2012	2012	8	20	1	Violence against civilians	Military Forces of South Sudan (2011-)		1	Civilians (South Sudan)		7	17	South Sudan	Jonglei	Pibor		Pibor	6.79833	33.13028	2	Sudan Tribune	"Government soldiers committed murder, torture and rape in the largest and troubled South Sudanese state of Jonglei Between 15 July and 20 August, the [UNAMID] mission said that the SPLA soldiers allegedly killed one person. It further said there are ""27 allegations of torture or ill-treatment, such as beatings, and simulated drowning in some cases, 12 rapes, six attempted rapes and eight abductions."""	1626	161SSD	78824	23/08/2012	2012	8	23	1	Battle-No change of territory	Yau Yau Rebels	Murle Ethnic Militia (South Sudan)	2	Military Forces of South Sudan (2011-)		1	12	South Sudan	Jonglei	Pibor		Thodo	6.80000	33.13330	2	Agence France Presse	"Rebels in South Sudan's Jonglei state have killed at least 24 soldiers, with several others missing or wounded"	24626	162SSD	78825	26/08/2012	2012	8	26	1	Violence against civilians	Unidentified Armed Group (Sudan)		3	Civilians (South Sudan)		7	37	South Sudan	Unity	Panyijiar		Tuochdol	7.49184	30.32776	2	Sudan Tribune	"Unknown raiders attacked Tuochdol village in Payinjiar county, Unity state on Sunday, leaving four dead, five seriously injured and taking with them 400 cattle, according to state authorities."	4626	163SSD	78826	29/08/2012	2012	8	29	1	Riots/Protests	Protesters (South Sudan)		6			0	60	South Sudan	Western Bahr el Ghazal	Wau		Wau	7.70278	27.99528	1	The Citizen (Juba)	"University of Bahr El Ghazal examination was indefinitely called off, after the lecturers decided not to show up with examination papers on the schedule timetable for second semester exams Therefore, they stage peaceful strike in order for the University administration to realize their first semesters and second examinations allowances, otherwise their strike would continue until their demand is met, said the lecturer."	0626	164SSD	78827	30/08/2012	2012	8	30	1	Battle-No change of territory	Yau Yau Rebels		2	Military Forces of South Sudan (2011-)		1	12	South Sudan	Jonglei	Pibor		Pibor	6.79833	33.13028	2	Sudan Tribune	Rebels led by David Yauyau attacked the South Sudan Army (SPLA) in Pibor County in south western Jonglei State at around noon local time on Thursday.	0626	166SSD	78829	05/09/2012	2012	9	5	1	Battle-No change of territory	Police Forces of South Sudan (2011-)		1	Police Forces of South Sudan (2011-)		1	11	South Sudan	Lakes	Rumbek Centre		Rumbek	6.81837	29.68128	1	Sudan Tribune	"A group of 30 drunk policemen in Rumbek, the capital of Lakes State, on Thursday attacked and shoot in the arm Rumbek Central County's Police Inspector, authorities have said."	0626	165SSD	78828	05/09/2012	2012	9	5	1	Violence against civilians	Unidentified Armed Group (South Sudan)		3	Civilians (South Sudan)		7	37	South Sudan	Central Equatoria	Juba		Juba	4.84597	31.60120	1	Sudan Tribune	"A human rights and civil society organisation in South Sudan's capital Juba were raided and looted by unknown gunmen, activists said on Wednesday. Biel Boutros Biel, the executive director of the South Susan Human Rights Society For Advocacy (SSHURSA), saif the office was broken early on Wednesday."	0626	167SSD	78830	06/09/2012	2012	9	6	1	Battle-No change of territory	Police Forces of South Sudan (2011-)		1	Police Forces of South Sudan (2011-)		1	11	South Sudan	Lakes	Rumbek Centre		Rumbek	6.81837	29.68128	1	Sudan Tribune	"On Wednesday other forces beaten up a Wildlife Police brigadier, also after reductions in their pay was announced."	0626	168SSD	78831	07/09/2012	2012	9	7	1	Riots/Protests	Protesters (South Sudan)	Police Forces of South Sudan (2011-)	6			0	60	South Sudan	Warrap	Tonj North		Warrap	8.00000	28.85000	2	Sudan Tribune	"Members of the organised forces in South Sudan's State of Warrap have refused to collect their monthly salaries, accusing the government to have unjustifiably and excessively cut their salaries, local officials and state legislators told Sudan Tribune on Friday."	0626	169SSD	78832	08/09/2012	2012	9	8	1	Violence against civilians	Police Forces of South Sudan (2011-)		1	Civilians (Sudan)		7	17	South Sudan	Central Equatoria	Juba		Juba	4.84597	31.60120	1	Capital FM	International hip hop star and renowned peace activist Emmanuel Jal was badly beaten by police in the South Sudanese capital of Juba last night on 8 September 2012.	0626	170SSD	78833	09/09/2012	2012	9	9	1	Battle-No change of territory	Military Forces of South Sudan (2011-)	SSLM/A: South Sudan Liberation Army/Movement	1	Military Forces of South Sudan (2011-)		1	11	South Sudan	Upper Nile	Renk		Chemedi	11.81359	32.80260	2	Sudan Tribune	"The SSLA in their email claim that on 9 September a ""Lt Col Deng Tito Lual Ajak rebelled with the force he was commanding at Chemedi near Renk town, Upper Nile State"". The rebels say that Ajak fought with the SPLA in the area and ""started contacting SSLA on September, 10, and asked for cooperation""... SPLA denies any rebellion took place."	0626	171SSD	78834	11/09/2012	2012	9	11	1	Violence against civilians	Unidentified Armed Group (South Sudan)		3	Civilians (South Sudan)		7	37	South Sudan	Lakes	Rumbek Centre		Rumbek	6.81837	29.68128	1	Sudan Tribune	"The Director of Catholic Radio Good News, Fr. Don Bosco Ochieng, was physically attack by unknown group of people at around 10pm on Tuesday night in Rumbek market,"	0626	172SSD	78835	12/09/2012	2012	9	12	2	Remote violence	Military Forces of Sudan (1989-)		8			0	80	South Sudan	Unity	Koch		Unity	8.65000	29.85000	3	Sudan Tribune	warplanes belonging to Khartoum have hovered over Unity and Upper Nile states over the last two days in violation of South Sudanese airspace.	0626	173SSD	78836	13/09/2012	2012	9	13	2	Remote violence	Military Forces of Sudan (1989-)		8			0	80	South Sudan	Upper Nile	Baliet		Upper Nile	9.76667	32.73333	3	Sudan Tribune	warplanes belonging to Khartoum have hovered over Unity and Upper Nile states over the last two days in violation of South Sudanese airspace.	0626	174SSD	78837	15/09/2012	2012	9	15	1	Battle-No change of territory	Military Forces of South Sudan (2011-)		1	Military Forces of South Sudan (2011-)		1	11	South Sudan	Upper Nile	Manyo		Nile River	11.43426	32.68433	2	Agence France Presse	"At least 10 soldiers were killed and another 50 were reported missing after friendly fire caused a South Sudanese military boat to sink on the Nile river, the army said Saturday. NB: final official toll was later raised to 40"	40626	175SSD	78838	30/09/2012	2012	9	30	1	Violence against civilians	Murle Ethnic Militia (South Sudan)		4	Civilians (South Sudan)		7	47	South Sudan	Jonglei	Bor South		Pariak	5.97684	31.66651	1	Sudan Tribune	Raiders from Murle ethnic group kill one man and steal an unverified number of cattle	1626	176SSD	78839	30/09/2012	2012	9	30	2	Violence against civilians	Yau Yau Rebels		2	Civilians (South Sudan)		7	27	South Sudan	Jonglei	Pibor		Pibor	6.79833	33.13028	2	Sudan Tribune	A chief from Thangnyang village of Gumuruk Payam is killed by Yau Yau rebels for not allowing youth to join them	1626	177SSD	78840	01/10/2012	2012	10	1	1	Violence against civilians	Murle Ethnic Militia (South Sudan)		4	Civilians (South Sudan)		7	47	South Sudan	Jonglei	Bor South		Pariak	5.97684	31.66651	2	Sudan Tribune	"Raiders, probably from Murle ethnic group, abduct a boy from Panwei village"	0626	178SSD	78841	04/10/2012	2012	10	4	1	Riots/Protests	Protesters (South Sudan)		6			0	60	South Sudan	Northern Bahr el Ghazal	Aweil West		Aweil	8.76670	27.40000	1	Sudan Tribune	Thousands stage peaceful demonstration accompanied by petition to South Sudan's President against categorisation and demilitarization of 14 Mile Area as buffer zone	0626	179SSD	78842	06/10/2012	2012	10	6	1	Battle-No change of territory	Military Forces of South Sudan (2011-)		1	Yau Yau Rebels		2	12	South Sudan	Jonglei	Pibor		Pibor	6.79833	33.13028	2	Sudan Tribune	South Sudanese forces repulse the attack of Yau Yau rebels in Gumuruk town	0626	180SSD	78843	11/10/2012	2012	10	11	1	Battle-No change of territory	Military Forces of South Sudan (2011-)		1	Unidentified Armed Group (South Sudan)		3	13	South Sudan	Central Equatoria	Juba		Juba	4.85170	31.58250	1	BBC Monitoring Africa	A senior SPLA soldier is shot dead by armed men at his house in Hai Ma'una of Juba	1626	181SSD	78844	11/10/2012	2012	10	11	1	Non-violent activity by a conflict actor	Police Forces of South Sudan (2011-)		1	Military Forces of South Sudan (2011-)		1	11	South Sudan	Central Equatoria	Juba		Juba	4.85170	31.58250	1	Sudan Tribune	Arrest of SPLA senior officer from Bilpham army's HQs over alleged links with rebels fighting the government	0626	182SSD	78845	12/10/2012	2012	10	12	1	Violence against civilians	Murle Ethnic Militia (South Sudan)		4	Civilians (South Sudan)		7	47	South Sudan	Jonglei	Bor South		Bor	6.20720	31.55920	2	Sudan Tribune	"Suspected Murle raiders attack Thian-wei village 5km from Anyidi, shoot two people dead and steal cattle"	2626	183SSD	78846	15/10/2012	2012	10	15	1	Riots/Protests	Police Forces of South Sudan (2011-)		1	Rioters (South Sudan)		5	15	South Sudan	Central Equatoria	Juba		Juba	4.85170	31.58250	1	Sudan Tribune	Police forces clash with angry demonstrators who protest in condemnation of Addis Ababa agreement	0626	184SSD	78847	15/10/2012	2012	10	15	1	Riots/Protests	Protesters (South Sudan)		6			0	60	South Sudan	Northern Bahr el Ghazal	Aweil West		Aweil	8.76670	27.40000	1	BBC Monitoring Middle East	Demonstrators denounce surrendering of territories declared demilitarized by Addis Ababa security agreements	0626	185SSD	78848	16/10/2012	2012	10	16	1	Battle-No change of territory	Police Forces of South Sudan (2011-)		1	Military Forces of South Sudan (2011-)	Murle Ethnic Group (South Sudan)	1	11	South Sudan	Lakes	Rumbek Centre		Rumbek	6.81837	29.68128	1	Sudan Tribune	An SPLA soldier from Murle ethnic group attacks police station in Rumbek killing one policewoman. The soldier is killed by police	2626	186SSD	78849	18/10/2012	2012	10	18	1	Non-violent activity by a conflict actor	Government of South Sudan (2011-)		1			0	10	South Sudan	Central Equatoria	Juba		Juba	4.85170	31.58250	1	Sudan Tribune	Foreign and national companies involved in oil industry are ordered to immediately resume production and exports through the territory of neighbouring Sudan	0626	188SSD	78851	19/10/2012	2012	10	19	1	Violence against civilians	Murle Ethnic Militia (South Sudan)		4	Civilians (South Sudan)	Military Forces of South Sudan (2011-)	7	47	South Sudan	Jonglei	Bor South		Bor	6.20720	31.55920	2	Sudan Tribune	One soldier is killed in an attempted raid at Weereh cattle camp east of Jale village	1626	187SSD	78850	19/10/2012	2012	10	19	1	Violence against civilians	Unidentified Armed Group (South Sudan)		3	Civilians (South Sudan)		7	37	South Sudan	Jonglei	Bor South		Bor	6.20720	31.55920	1	Sudan Tribune	"A woman who leaves Kolnyang village for Malual-Agor-Baar on the White Nile River side, about 13 Kilometers from Bor town along Bor-Juba road, is shot dead by unknown gunmen"	1626	189SSD	78852	19/10/2012	2012	10	19	1	Violence against civilians	Unidentified Ethnic Militia (South Sudan)		4	Civilians (South Sudan)		7	47	South Sudan	Jonglei	Bor South		Bor	6.20720	31.55920	3	Sudan Tribune	Three men going to inspect a dike in Nyuak Payam district are killed by gunmen in military uniforms	3626	190SSD	78853	22/10/2012	2012	10	22	1	Violence against civilians	Unidentified Armed Group (South Sudan)		3	Civilians (South Sudan)		7	37	South Sudan	Central Equatoria	Juba		Juba	4.85170	31.58250	1	Sudan Tribune	A defence lawyer from South Sudan Civil Society Alliance working on a legal case about an army general grabbing land is kidnapped by unknown armed men	0626	191SSD	78854	24/10/2012	2012	10	24	1	Violence against civilians	Murle Ethnic Militia (South Sudan)		4	Civilians (South Sudan)	Military Forces of South Sudan (2011-)	7	47	South Sudan	Jonglei	Akobo		Walgak	8.15917	32.23972	1	Sudan Tribune	Four people from Niew Niew village of Aboko county were attacked and injured by Murle armed men during an attempted raid	0626	192SSD	78855	26/10/2012	2012	10	26	1	Violence against civilians	Unidentified Armed Group (South Sudan)		3	Civilians (South Sudan)		7	37	South Sudan	Central Equatoria	Juba		Juba	4.85170	31.58250	1	Sudan Tribune	The lawyer of SSCSA is found. The kidnapping involved beating and interrogation by unidentified men about who was behind his actions	0626	193SSD	78856	29/10/2012	2012	10	29	1	Violence against civilians	Unidentified Armed Group (South Sudan)		3	Civilians (Sudan)		7	37	South Sudan	Jonglei	Bor South		Bor	6.20720	31.55920	3	Sudan Tribune	"An unidentified armed group, comprising of either Yau Yau rebels or of Murle ethnic militiamen, raid Baping village of Twic East county and wound one"	0626	194SSD	78857	30/10/2012	2012	10	30	1	Non-violent activity by a conflict actor	Military Forces of South Sudan (2011-)		1	Civilians (Sudan)		7	17	South Sudan	Jonglei	Pibor		Pibor	6.79833	33.13028	1	Sudan Tribune	South Sudan has stopped civilian disarmament operation in Pibor county while instructing the military to first clear area from rebels 	0626	195SSD	78858	02/11/2012	2012	11	2	1	Violence against civilians	Yau Yau Rebels		2	Civilians (Aid workers)		7	27	South Sudan	Jonglei	Pibor		Pibor	6.79833	33.13028	2	Sudan Tribune	"A South Sudanese man, former soldier and fighter of SPLA and current aid worker for the Plan International aid organisation in Jonglei State has been kidnapped and taken to Thiangnyang, a village to the east of Gumuruk town"	0626	196SSD	78859	04/11/2012	2012	11	4	1	Violence against civilians	Yau Yau Rebels		2	Civilians (Aid workers)		7	27	South Sudan	Jonglei	Pibor		Pibor	6.79833	33.13028	2	Sudan Tribune	The South Sudanese aid worker who was kidnapped on 02 November is killed by rebels after an assumed refusal of defection 	1626	197SSD	78860	06/11/2012	2012	11	6	1	Non-violent activity by a conflict actor	Government of South Sudan (2011-)		1	Government of Sudan (1989-)		8	18	South Sudan	Central Equatoria	Juba		Juba	4.85170	31.58250	1	Sudan Tribune	The Joint Political and Security Mechanism (JPSM) Meeting takes place in Juma between 06-08 November	0626	198SSD	78861	06/11/2012	2012	11	6	1	Battle-No change of territory	Panyon Communal Militia (South Sudan)	Dinka Ethnic Group (South Sudan)	4	Amothnhon Communal Militia (South Sudan)	Dinka Ethnic Group (South Sudan)	4	44	South Sudan	Lakes	Rumbek Centre		Rumbek	6.81837	29.68128	1	Sudan Tribune	"Inter-communal violence has killed 12 people and wounded 23, with the police and military firing against youth fighting "	12626	199SSD	78862	16/11/2012	2012	11	16	1	Violence against civilians	Unidentified Armed Group (South Sudan)		3	Civilians (South Sudan)	Police Forces of South Sudan (2011-)	7	37	South Sudan	Warrap	Tonj South		Tonj	7.27361	28.68222	1	Sudan Tribune	"A community police officer is shot dead by unknown armed men at a raid of 400 cattle in Manyangok payam, Warap state. The attackers are believed to be from neighbouring Cuibet county of Lakes State"	1626	200SSD	78863	19/11/2012	2012	11	19	1	Battle-No change of territory	Military Forces of South Sudan (2011-)		1	Yau Yau Rebels		2	12	South Sudan	Jonglei	Pibor		Pibor	6.79833	33.13028	1	Sudan Tribune;Miraya FM	Nineteen militias and one soldier die during clashes between Yau Yau rebels and SPLA forces	20626	201SSD	78864	19/11/2012	2012	11	19	1	Non-violent activity by a conflict actor	Yau Yau Rebels		2	UNMISS: United Nations Mission in the Republic of South Sudan		8	28	South Sudan	Jonglei	Pibor		Pibor	6.79833	33.13028	1	Sudan Tribune	A group of about 50 militias loyal to Yau Yau storm into a UN compound and request them to evacuate the area	0626	202SSD	78865	20/11/2012	2012	11	20	1	Remote violence	Military Forces of Sudan (1989-)		8	Civilians (South Sudan)		7	78	South Sudan	Northern Bahr el Ghazal	Aweil East		Ambaraba	9.58992	27.38986	2	Sudan Tribune	Sudanese forces bomb Kiir Adem of Bahr el Ghazal killing 7 civilians	7626	203SSD	78866	21/11/2012	2012	11	21	1	Remote violence	Military Forces of Sudan (1989-)		8	Civilians (South Sudan)		7	78	South Sudan	Northern Bahr el Ghazal	Aweil East		Ambaraba	9.58992	27.38986	2	Sudan Tribune	Sudanese forces bomb Kiir Adem of Bahr el Ghazal for second consecutive day	0626	204SSD	78867	21/11/2012	2012	11	21	1	Violence against civilians	Unidentified Armed Group (South Sudan)		3	Civilians (South Sudan)		7	37	South Sudan	Unity	Panyijiar		Panyijar	7.48809	30.35351	1	Sudan Tribune	A boy is abducted and 397 cattle stolen form Dhormanyang village of Payinjiar County. The suspects are believed to be from neighbouring Lake state	0626	205SSD	78868	22/11/2012	2012	11	22	1	Remote violence	Military Forces of Sudan (1989-)		8	Civilians (South Sudan)		7	78	South Sudan	Northern Bahr el Ghazal	Aweil East		Ambaraba	9.58992	27.38986	2	Sudan Tribune	Sudanese forces bomb Kiir Adem of Bahr el Ghazal for third consecutive day	0626	206SSD	78869	22/11/2012	2012	11	22	1	Non-violent activity by a conflict actor	Military Forces of Sudan (1989-)		8			0	80	South Sudan	Western Bahr el Ghazal	Raga		Raga	8.45955	25.67800	1	Sudan Tribune	Sudanese forces are massed near Raja with what is claimed as the intention of carry out ground attacks inside South Sudan	0626	207SSD	78870	24/11/2012	2012	11	24	1	Riots/Protests	Protesters (South Sudan)		6			0	60	South Sudan	Northern Bahr el Ghazal	Aweil West		Aweil	8.76670	27.40000	2	Sudan Tribune	Thousands protest against Sudanese aerial bombardments advocating for stronger action on behalf of South Sudanese government	0626	208SSD	78871	26/11/2012	2012	11	26	1	Non-violent activity by a conflict actor	Government of South Sudan (2011-)	UNDP: United Nations Development Programme	1			0	10	South Sudan	Central Equatoria	Juba		Juba	4.85170	31.58250	1	Sudan Tribune	"The second governor's forum begins, a four day event which brings together 10 state governors, members of legislature, key ministers and development partners"	0626	209SSD	78872	29/11/2012	2012	11	29	1	Violence against civilians	Murle Ethnic Militia (South Sudan)		4	Civilians (South Sudan)		7	47	South Sudan	Jonglei	Bor South		Bor	6.20720	31.55920	2	Sudan Tribune	Armed members of the Murle ethnic group attack Pamuom and Akoiria cattle camps at Alian village	9626	210SSD	78873	30/11/2012	2012	11	30	1	Violence against civilians	Dinka Ngok Ethnic Militia (Sudan)		4	Civilians (South Sudan)		7	47	South Sudan	Warrap	Tonj South		Tonj	7.28000	28.68000	1	Miraya FM; Sudan Tribune	"Cattle raiders who are members of the Gok branch of the Dinka tribe from Cueibet County attack 12 camps in Wunkeec in Tonj South County. More than 80 people, mostly civilians, are killed "	80626	212SSD	78875	01/12/2012	2012	12	1	1	Battle-No change of territory	Dinka Ngok Ethnic Militia (Sudan)		4	Dinka Rek Ethnic Militia (Sudan)		4	44	South Sudan	Warrap	Tonj South		Tonj	7.28000	28.68000	1	Miraya FM; Agence-France Presse	Youth from Wunkeec area track down and recover cattle belonging to 10 of the 12 looted camps while killing 22 Ngok militiamen. 9 Rek militiamen are also killed during the battle	31626	211SSD	78874	01/12/2012	2012	12	1	1	Violence against civilians	Unidentified Armed Group (South Sudan)		3	Civilians (South Sudan)		7	37	South Sudan	Lakes	Rumbek Centre		Rumbek	6.81837	29.68128	1	Sudan Tribune	"Two businessmen from Nuer of Unity State are killed when the car of a local MP is attacked in Pulkuc, located in the western part of Rumbek East County of Lakes state. The car was on its way for repair in Juba"	2626	213SSD	78876	02/12/2012	2012	12	2	1	Violence against civilians	Dinka Ngok Ethnic Militia (Sudan)		4	Civilians (South Sudan)		7	47	South Sudan	Warrap	Tonj South		Tonj	7.28000	28.68000	1	Miraya FM; Sudan Tribune	Cattle raiders attack Cueichok Boma camp setting the area on fire	0626	214SSD	78877	04/12/2012	2012	12	4	1	Violence against civilians	Military Forces of South Sudan (2011-)		1	Civilians (South Sudan)		7	17	South Sudan	Jonglei	Pibor		Pibor	6.79833	33.13028	1	Kenya Daily Nation; Reuters	South Sudan's army allegedly kills 14 civilians at Gumuruk village upon suspicion that they are followers of Yau Yau rebel group	14626	215SSD	78878	05/12/2012	2012	12	5	1	Violence against civilians	Unidentified Armed Group (South Sudan)		3	Civilians (South Sudan)	Journalists (South Sudan)	7	37	South Sudan	Central Equatoria	Juba		Juba	4.85170	31.58250	1	Sudan Tribune	South Sudanese political commentator is shot dead in front of his house in Juba by an unidentified armed group	1626	216SSD	78879	05/12/2012	2012	12	5	1	Violence against civilians	Unidentified Ethnic Militia (South Sudan)		4	Civilians (South Sudan)	Military Forces of South Sudan (2011-)	7	47	South Sudan	Lakes	Rumbek Centre		Rumbek	6.81837	29.68128	1	Sudan Tribune	"Youth from Payinjiar raid cows from the Manyang-Rel and Amonyping cattle camps, clashing with civilians and members of South Sudan's armed forces (SPLA), killing two and injuring four people."	2626	217SSD	78880	06/12/2012	2012	12	6	1	Violence against civilians	Unidentified Ethnic Militia (South Sudan)		4	Civilians (South Sudan)		7	47	South Sudan	Unity	Panyijiar		Panyijar	7.48809	30.35351	1	Sudan Tribune	"Raiders, alleged to come from Rumbek Central and Rumbek North in neighbouring Lakes State, attack camp near Mukar village, Panyijar county, killing 8 and injuring 10. "	11626	218SSD	78881	08/12/2012	2012	12	8	1	Riots/Protests	Police Forces of South Sudan (2011-)		1	Rioters (South Sudan)	Balanda Ethnic Group (South Sudan)	5	15	South Sudan	Western Bahr el Ghazal	Wau		Wau	7.70278	27.99528	1	Sudan Tribune	"Security forces kill rioters from Balanda Ethnic Group who violently protest against the relocation of the headquarters of Wau County in Bagari, 12 miles from its previous location"	4626	219SSD	78882	08/12/2012	2012	12	8	2	Violence against civilians	Unidentified Armed Group (South Sudan)		3	Civilians (South Sudan)	Dinka Ngok Ethnic Group (Sudan)	7	37	South Sudan	Western Bahr el Ghazal	Wau		Wau	7.70278	27.99528	2	Sudan Tribune; Agene France Presse	"Civilians from Dinka ethnic group are killed in Parajallah Locality of Bagari , 48 miles south of Wau. The motives and perpetrators of the killings remain unclear"	26626	220SSD	78883	09/12/2012	2012	12	9	1	Battle-No change of territory	Military Forces of South Sudan (2011-)		1	Military Forces of Sudan (1989-)		8	18	South Sudan	Northern Bahr el Ghazal	Aweil East		Ambaraba	9.58992	27.38986	2	Sudan Tribune	"The Sudanese Armed Forces launch a ground attack on the position of the SPLA forces in Kiir Adem, killing two soldiers and one civilian but they are repulsed"	3626	221SSD	78884	09/12/2012	2012	12	9	1	Riots/Protests	Police Forces of South Sudan (2011-)		1	Rioters (South Sudan)	Balanda Ethnic Group (South Sudan)	5	15	South Sudan	Western Bahr el Ghazal	Wau		Wau	7.70278	27.99528	1	Sudan Tribune	Security forces kill rioters from Balanda Ethnic Group who violently protest against the relocation of the headquarters of Wau County	5626	222SSD	78885	11/12/2012	2012	12	11	1	Riots/Protests	Protesters (South Sudan)		6			0	60	South Sudan	Jonglei	Bor South		Bor	6.20720	31.55920	1	Miraya FM	Hundreds stage a peaceful demonstration condemning killings in disarmed communities 	0626	223SSD	78886	15/12/2012	2012	12	15	1	Non-violent activity by a conflict actor	Ambororo Ethnic Militia (Sudan)		4			0	40	South Sudan	Unity	Panyijiar		Panyijar	7.48809	30.35351	2	Sudan Tribune	"The group of Ambororo herdsmen, who is heavily armed, enters Parieng County without properly notifying the local government"	0626	224SSD	78887	17/12/2012	2012	12	17	1	Riots/Protests	Police Forces of South Sudan (2011-)		1	Rioters (South Sudan)		5	15	South Sudan	Western Bahr el Ghazal	Wau		Wau	7.70278	27.99528	1	Agence France-Presse	"Police use force to break riots in Wau town. The clashes follow the killing last week by security forces of at least nine protesters during violent demonstrations in Wau, and the discovery this week of six bodies of people from the Dinka tribe."	12626	225SSD	78888	18/12/2012	2012	12	18	1	Battle-No change of territory	Police Forces of South Sudan (2011-)		1	Unidentified Ethnic Militia (South Sudan)		4	14	South Sudan	Western Bahr el Ghazal	Wau		Wau	7.70278	27.99528	1	Associated Press	Security forces clash with armed youth in Wau. Two are reported dead	2626	227SSD	78890	19/12/2012	2012	12	19	1	Violence against civilians	Murle Ethnic Militia (South Sudan)		4	Civilians (South Sudan)		7	47	South Sudan	Jonglei	Bor South		Bor	6.20720	31.55920	3	Sudan Tribune	A cattle raid takes place at Kiir Adhiok cattle camp 	0626	228SSD	78891	19/12/2012	2012	12	19	1	Violence against civilians	Murle Ethnic Militia (South Sudan)		4	Civilians (South Sudan)		7	47	South Sudan	Jonglei	Bor South		Bor	6.20720	31.55920	3	Sudan Tribune	A cattle raid takes place on Mission cattle camp in Kongoor Payam of Twic East County	1626	226SSD	78889	19/12/2012	2012	12	19	1	Battle-No change of territory	Police Forces of South Sudan (2011-)		1	Murle Ethnic Militia (South Sudan)		4	14	South Sudan	Jonglei	Bor South		Bor	6.20720	31.55920	3	Sudan Tribune	Twic east County's organized forces lay an ambush at Padingas as Murle raiders are crossing with stolen cattle. Three raiders die as a result	3626	229SSD	78892	21/12/2012	2012	12	21	1	Battle-No change of territory	Military Forces of South Sudan (2011-)		1	UNMISS: United Nations Mission in the Republic of South Sudan		8	18	South Sudan	Jonglei	Pibor		Pibor	6.79833	33.13028	1	Associated Press	The United Nations claim that South Sudan's armed forces have shot down a U.N. helicopter killing all four Russian crew members on board	4626	230SSD	78893	22/12/2012	2012	12	22	1	Non-violent activity by a conflict actor	Military Forces of South Sudan (2011-)		1	Police Forces of South Sudan (2011-)		1	11	South Sudan	Western Bahr el Ghazal	Wau		Wau	7.70278	27.99528	1	Sudan Tribune	"South Sudan's army arrests a number of police officers who are held responsible for the recent killing of civilians in the Western Bahr el Ghazal's capital, Wau. Allegedly the police personnel were wearing SPLA uniforms when they committed the crime"	0626	232SSD	78895	26/12/2012	2012	12	26	1	Remote violence	Civilians (South Sudan)		7	Military Forces of Sudan (1989-)		8	78	South Sudan	Northern Bahr el Ghazal	Aweil East		Ambaraba	9.58992	27.38986	2	Sudan Tribune; Associated Press	Sudanese air forces bomb Werguet village	5626	231SSD	78894	26/12/2012	2012	12	26	1	Remote violence	Military Forces of South Sudan (2011-)		1	Military Forces of Sudan (1989-)	Rizaygat Ethnic Militia (Sudan)	8	18	South Sudan	Northern Bahr el Ghazal	Aweil East		Ambaraba	9.58992	27.38986	2	Sudan Tribune; Associated Press	SPLA repulses attack by Sudanese air forces at Kiir Adem	0626	233SSD	78896	28/12/2012	2012	12	28	1	Battle-No change of territory	Military Forces of South Sudan (2011-)		1	Murle Ethnic Militia (South Sudan)		4	14	South Sudan	Jonglei	Bor South		Nyirol	6.20583	31.55611	2	Sudan Tribune	SPLA exchange gunfire with Murle cattle raiders	0626	234SSD	78897	28/12/2012	2012	12	28	1	Violence against civilians	Murle Ethnic Militia (South Sudan)		4	Civilians (South Sudan)		7	47	South Sudan	Jonglei	Bor South		Nyirol	6.20583	31.55611	2	Sudan Tribune	"Cattle raiders, suspected to be of the Murle tribe, kill two and wound two others in an attempted cattle raid on Nyirol County "	2626	235SSD	78898	28/12/2012	2012	12	28	1	Violence against civilians	Murle Ethnic Militia (South Sudan)		4	Civilians (South Sudan)		7	47	South Sudan	Northern Bahr el Ghazal	Aweil East		Mareng	8.94833	27.73889	1	Sudan Tribune	"Seven people are killed and two wounded in a raid in Mareng, the Duk county headquarters. The attack is suspected to have been carried out by Murle raiders"	7626	236SSD	78899	29/12/2012	2012	12	29	1	Battle-No change of territory	Military Forces of South Sudan (2011-)		1	Military Forces of Sudan (1989-)	Rizaygat Ethnic Militia (Sudan)	8	18	South Sudan	Western Bahr el Ghazal	Raga		Raga	8.45944	25.67778	2	Sudan Tribune	"SPLA clash with Sudanese army, PDF and Rizaygar militia in Sirmalaka area of Raja county"	0626	237SSD	78900	01/01/2013	2013	1	1	1	Violence against civilians	Murle Ethnic Militia (South Sudan)		4	Civilians (South Sudan)		7	47	South Sudan	Jonglei	Bor South		Bor	6.20720	31.55920	2	Sudan Tribune	"An attack in Kolnyang payam, 30km east of Bor, results in the killing of one"	1626	238SSD	78901	01/01/2013	2013	1	1	1	Violence against civilians	Murle Ethnic Militia (South Sudan)		4	Civilians (South Sudan)		7	47	South Sudan	Jonglei	Bor South		Bor	6.20720	31.55920	1	Sudan Tribune	An attack in Makuach Payam of Bor county results in the killing of three	3626	239SSD	78902	01/01/2013	2013	1	1	1	Violence against civilians	Unidentified Ethnic Militia (South Sudan)		4	Civilians (South Sudan)		7	47	South Sudan	Lakes	Rumbek Centre		Rumbek	6.80194	29.69111	2	Sudan Tribune	Cattle raiders attack Malou-pec area of Cueibet county. The attackers allegedly came from neighbouring Tonj South County of South Sudan's Warrap State	0626	240SSD	78903	02/01/2013	2013	1	2	1	Battle-No change of territory	Military Forces of South Sudan (2011-)		1	Military Forces of Sudan (1989-)		8	18	South Sudan	Western Bahr el Ghazal	Raga		Raga	8.45944	25.67778	2	Sudan Tribune	"SAF attack positions of the South Sudanese army (SPLA) in Kitkit, which is situated 119 kilometers north of Raja town. At least 32 civilians and soldiers are killed"	32626	241SSD	78904	03/01/2013	2013	1	3	1	Violence against civilians	Dinka Pakam Ethnic Militia (Sudan)		4	Civilians (South Sudan)		7	47	South Sudan	Lakes	Rumbek Centre		Rumbek	6.80194	29.69111	2	Sudan Tribune	A cattle raid by armed youth at Nhomtit cattle camp near Pagor payam  in Cueibet of Lakes State results in the killing of one. The raiders are suspected to be from the Pakam Dinka of Rumbek North County	1626	242SSD	78905	06/01/2013	2013	1	6	1	Violence against civilians	Police Forces of South Sudan (2011-)		1	Civilians (South Sudan)		7	17	South Sudan	Central Equatoria	Lainya		Kenyi	4.21528	30.92528	1	Bakhita FM	 Riot police deployed to Yei during inter-tribal clashes prior to Christmas loot some shops in Kenyi and Lainya payams [localities] on their way to Juba	0626	243SSD	78906	06/01/2013	2013	1	6	1	Violence against civilians	Unidentified Ethnic Militia (South Sudan)		4	Civilians (South Sudan)		7	47	South Sudan	Jonglei	Bor South		Bor	6.20720	31.55920	2	Sudan Tribune	"Close to 80,000 heads of cattle are raided from Pajut cattle camp in an attack not far from the border between Bor-Twice East counties in which two people are killed"	2626	244SSD	78907	08/01/2013	2013	1	8	1	Battle-No change of territory	Deer Clan Dinka Ethnic Militia (South Sudan)		4	Koch Clan Dinka Ethnic Militia (South Sudan)		4	44	South Sudan	Jonglei	Bor South		Bor	6.20720	31.55920	1	Sudan Tribune	Gun battle between members of the Deer and Koch clans in Makuach Payam of Bor. Two policemen are wounded as they try to intervene 	2626	245SSD	78908	10/01/2013	2013	1	10	1	Violence against civilians	Rumbek Area Militia (South Sudan)		4	Civilians (South Sudan)		7	47	South Sudan	Unity	Panyijiar		Bentiu	7.48809	30.35351	2	Miraya FM	"Three civilians are killed when gunmen ambush a vehicle transporting people from Panyijar County to Bentiu town, on the road between Mayom payam [district] of Payinjiar County and Madol junction of Mayiandit County. The gang is suspected to be from Rumbek North neighbouring Lakes State"	3626	246SSD	78909	11/01/2013	2013	1	11	1	Battle-No change of territory	Military Forces of South Sudan (2011-)		1	Gok Dinka Ethnic Militia (South Sudan)		4	14	South Sudan	Lakes	Rumbek Centre		Rumbek	6.80194	29.69111	2	Sudan Tribune	"Gok Dinka youth violently resist to handover cattle stolen in June last year from Warrap state to soldiers at Malul-chum cattle camp in Tiap Tiap payam, resulting in the death of seven soldiers and three civilians "	10626	247SSD	78910	13/01/2013	2013	1	13	1	Non-violent activity by a conflict actor	Police Forces of South Sudan (2011-)		1	SPLM Youth League		3	13	South Sudan	Northern Bahr el Ghazal	Aweil West		Aweil	8.76816	27.40019	1	Sudan Tribune	The leader of the youth wing of SPLM is arrested while on his way home from Aweil where he was holding a youth meeting. His arrest is claimed to be a product of failing to relax his campaign against the inclusion of a key border area in the Safe Demilitarized Buffer Zone 	0626	248SSD	78911	14/01/2013	2013	1	14	1	Riots/Protests	Protesters (South Sudan)		6			0	60	South Sudan	Western Bahr el Ghazal	Wau		Wau	7.70278	27.99528	1	Sudan Tribune	"Thousands of peaceful demonstrators  take to the streets of Wau to strongly condemn a ground and air attack allegedly launched by Sudanese Armed Forces in Kitkit, 119 kilometer north of its Raja County"	0626	249SSD	78912	16/01/2013	2013	1	16	1	Battle-No change of territory	Panyon Communal Militia (South Sudan)		4	Amothnhon Communal Militia (South Sudan)		4	44	South Sudan	Lakes	Rumbek Centre		Rumbek	6.80194	29.69111	1	Sudan Tribune	"Inter-clan clashes reignite on Lakes State on  at a cattle camp between Marial-bek and Ghun 15km NE of Rumbek, between sections of the Dinka ethnic group"	10626	251SSD	78914	18/01/2013	2013	1	18	1	Non-violent activity by a conflict actor	Government of South Sudan (2011-)		1			0	10	South Sudan	Warrap	Twic		Turalei	9.08582	28.42701	3	News Agency of South Sudan	The government of